src/acc/libsmm_acc/parameters/parameters_A100.json
[
{"m": 4, "n": 4, "k": 4, "tile_m": 1, "tile_n": 1, "threads": 32, "grouping": 7, "minblocks": 4, "algorithm": "medium", "perf": 366.312, "source": "autotuned"},
{"m": 4, "n": 4, "k": 5, "tile_m": 2, "tile_n": 1, "threads": 32, "grouping": 8, "minblocks": 1, "algorithm": "medium", "perf": 447.452, "source": "autotuned"},
{"m": 4, "n": 4, "k": 6, "tile_m": 1, "tile_n": 1, "threads": 32, "grouping": 8, "minblocks": 5, "algorithm": "medium", "perf": 538.61, "source": "autotuned"},
{"m": 4, "n": 4, "k": 7, "tile_m": 1, "tile_n": 1, "threads": 32, "grouping": 7, "minblocks": 20, "algorithm": "medium", "perf": 603.713, "source": "autotuned"},
{"m": 4, "n": 4, "k": 8, "threads": 32, "grouping": 6, "minblocks": 1, "algorithm": "tiny", "perf": 671.127, "source": "autotuned"},
{"m": 4, "n": 4, "k": 9, "tile_m": 1, "tile_n": 1, "threads": 64, "grouping": 9, "minblocks": 12, "algorithm": "medium", "perf": 671.175, "source": "autotuned"},
{"m": 4, "n": 4, "k": 10, "tile_m": 1, "tile_n": 1, "threads": 64, "grouping": 9, "minblocks": 1, "algorithm": "medium", "perf": 720.904, "source": "autotuned"},
{"m": 4, "n": 4, "k": 13, "tile_m": 1, "tile_n": 1, "threads": 64, "grouping": 4, "minblocks": 25, "algorithm": "medium", "perf": 876.063, "source": "autotuned"},
{"m": 4, "n": 4, "k": 15, "threads": 32, "grouping": 4, "minblocks": 1, "algorithm": "tiny", "perf": 986.012, "source": "autotuned"},
{"m": 4, "n": 4, "k": 16, "threads": 32, "grouping": 4, "minblocks": 1, "algorithm": "tiny", "perf": 1025.09, "source": "autotuned"},
{"m": 4, "n": 4, "k": 22, "tile_m": 1, "tile_n": 1, "threads": 32, "grouping": 3, "minblocks": 19, "algorithm": "small", "perf": 1213.34, "source": "autotuned"},
{"m": 4, "n": 4, "k": 23, "tile_m": 1, "tile_n": 1, "threads": 32, "grouping": 2, "minblocks": 1, "algorithm": "small", "perf": 1262.76, "source": "autotuned"},
{"m": 4, "n": 4, "k": 25, "tile_m": 1, "tile_n": 1, "threads": 64, "grouping": 2, "minblocks": 1, "algorithm": "small", "perf": 1139.12, "source": "autotuned"},
{"m": 4, "n": 4, "k": 26, "tile_m": 1, "tile_n": 1, "threads": 96, "grouping": 8, "minblocks": 21, "algorithm": "small", "perf": 1178.95, "source": "autotuned"},
{"m": 4, "n": 4, "k": 28, "tile_m": 1, "tile_n": 1, "threads": 32, "grouping": 2, "minblocks": 1, "algorithm": "small", "perf": 1234.29, "source": "autotuned"},
{"m": 4, "n": 4, "k": 32, "tile_m": 1, "tile_n": 1, "threads": 32, "grouping": 2, "minblocks": 1, "algorithm": "small", "perf": 1464.19, "source": "autotuned"},
{"m": 4, "n": 4, "k": 45, "tile_m": 1, "tile_n": 1, "threads": 32, "grouping": 2, "minblocks": 16, "algorithm": "medium", "perf": 1420.4, "source": "autotuned"},
{"m": 4, "n": 5, "k": 4, "tile_m": 1, "tile_n": 1, "threads": 32, "grouping": 8, "minblocks": 13, "algorithm": "medium", "perf": 460.712, "source": "autotuned"},
{"m": 4, "n": 5, "k": 5, "tile_m": 2, "tile_n": 1, "threads": 32, "grouping": 8, "minblocks": 17, "algorithm": "medium", "perf": 558.584, "source": "autotuned"},
{"m": 4, "n": 5, "k": 6, "tile_m": 2, "tile_n": 1, "threads": 32, "grouping": 8, "minblocks": 8, "algorithm": "medium", "perf": 649.594, "source": "autotuned"},
{"m": 4, "n": 5, "k": 7, "tile_m": 1, "tile_n": 1, "threads": 64, "grouping": 9, "minblocks": 8, "algorithm": "medium", "perf": 680.195, "source": "autotuned"},
{"m": 4, "n": 5, "k": 8, "tile_m": 1, "tile_n": 1, "threads": 64, "grouping": 9, "minblocks": 13, "algorithm": "medium", "perf": 754.633, "source": "autotuned"},
{"m": 4, "n": 5, "k": 9, "tile_m": 1, "tile_n": 1, "threads": 64, "grouping": 9, "minblocks": 26, "algorithm": "medium", "perf": 830.418, "source": "autotuned"},
{"m": 4, "n": 5, "k": 10, "tile_m": 1, "tile_n": 1, "threads": 64, "grouping": 9, "minblocks": 14, "algorithm": "medium", "perf": 876.289, "source": "autotuned"},
{"m": 4, "n": 5, "k": 13, "tile_m": 2, "tile_n": 1, "threads": 96, "grouping": 8, "minblocks": 16, "algorithm": "medium", "perf": 1013.39, "source": "autotuned"},
{"m": 4, "n": 5, "k": 15, "tile_m": 2, "tile_n": 1, "threads": 96, "grouping": 8, "minblocks": 15, "algorithm": "medium", "perf": 1132.43, "source": "autotuned"},
{"m": 4, "n": 5, "k": 16, "tile_m": 2, "tile_n": 1, "threads": 96, "grouping": 8, "minblocks": 15, "algorithm": "medium", "perf": 1192.46, "source": "autotuned"},
{"m": 4, "n": 5, "k": 22, "tile_m": 2, "tile_n": 1, "threads": 128, "grouping": 8, "minblocks": 16, "algorithm": "medium", "perf": 1308.13, "source": "autotuned"},
{"m": 4, "n": 5, "k": 23, "tile_m": 2, "tile_n": 1, "threads": 128, "grouping": 8, "minblocks": 16, "algorithm": "medium", "perf": 1322.25, "source": "autotuned"},
{"m": 4, "n": 5, "k": 25, "tile_m": 2, "tile_n": 1, "threads": 128, "grouping": 8, "minblocks": 15, "algorithm": "medium", "perf": 1383.33, "source": "autotuned"},
{"m": 4, "n": 5, "k": 26, "tile_m": 1, "tile_n": 1, "threads": 160, "grouping": 11, "minblocks": 11, "algorithm": "medium", "perf": 1287.4, "source": "autotuned"},
{"m": 4, "n": 5, "k": 28, "tile_m": 2, "tile_n": 1, "threads": 32, "grouping": 5, "minblocks": 27, "algorithm": "medium", "perf": 1349.82, "source": "autotuned"},
{"m": 4, "n": 5, "k": 32, "tile_m": 2, "tile_n": 1, "threads": 32, "grouping": 8, "minblocks": 23, "algorithm": "medium", "perf": 1417.03, "source": "autotuned"},
{"m": 4, "n": 5, "k": 45, "tile_m": 2, "tile_n": 1, "threads": 32, "grouping": 8, "minblocks": 18, "algorithm": "medium", "perf": 1562.57, "source": "autotuned"},
{"m": 4, "n": 6, "k": 4, "tile_m": 1, "tile_n": 1, "threads": 32, "grouping": 8, "minblocks": 3, "algorithm": "medium", "perf": 545.244, "source": "autotuned"},
{"m": 4, "n": 6, "k": 5, "tile_m": 1, "tile_n": 1, "threads": 32, "grouping": 8, "minblocks": 7, "algorithm": "medium", "perf": 672.298, "source": "autotuned"},
{"m": 4, "n": 6, "k": 6, "tile_m": 1, "tile_n": 1, "threads": 64, "grouping": 9, "minblocks": 1, "algorithm": "medium", "perf": 726.476, "source": "autotuned"},
{"m": 4, "n": 6, "k": 7, "tile_m": 1, "tile_n": 1, "threads": 64, "grouping": 9, "minblocks": 10, "algorithm": "medium", "perf": 822.207, "source": "autotuned"},
{"m": 4, "n": 6, "k": 8, "tile_m": 1, "tile_n": 1, "threads": 64, "grouping": 8, "minblocks": 25, "algorithm": "medium", "perf": 894.647, "source": "autotuned"},
{"m": 4, "n": 6, "k": 9, "tile_m": 1, "tile_n": 1, "threads": 64, "grouping": 9, "minblocks": 8, "algorithm": "medium", "perf": 972.125, "source": "autotuned"},
{"m": 4, "n": 6, "k": 10, "tile_m": 1, "tile_n": 1, "threads": 64, "grouping": 11, "minblocks": 7, "algorithm": "medium", "perf": 1045.03, "source": "autotuned"},
{"m": 4, "n": 6, "k": 13, "tile_m": 2, "tile_n": 1, "threads": 96, "grouping": 8, "minblocks": 16, "algorithm": "medium", "perf": 1212.97, "source": "autotuned"},
{"m": 4, "n": 6, "k": 15, "tile_m": 2, "tile_n": 1, "threads": 96, "grouping": 8, "minblocks": 15, "algorithm": "medium", "perf": 1343.56, "source": "autotuned"},
{"m": 4, "n": 6, "k": 22, "tile_m": 2, "tile_n": 1, "threads": 32, "grouping": 5, "minblocks": 25, "algorithm": "medium", "perf": 1423.63, "source": "autotuned"},
{"m": 4, "n": 6, "k": 26, "tile_m": 1, "tile_n": 1, "threads": 160, "grouping": 11, "minblocks": 11, "algorithm": "medium", "perf": 1526.71, "source": "autotuned"},
{"m": 4, "n": 6, "k": 32, "tile_m": 2, "tile_n": 1, "threads": 32, "grouping": 8, "minblocks": 5, "algorithm": "medium", "perf": 1674.41, "source": "autotuned"},
{"m": 4, "n": 6, "k": 45, "tile_m": 2, "tile_n": 1, "w": 16, "v": 6, "threads": 32, "grouping": 16, "minblocks": 2, "algorithm": "largeDB2", "perf": 1974.69, "source": "autotuned"},
{"m": 4, "n": 7, "k": 4, "tile_m": 2, "tile_n": 1, "threads": 32, "grouping": 8, "minblocks": 15, "algorithm": "medium", "perf": 648.412, "source": "autotuned"},
{"m": 4, "n": 7, "k": 5, "tile_m": 1, "tile_n": 1, "threads": 64, "grouping": 8, "minblocks": 8, "algorithm": "medium", "perf": 724.14, "source": "autotuned"},
{"m": 4, "n": 7, "k": 6, "tile_m": 1, "tile_n": 1, "threads": 64, "grouping": 8, "minblocks": 8, "algorithm": "medium", "perf": 872.388, "source": "autotuned"},
{"m": 4, "n": 7, "k": 7, "tile_m": 1, "tile_n": 1, "threads": 64, "grouping": 9, "minblocks": 2, "algorithm": "medium", "perf": 943.682, "source": "autotuned"},
{"m": 4, "n": 7, "k": 8, "tile_m": 1, "tile_n": 1, "threads": 64, "grouping": 9, "minblocks": 24, "algorithm": "medium", "perf": 1046.88, "source": "autotuned"},
{"m": 4, "n": 7, "k": 9, "tile_m": 1, "tile_n": 1, "threads": 64, "grouping": 8, "minblocks": 8, "algorithm": "medium", "perf": 1129.98, "source": "autotuned"},
{"m": 4, "n": 7, "k": 10, "tile_m": 2, "tile_n": 1, "threads": 96, "grouping": 8, "minblocks": 16, "algorithm": "medium", "perf": 1167.81, "source": "autotuned"},
{"m": 4, "n": 7, "k": 13, "tile_m": 2, "tile_n": 1, "threads": 96, "grouping": 8, "minblocks": 15, "algorithm": "medium", "perf": 1384.31, "source": "autotuned"},
{"m": 4, "n": 7, "k": 15, "tile_m": 2, "tile_n": 1, "threads": 128, "grouping": 8, "minblocks": 15, "algorithm": "medium", "perf": 1397.55, "source": "autotuned"},
{"m": 4, "n": 7, "k": 22, "tile_m": 2, "tile_n": 1, "threads": 32, "grouping": 5, "minblocks": 25, "algorithm": "medium", "perf": 1629.49, "source": "autotuned"},
{"m": 4, "n": 7, "k": 25, "tile_m": 2, "tile_n": 1, "threads": 32, "grouping": 5, "minblocks": 27, "algorithm": "medium", "perf": 1693.03, "source": "autotuned"},
{"m": 4, "n": 7, "k": 26, "tile_m": 2, "tile_n": 1, "threads": 32, "grouping": 5, "minblocks": 27, "algorithm": "medium", "perf": 1703.57, "source": "autotuned"},
{"m": 4, "n": 7, "k": 28, "tile_m": 2, "tile_n": 1, "threads": 32, "grouping": 5, "minblocks": 25, "algorithm": "medium", "perf": 1768.44, "source": "autotuned"},
{"m": 4, "n": 7, "k": 32, "tile_m": 2, "tile_n": 1, "threads": 32, "grouping": 8, "minblocks": 2, "algorithm": "medium", "perf": 1884.46, "source": "autotuned"},
{"m": 4, "n": 7, "k": 45, "tile_m": 2, "tile_n": 1, "w": 16, "v": 4, "threads": 32, "grouping": 16, "minblocks": 8, "algorithm": "largeDB2", "perf": 2084.06, "source": "autotuned"},
{"m": 4, "n": 8, "k": 4, "tile_m": 1, "tile_n": 1, "threads": 32, "grouping": 6, "minblocks": 16, "algorithm": "medium", "perf": 604.227, "source": "autotuned"},
{"m": 4, "n": 8, "k": 5, "tile_m": 1, "tile_n": 1, "threads": 64, "grouping": 9, "minblocks": 3, "algorithm": "medium", "perf": 834.318, "source": "autotuned"},
{"m": 4, "n": 8, "k": 6, "tile_m": 1, "tile_n": 1, "threads": 64, "grouping": 6, "minblocks": 16, "algorithm": "medium", "perf": 983.062, "source": "autotuned"},
{"m": 4, "n": 8, "k": 7, "tile_m": 1, "tile_n": 1, "threads": 64, "grouping": 6, "minblocks": 16, "algorithm": "medium", "perf": 1105.87, "source": "autotuned"},
{"m": 4, "n": 8, "k": 8, "tile_m": 1, "tile_n": 1, "threads": 64, "grouping": 6, "minblocks": 8, "algorithm": "small", "perf": 1027.83, "source": "autotuned"},
{"m": 4, "n": 8, "k": 9, "tile_m": 1, "tile_n": 1, "threads": 96, "grouping": 8, "minblocks": 19, "algorithm": "medium", "perf": 1228.47, "source": "autotuned"},
{"m": 4, "n": 8, "k": 10, "tile_m": 2, "tile_n": 1, "threads": 96, "grouping": 8, "minblocks": 16, "algorithm": "medium", "perf": 1336.03, "source": "autotuned"},
{"m": 4, "n": 8, "k": 13, "tile_m": 2, "tile_n": 1, "threads": 128, "grouping": 8, "minblocks": 14, "algorithm": "medium", "perf": 1459.42, "source": "autotuned"},
{"m": 4, "n": 8, "k": 15, "tile_m": 2, "tile_n": 1, "threads": 128, "grouping": 8, "minblocks": 14, "algorithm": "medium", "perf": 1610.83, "source": "autotuned"},
{"m": 4, "n": 8, "k": 22, "tile_m": 2, "tile_n": 1, "threads": 32, "grouping": 5, "minblocks": 27, "algorithm": "medium", "perf": 1823.29, "source": "autotuned"},
{"m": 4, "n": 8, "k": 26, "tile_m": 2, "tile_n": 1, "threads": 32, "grouping": 5, "minblocks": 25, "algorithm": "medium", "perf": 1911.19, "source": "autotuned"},
{"m": 4, "n": 8, "k": 32, "tile_m": 2, "tile_n": 1, "threads": 32, "grouping": 8, "minblocks": 16, "algorithm": "medium", "perf": 2153.82, "source": "autotuned"},
{"m": 4, "n": 8, "k": 45, "tile_m": 2, "tile_n": 1, "threads": 32, "grouping": 8, "minblocks": 12, "algorithm": "medium", "perf": 2288.7, "source": "autotuned"},
{"m": 4, "n": 9, "k": 4, "tile_m": 2, "tile_n": 1, "threads": 64, "grouping": 9, "minblocks": 3, "algorithm": "medium", "perf": 739.045, "source": "autotuned"},
{"m": 4, "n": 9, "k": 5, "tile_m": 2, "tile_n": 1, "threads": 64, "grouping": 9, "minblocks": 8, "algorithm": "medium", "perf": 891.176, "source": "autotuned"},
{"m": 4, "n": 9, "k": 6, "tile_m": 2, "tile_n": 1, "threads": 64, "grouping": 9, "minblocks": 11, "algorithm": "medium", "perf": 1032.86, "source": "autotuned"},
{"m": 4, "n": 9, "k": 7, "tile_m": 2, "tile_n": 1, "threads": 64, "grouping": 9, "minblocks": 4, "algorithm": "medium", "perf": 1165.49, "source": "autotuned"},
{"m": 4, "n": 9, "k": 8, "tile_m": 2, "tile_n": 1, "threads": 96, "grouping": 12, "minblocks": 9, "algorithm": "medium", "perf": 1195.62, "source": "autotuned"},
{"m": 4, "n": 9, "k": 9, "tile_m": 2, "tile_n": 1, "threads": 96, "grouping": 8, "minblocks": 16, "algorithm": "medium", "perf": 1302.71, "source": "autotuned"},
{"m": 4, "n": 9, "k": 10, "tile_m": 2, "tile_n": 1, "threads": 96, "grouping": 8, "minblocks": 14, "algorithm": "medium", "perf": 1415.63, "source": "autotuned"},
{"m": 4, "n": 9, "k": 13, "tile_m": 2, "tile_n": 1, "threads": 128, "grouping": 8, "minblocks": 13, "algorithm": "medium", "perf": 1536.65, "source": "autotuned"},
{"m": 4, "n": 9, "k": 15, "tile_m": 2, "tile_n": 1, "threads": 32, "grouping": 5, "minblocks": 27, "algorithm": "medium", "perf": 1578.04, "source": "autotuned"},
{"m": 4, "n": 9, "k": 16, "tile_m": 2, "tile_n": 1, "threads": 32, "grouping": 5, "minblocks": 27, "algorithm": "medium", "perf": 1640.87, "source": "autotuned"},
{"m": 4, "n": 9, "k": 22, "tile_m": 2, "tile_n": 1, "threads": 96, "grouping": 8, "minblocks": 16, "algorithm": "medium", "perf": 1875.29, "source": "autotuned"},
{"m": 4, "n": 9, "k": 23, "tile_m": 2, "tile_n": 1, "threads": 96, "grouping": 8, "minblocks": 20, "algorithm": "medium", "perf": 1925.29, "source": "autotuned"},
{"m": 4, "n": 9, "k": 25, "tile_m": 2, "tile_n": 1, "threads": 32, "grouping": 8, "minblocks": 21, "algorithm": "medium", "perf": 1918.95, "source": "autotuned"},
{"m": 4, "n": 9, "k": 26, "tile_m": 2, "tile_n": 1, "threads": 32, "grouping": 8, "minblocks": 17, "algorithm": "medium", "perf": 1948.11, "source": "autotuned"},
{"m": 4, "n": 9, "k": 28, "tile_m": 2, "tile_n": 1, "w": 12, "v": 6, "threads": 32, "grouping": 16, "minblocks": 1, "algorithm": "largeDB2", "perf": 2074.72, "source": "autotuned"},
{"m": 4, "n": 9, "k": 32, "tile_m": 2, "tile_n": 1, "threads": 32, "grouping": 8, "minblocks": 14, "algorithm": "medium", "perf": 2214.8, "source": "autotuned"},
{"m": 4, "n": 9, "k": 45, "tile_m": 2, "tile_n": 1, "threads": 32, "grouping": 8, "minblocks": 2, "algorithm": "medium", "perf": 2275.99, "source": "autotuned"},
{"m": 4, "n": 10, "k": 4, "tile_m": 2, "tile_n": 1, "threads": 64, "grouping": 8, "minblocks": 4, "algorithm": "medium", "perf": 830.82, "source": "autotuned"},
{"m": 4, "n": 10, "k": 5, "tile_m": 2, "tile_n": 1, "threads": 64, "grouping": 9, "minblocks": 4, "algorithm": "medium", "perf": 992.469, "source": "autotuned"},
{"m": 4, "n": 10, "k": 6, "tile_m": 2, "tile_n": 1, "threads": 64, "grouping": 9, "minblocks": 4, "algorithm": "medium", "perf": 1151.55, "source": "autotuned"},
{"m": 4, "n": 10, "k": 7, "tile_m": 2, "tile_n": 1, "threads": 96, "grouping": 8, "minblocks": 16, "algorithm": "medium", "perf": 1207.63, "source": "autotuned"},
{"m": 4, "n": 10, "k": 8, "tile_m": 2, "tile_n": 1, "threads": 96, "grouping": 8, "minblocks": 15, "algorithm": "medium", "perf": 1352.68, "source": "autotuned"},
{"m": 4, "n": 10, "k": 9, "tile_m": 2, "tile_n": 1, "threads": 96, "grouping": 8, "minblocks": 14, "algorithm": "medium", "perf": 1435.22, "source": "autotuned"},
{"m": 4, "n": 10, "k": 10, "tile_m": 2, "tile_n": 1, "threads": 128, "grouping": 8, "minblocks": 16, "algorithm": "medium", "perf": 1435.47, "source": "autotuned"},
{"m": 4, "n": 10, "k": 13, "tile_m": 2, "tile_n": 1, "threads": 32, "grouping": 5, "minblocks": 27, "algorithm": "medium", "perf": 1575.26, "source": "autotuned"},
{"m": 4, "n": 10, "k": 15, "tile_m": 2, "tile_n": 1, "threads": 64, "grouping": 9, "minblocks": 19, "algorithm": "medium", "perf": 1749.82, "source": "autotuned"},
{"m": 4, "n": 10, "k": 22, "tile_m": 2, "tile_n": 1, "threads": 96, "grouping": 8, "minblocks": 16, "algorithm": "medium", "perf": 2066.03, "source": "autotuned"},
{"m": 4, "n": 10, "k": 26, "tile_m": 2, "tile_n": 1, "w": 10, "v": 10, "threads": 32, "grouping": 16, "minblocks": 4, "algorithm": "largeDB2", "perf": 2220.15, "source": "autotuned"},
{"m": 4, "n": 10, "k": 32, "tile_m": 2, "tile_n": 1, "w": 12, "v": 10, "threads": 32, "grouping": 16, "minblocks": 8, "algorithm": "largeDB2", "perf": 2472.88, "source": "autotuned"},
{"m": 4, "n": 10, "k": 45, "tile_m": 2, "tile_n": 1, "threads": 32, "grouping": 8, "minblocks": 2, "algorithm": "medium", "perf": 2425.54, "source": "autotuned"},
{"m": 4, "n": 13, "k": 4, "tile_m": 2, "tile_n": 1, "threads": 64, "grouping": 9, "minblocks": 7, "algorithm": "medium", "perf": 1074.72, "source": "autotuned"},
{"m": 4, "n": 13, "k": 5, "tile_m": 2, "tile_n": 1, "threads": 96, "grouping": 8, "minblocks": 16, "algorithm": "medium", "perf": 1177.95, "source": "autotuned"},
{"m": 4, "n": 13, "k": 6, "tile_m": 2, "tile_n": 1, "threads": 96, "grouping": 8, "minblocks": 16, "algorithm": "medium", "perf": 1370.95, "source": "autotuned"},
{"m": 4, "n": 13, "k": 7, "tile_m": 2, "tile_n": 1, "threads": 96, "grouping": 8, "minblocks": 14, "algorithm": "medium", "perf": 1523.86, "source": "autotuned"},
{"m": 4, "n": 13, "k": 8, "tile_m": 2, "tile_n": 1, "threads": 128, "grouping": 8, "minblocks": 16, "algorithm": "medium", "perf": 1550.22, "source": "autotuned"},
{"m": 4, "n": 13, "k": 9, "tile_m": 2, "tile_n": 1, "threads": 128, "grouping": 9, "minblocks": 14, "algorithm": "medium", "perf": 1656.7, "source": "autotuned"},
{"m": 4, "n": 13, "k": 10, "tile_m": 2, "tile_n": 1, "threads": 64, "grouping": 9, "minblocks": 7, "algorithm": "medium", "perf": 1680.2, "source": "autotuned"},
{"m": 4, "n": 13, "k": 13, "tile_m": 2, "tile_n": 1, "threads": 64, "grouping": 9, "minblocks": 16, "algorithm": "medium", "perf": 2022.9, "source": "autotuned"},
{"m": 4, "n": 13, "k": 15, "tile_m": 2, "tile_n": 1, "threads": 64, "grouping": 9, "minblocks": 19, "algorithm": "medium", "perf": 2098.13, "source": "autotuned"},
{"m": 4, "n": 13, "k": 16, "tile_m": 2, "tile_n": 1, "threads": 96, "grouping": 8, "minblocks": 18, "algorithm": "medium", "perf": 2170.36, "source": "autotuned"},
{"m": 4, "n": 13, "k": 22, "tile_m": 2, "tile_n": 1, "threads": 96, "grouping": 8, "minblocks": 16, "algorithm": "medium", "perf": 2607.33, "source": "autotuned"},
{"m": 4, "n": 13, "k": 23, "tile_m": 2, "tile_n": 1, "threads": 32, "grouping": 8, "minblocks": 20, "algorithm": "medium", "perf": 2535.23, "source": "autotuned"},
{"m": 4, "n": 13, "k": 25, "tile_m": 2, "tile_n": 1, "threads": 32, "grouping": 8, "minblocks": 18, "algorithm": "medium", "perf": 2584.16, "source": "autotuned"},
{"m": 4, "n": 13, "k": 26, "tile_m": 2, "tile_n": 1, "threads": 32, "grouping": 8, "minblocks": 5, "algorithm": "medium", "perf": 2641.45, "source": "autotuned"},
{"m": 4, "n": 13, "k": 28, "tile_m": 2, "tile_n": 1, "threads": 32, "grouping": 8, "minblocks": 13, "algorithm": "medium", "perf": 2706.54, "source": "autotuned"},
{"m": 4, "n": 13, "k": 32, "tile_m": 2, "tile_n": 1, "threads": 32, "grouping": 8, "minblocks": 10, "algorithm": "medium", "perf": 2872.69, "source": "autotuned"},
{"m": 4, "n": 13, "k": 45, "tile_m": 2, "tile_n": 1, "threads": 32, "grouping": 8, "minblocks": 10, "algorithm": "medium", "perf": 3068.6, "source": "autotuned"},
{"m": 4, "n": 15, "k": 4, "tile_m": 2, "tile_n": 1, "threads": 64, "grouping": 9, "minblocks": 1, "algorithm": "medium", "perf": 1232.0, "source": "autotuned"},
{"m": 4, "n": 15, "k": 5, "tile_m": 2, "tile_n": 1, "threads": 96, "grouping": 8, "minblocks": 16, "algorithm": "medium", "perf": 1349.85, "source": "autotuned"},
{"m": 4, "n": 15, "k": 6, "tile_m": 2, "tile_n": 1, "threads": 96, "grouping": 8, "minblocks": 14, "algorithm": "medium", "perf": 1568.31, "source": "autotuned"},
{"m": 4, "n": 15, "k": 7, "tile_m": 2, "tile_n": 1, "threads": 32, "grouping": 6, "minblocks": 23, "algorithm": "medium", "perf": 1650.48, "source": "autotuned"},
{"m": 4, "n": 15, "k": 8, "tile_m": 2, "tile_n": 1, "threads": 128, "grouping": 8, "minblocks": 15, "algorithm": "medium", "perf": 1791.86, "source": "autotuned"},
{"m": 4, "n": 15, "k": 9, "tile_m": 2, "tile_n": 1, "threads": 64, "grouping": 9, "minblocks": 4, "algorithm": "medium", "perf": 1791.99, "source": "autotuned"},
{"m": 4, "n": 15, "k": 10, "tile_m": 2, "tile_n": 1, "threads": 64, "grouping": 9, "minblocks": 13, "algorithm": "medium", "perf": 1918.45, "source": "autotuned"},
{"m": 4, "n": 15, "k": 13, "tile_m": 2, "tile_n": 1, "threads": 64, "grouping": 9, "minblocks": 19, "algorithm": "medium", "perf": 2174.9, "source": "autotuned"},
{"m": 4, "n": 15, "k": 15, "tile_m": 2, "tile_n": 1, "threads": 64, "grouping": 9, "minblocks": 20, "algorithm": "medium", "perf": 2384.61, "source": "autotuned"},
{"m": 4, "n": 15, "k": 16, "tile_m": 2, "tile_n": 1, "threads": 96, "grouping": 8, "minblocks": 15, "algorithm": "medium", "perf": 2479.42, "source": "autotuned"},
{"m": 4, "n": 15, "k": 22, "tile_m": 2, "tile_n": 1, "threads": 32, "grouping": 8, "minblocks": 17, "algorithm": "medium", "perf": 2792.23, "source": "autotuned"},
{"m": 4, "n": 15, "k": 25, "tile_m": 2, "tile_n": 1, "w": 10, "v": 8, "threads": 32, "grouping": 16, "minblocks": 2, "algorithm": "largeDB2", "perf": 2864.86, "source": "autotuned"},
{"m": 4, "n": 15, "k": 26, "tile_m": 2, "tile_n": 1, "threads": 32, "grouping": 8, "minblocks": 6, "algorithm": "medium", "perf": 2900.53, "source": "autotuned"},
{"m": 4, "n": 15, "k": 45, "tile_m": 2, "tile_n": 1, "threads": 32, "grouping": 8, "minblocks": 4, "algorithm": "medium", "perf": 3266.82, "source": "autotuned"},
{"m": 4, "n": 16, "k": 4, "tile_m": 2, "tile_n": 1, "threads": 32, "grouping": 5, "minblocks": 7, "algorithm": "medium", "perf": 1115.11, "source": "autotuned"},
{"m": 4, "n": 16, "k": 5, "tile_m": 2, "tile_n": 1, "threads": 96, "grouping": 8, "minblocks": 14, "algorithm": "medium", "perf": 1453.31, "source": "autotuned"},
{"m": 4, "n": 16, "k": 9, "tile_m": 2, "tile_n": 1, "threads": 64, "grouping": 9, "minblocks": 20, "algorithm": "medium", "perf": 1932.25, "source": "autotuned"},
{"m": 4, "n": 16, "k": 13, "tile_m": 2, "tile_n": 1, "threads": 64, "grouping": 9, "minblocks": 1, "algorithm": "medium", "perf": 2330.39, "source": "autotuned"},
{"m": 4, "n": 16, "k": 15, "tile_m": 2, "tile_n": 1, "threads": 64, "grouping": 9, "minblocks": 20, "algorithm": "medium", "perf": 2613.33, "source": "autotuned"},
{"m": 4, "n": 16, "k": 16, "tile_m": 2, "tile_n": 1, "threads": 32, "grouping": 5, "minblocks": 25, "algorithm": "medium", "perf": 2666.34, "source": "autotuned"},
{"m": 4, "n": 16, "k": 22, "tile_m": 2, "tile_n": 1, "w": 8, "v": 16, "threads": 32, "grouping": 16, "minblocks": 1, "algorithm": "largeDB2", "perf": 2991.11, "source": "autotuned"},
{"m": 4, "n": 16, "k": 25, "tile_m": 2, "tile_n": 1, "w": 10, "v": 16, "threads": 32, "grouping": 16, "minblocks": 12, "algorithm": "largeDB2", "perf": 3111.22, "source": "autotuned"},
{"m": 4, "n": 16, "k": 26, "tile_m": 2, "tile_n": 1, "w": 10, "v": 16, "threads": 32, "grouping": 16, "minblocks": 1, "algorithm": "largeDB2", "perf": 3156.77, "source": "autotuned"},
{"m": 4, "n": 16, "k": 45, "tile_m": 2, "tile_n": 1, "threads": 32, "grouping": 8, "minblocks": 8, "algorithm": "medium", "perf": 3447.08, "source": "autotuned"},
{"m": 4, "n": 22, "k": 4, "tile_m": 1, "tile_n": 3, "threads": 96, "grouping": 8, "minblocks": 14, "algorithm": "medium", "perf": 1502.73, "source": "autotuned"},
{"m": 4, "n": 22, "k": 5, "tile_m": 1, "tile_n": 3, "threads": 32, "grouping": 7, "minblocks": 19, "algorithm": "medium", "perf": 1691.91, "source": "autotuned"},
{"m": 4, "n": 22, "k": 6, "tile_m": 2, "tile_n": 2, "threads": 32, "grouping": 8, "minblocks": 1, "algorithm": "medium", "perf": 1903.15, "source": "autotuned"},
{"m": 4, "n": 22, "k": 7, "tile_m": 2, "tile_n": 2, "threads": 32, "grouping": 8, "minblocks": 5, "algorithm": "medium", "perf": 2145.14, "source": "autotuned"},
{"m": 4, "n": 22, "k": 8, "tile_m": 2, "tile_n": 1, "threads": 64, "grouping": 9, "minblocks": 15, "algorithm": "medium", "perf": 2206.77, "source": "autotuned"},
{"m": 4, "n": 22, "k": 9, "tile_m": 2, "tile_n": 1, "threads": 64, "grouping": 9, "minblocks": 19, "algorithm": "medium", "perf": 2220.42, "source": "autotuned"},
{"m": 4, "n": 22, "k": 10, "tile_m": 2, "tile_n": 2, "threads": 32, "grouping": 5, "minblocks": 27, "algorithm": "medium", "perf": 2366.79, "source": "autotuned"},
{"m": 4, "n": 22, "k": 13, "tile_m": 2, "tile_n": 2, "threads": 96, "grouping": 8, "minblocks": 14, "algorithm": "medium", "perf": 2730.51, "source": "autotuned"},
{"m": 4, "n": 22, "k": 15, "tile_m": 2, "tile_n": 2, "threads": 32, "grouping": 8, "minblocks": 9, "algorithm": "medium", "perf": 2867.0, "source": "autotuned"},
{"m": 4, "n": 22, "k": 16, "tile_m": 2, "tile_n": 2, "threads": 32, "grouping": 8, "minblocks": 5, "algorithm": "medium", "perf": 3048.57, "source": "autotuned"},
{"m": 4, "n": 22, "k": 22, "tile_m": 2, "tile_n": 2, "threads": 32, "grouping": 8, "minblocks": 13, "algorithm": "medium", "perf": 3224.99, "source": "autotuned"},
{"m": 4, "n": 22, "k": 23, "tile_m": 2, "tile_n": 2, "threads": 32, "grouping": 8, "minblocks": 3, "algorithm": "medium", "perf": 3217.11, "source": "autotuned"},
{"m": 4, "n": 22, "k": 25, "tile_m": 2, "tile_n": 2, "threads": 32, "grouping": 8, "minblocks": 9, "algorithm": "medium", "perf": 3246.81, "source": "autotuned"},
{"m": 4, "n": 22, "k": 26, "tile_m": 1, "tile_n": 3, "threads": 32, "grouping": 8, "minblocks": 10, "algorithm": "medium", "perf": 2983.98, "source": "autotuned"},
{"m": 4, "n": 22, "k": 32, "tile_m": 2, "tile_n": 2, "threads": 32, "grouping": 12, "minblocks": 9, "algorithm": "medium", "perf": 3471.2, "source": "autotuned"},
{"m": 4, "n": 22, "k": 45, "tile_m": 2, "tile_n": 2, "threads": 32, "grouping": 12, "minblocks": 6, "algorithm": "medium", "perf": 3536.82, "source": "autotuned"},
{"m": 4, "n": 23, "k": 4, "tile_m": 2, "tile_n": 1, "threads": 96, "grouping": 8, "minblocks": 20, "algorithm": "medium", "perf": 1572.73, "source": "autotuned"},
{"m": 4, "n": 23, "k": 5, "tile_m": 1, "tile_n": 3, "threads": 32, "grouping": 7, "minblocks": 20, "algorithm": "medium", "perf": 1758.51, "source": "autotuned"},
{"m": 4, "n": 23, "k": 13, "tile_m": 2, "tile_n": 1, "threads": 64, "grouping": 8, "minblocks": 21, "algorithm": "medium", "perf": 2660.97, "source": "autotuned"},
{"m": 4, "n": 23, "k": 22, "tile_m": 2, "tile_n": 2, "threads": 32, "grouping": 8, "minblocks": 11, "algorithm": "medium", "perf": 3073.06, "source": "autotuned"},
{"m": 4, "n": 23, "k": 23, "tile_m": 2, "tile_n": 2, "threads": 32, "grouping": 8, "minblocks": 5, "algorithm": "medium", "perf": 3102.7, "source": "autotuned"},
{"m": 4, "n": 23, "k": 26, "tile_m": 2, "tile_n": 2, "threads": 32, "grouping": 8, "minblocks": 11, "algorithm": "medium", "perf": 3324.18, "source": "autotuned"},
{"m": 4, "n": 25, "k": 4, "tile_m": 2, "tile_n": 3, "threads": 32, "grouping": 6, "minblocks": 22, "algorithm": "medium", "perf": 1510.09, "source": "autotuned"},
{"m": 4, "n": 25, "k": 5, "tile_m": 2, "tile_n": 3, "threads": 32, "grouping": 6, "minblocks": 23, "algorithm": "medium", "perf": 1796.8, "source": "autotuned"},
{"m": 4, "n": 25, "k": 7, "tile_m": 2, "tile_n": 2, "threads": 32, "grouping": 8, "minblocks": 26, "algorithm": "medium", "perf": 2204.39, "source": "autotuned"},
{"m": 4, "n": 25, "k": 9, "tile_m": 2, "tile_n": 1, "threads": 64, "grouping": 8, "minblocks": 23, "algorithm": "medium", "perf": 2348.72, "source": "autotuned"},
{"m": 4, "n": 25, "k": 13, "tile_m": 2, "tile_n": 2, "threads": 32, "grouping": 8, "minblocks": 1, "algorithm": "medium", "perf": 2735.78, "source": "autotuned"},
{"m": 4, "n": 25, "k": 15, "tile_m": 2, "tile_n": 2, "threads": 32, "grouping": 8, "minblocks": 17, "algorithm": "medium", "perf": 2942.82, "source": "autotuned"},
{"m": 4, "n": 25, "k": 16, "tile_m": 2, "tile_n": 2, "threads": 32, "grouping": 8, "minblocks": 1, "algorithm": "medium", "perf": 3021.44, "source": "autotuned"},
{"m": 4, "n": 25, "k": 22, "tile_m": 2, "tile_n": 2, "threads": 32, "grouping": 8, "minblocks": 8, "algorithm": "medium", "perf": 3158.28, "source": "autotuned"},
{"m": 4, "n": 25, "k": 25, "tile_m": 2, "tile_n": 2, "threads": 32, "grouping": 12, "minblocks": 3, "algorithm": "medium", "perf": 3279.28, "source": "autotuned"},
{"m": 4, "n": 25, "k": 26, "tile_m": 2, "tile_n": 2, "threads": 32, "grouping": 12, "minblocks": 5, "algorithm": "medium", "perf": 3299.48, "source": "autotuned"},
{"m": 4, "n": 25, "k": 28, "tile_m": 2, "tile_n": 2, "threads": 32, "grouping": 12, "minblocks": 6, "algorithm": "medium", "perf": 3313.66, "source": "autotuned"},
{"m": 4, "n": 25, "k": 32, "tile_m": 2, "tile_n": 2, "threads": 32, "grouping": 12, "minblocks": 4, "algorithm": "medium", "perf": 3464.29, "source": "autotuned"},
{"m": 4, "n": 25, "k": 45, "tile_m": 2, "tile_n": 2, "threads": 32, "grouping": 16, "minblocks": 3, "algorithm": "medium", "perf": 3439.69, "source": "autotuned"},
{"m": 4, "n": 26, "k": 4, "tile_m": 2, "tile_n": 2, "threads": 32, "grouping": 5, "minblocks": 3, "algorithm": "medium", "perf": 1601.53, "source": "autotuned"},
{"m": 4, "n": 26, "k": 5, "tile_m": 2, "tile_n": 2, "threads": 32, "grouping": 8, "minblocks": 15, "algorithm": "medium", "perf": 1864.94, "source": "autotuned"},
{"m": 4, "n": 26, "k": 6, "tile_m": 2, "tile_n": 2, "threads": 32, "grouping": 8, "minblocks": 11, "algorithm": "medium", "perf": 2151.65, "source": "autotuned"},
{"m": 4, "n": 26, "k": 7, "tile_m": 2, "tile_n": 2, "threads": 32, "grouping": 8, "minblocks": 18, "algorithm": "medium", "perf": 2351.8, "source": "autotuned"},
{"m": 4, "n": 26, "k": 8, "tile_m": 2, "tile_n": 1, "threads": 64, "grouping": 8, "minblocks": 23, "algorithm": "medium", "perf": 2365.72, "source": "autotuned"},
{"m": 4, "n": 26, "k": 9, "tile_m": 2, "tile_n": 2, "threads": 64, "grouping": 9, "minblocks": 15, "algorithm": "medium", "perf": 2508.62, "source": "autotuned"},
{"m": 4, "n": 26, "k": 10, "tile_m": 2, "tile_n": 2, "threads": 96, "grouping": 8, "minblocks": 15, "algorithm": "medium", "perf": 2634.29, "source": "autotuned"},
{"m": 4, "n": 26, "k": 13, "tile_m": 2, "tile_n": 2, "threads": 32, "grouping": 8, "minblocks": 17, "algorithm": "medium", "perf": 2943.6, "source": "autotuned"},
{"m": 4, "n": 26, "k": 15, "tile_m": 2, "tile_n": 2, "threads": 32, "grouping": 8, "minblocks": 3, "algorithm": "medium", "perf": 3139.02, "source": "autotuned"},
{"m": 4, "n": 26, "k": 16, "tile_m": 2, "tile_n": 2, "threads": 32, "grouping": 8, "minblocks": 16, "algorithm": "medium", "perf": 3347.21, "source": "autotuned"},
{"m": 4, "n": 26, "k": 22, "tile_m": 2, "tile_n": 2, "threads": 32, "grouping": 8, "minblocks": 12, "algorithm": "medium", "perf": 3468.8, "source": "autotuned"},
{"m": 4, "n": 26, "k": 23, "tile_m": 2, "tile_n": 2, "threads": 32, "grouping": 8, "minblocks": 9, "algorithm": "medium", "perf": 3763.37, "source": "autotuned"},
{"m": 4, "n": 26, "k": 25, "tile_m": 2, "tile_n": 2, "threads": 32, "grouping": 12, "minblocks": 9, "algorithm": "medium", "perf": 3522.94, "source": "autotuned"},
{"m": 4, "n": 26, "k": 26, "tile_m": 2, "tile_n": 2, "threads": 32, "grouping": 12, "minblocks": 1, "algorithm": "medium", "perf": 3508.23, "source": "autotuned"},
{"m": 4, "n": 26, "k": 28, "tile_m": 2, "tile_n": 2, "threads": 32, "grouping": 12, "minblocks": 8, "algorithm": "medium", "perf": 3577.41, "source": "autotuned"},
{"m": 4, "n": 26, "k": 32, "tile_m": 2, "tile_n": 2, "threads": 32, "grouping": 12, "minblocks": 8, "algorithm": "medium", "perf": 3723.76, "source": "autotuned"},
{"m": 4, "n": 26, "k": 45, "tile_m": 2, "tile_n": 2, "threads": 32, "grouping": 16, "minblocks": 5, "algorithm": "medium", "perf": 3593.75, "source": "autotuned"},
{"m": 4, "n": 28, "k": 4, "tile_m": 2, "tile_n": 2, "threads": 32, "grouping": 5, "minblocks": 26, "algorithm": "medium", "perf": 1682.16, "source": "autotuned"},
{"m": 4, "n": 28, "k": 5, "tile_m": 2, "tile_n": 2, "threads": 32, "grouping": 8, "minblocks": 8, "algorithm": "medium", "perf": 2009.43, "source": "autotuned"},
{"m": 4, "n": 28, "k": 7, "tile_m": 2, "tile_n": 2, "threads": 32, "grouping": 8, "minblocks": 24, "algorithm": "medium", "perf": 2468.77, "source": "autotuned"},
{"m": 4, "n": 28, "k": 9, "tile_m": 2, "tile_n": 2, "threads": 64, "grouping": 9, "minblocks": 15, "algorithm": "medium", "perf": 2727.02, "source": "autotuned"},
{"m": 4, "n": 28, "k": 13, "tile_m": 2, "tile_n": 2, "threads": 32, "grouping": 8, "minblocks": 11, "algorithm": "medium", "perf": 3117.08, "source": "autotuned"},
{"m": 4, "n": 28, "k": 25, "tile_m": 2, "tile_n": 2, "threads": 32, "grouping": 12, "minblocks": 7, "algorithm": "medium", "perf": 3639.86, "source": "autotuned"},
{"m": 4, "n": 28, "k": 26, "tile_m": 2, "tile_n": 2, "threads": 32, "grouping": 12, "minblocks": 6, "algorithm": "medium", "perf": 3668.65, "source": "autotuned"},
{"m": 4, "n": 28, "k": 28, "tile_m": 2, "tile_n": 2, "threads": 32, "grouping": 12, "minblocks": 1, "algorithm": "medium", "perf": 3762.87, "source": "autotuned"},
{"m": 4, "n": 28, "k": 32, "tile_m": 2, "tile_n": 2, "threads": 32, "grouping": 12, "minblocks": 7, "algorithm": "medium", "perf": 3801.82, "source": "autotuned"},
{"m": 4, "n": 28, "k": 45, "tile_m": 2, "tile_n": 2, "threads": 32, "grouping": 16, "minblocks": 5, "algorithm": "medium", "perf": 3703.41, "source": "autotuned"},
{"m": 4, "n": 32, "k": 4, "tile_m": 2, "tile_n": 2, "threads": 32, "grouping": 5, "minblocks": 9, "algorithm": "small", "perf": 1979.68, "source": "autotuned"},
{"m": 4, "n": 32, "k": 5, "tile_m": 2, "tile_n": 2, "threads": 32, "grouping": 8, "minblocks": 1, "algorithm": "medium", "perf": 2240.11, "source": "autotuned"},
{"m": 4, "n": 32, "k": 6, "tile_m": 2, "tile_n": 2, "threads": 32, "grouping": 8, "minblocks": 9, "algorithm": "medium", "perf": 2547.53, "source": "autotuned"},
{"m": 4, "n": 32, "k": 7, "tile_m": 2, "tile_n": 2, "threads": 32, "grouping": 8, "minblocks": 6, "algorithm": "medium", "perf": 2762.36, "source": "autotuned"},
{"m": 4, "n": 32, "k": 8, "tile_m": 2, "tile_n": 2, "threads": 32, "grouping": 5, "minblocks": 27, "algorithm": "medium", "perf": 2823.76, "source": "autotuned"},
{"m": 4, "n": 32, "k": 9, "tile_m": 2, "tile_n": 2, "threads": 64, "grouping": 9, "minblocks": 16, "algorithm": "medium", "perf": 2957.04, "source": "autotuned"},
{"m": 4, "n": 32, "k": 10, "tile_m": 2, "tile_n": 2, "threads": 32, "grouping": 8, "minblocks": 12, "algorithm": "medium", "perf": 3065.6, "source": "autotuned"},
{"m": 4, "n": 32, "k": 13, "tile_m": 2, "tile_n": 2, "threads": 32, "grouping": 8, "minblocks": 2, "algorithm": "medium", "perf": 3471.88, "source": "autotuned"},
{"m": 4, "n": 32, "k": 22, "tile_m": 2, "tile_n": 2, "threads": 32, "grouping": 12, "minblocks": 10, "algorithm": "medium", "perf": 3901.5, "source": "autotuned"},
{"m": 4, "n": 32, "k": 25, "tile_m": 2, "tile_n": 2, "threads": 32, "grouping": 12, "minblocks": 5, "algorithm": "medium", "perf": 3884.71, "source": "autotuned"},
{"m": 4, "n": 32, "k": 26, "tile_m": 2, "tile_n": 2, "threads": 32, "grouping": 12, "minblocks": 5, "algorithm": "medium", "perf": 3933.49, "source": "autotuned"},
{"m": 4, "n": 32, "k": 28, "tile_m": 2, "tile_n": 2, "threads": 32, "grouping": 12, "minblocks": 3, "algorithm": "medium", "perf": 3971.7, "source": "autotuned"},
{"m": 4, "n": 32, "k": 32, "tile_m": 2, "tile_n": 2, "threads": 32, "grouping": 12, "minblocks": 7, "algorithm": "medium", "perf": 4109.61, "source": "autotuned"},
{"m": 4, "n": 32, "k": 45, "tile_m": 2, "tile_n": 2, "threads": 32, "grouping": 16, "minblocks": 1, "algorithm": "medium", "perf": 3806.52, "source": "autotuned"},
{"m": 4, "n": 45, "k": 4, "tile_m": 2, "tile_n": 3, "threads": 32, "grouping": 7, "minblocks": 10, "algorithm": "medium", "perf": 2382.99, "source": "autotuned"},
{"m": 4, "n": 45, "k": 5, "tile_m": 2, "tile_n": 3, "threads": 32, "grouping": 8, "minblocks": 23, "algorithm": "medium", "perf": 2697.94, "source": "autotuned"},
{"m": 4, "n": 45, "k": 6, "tile_m": 2, "tile_n": 3, "threads": 32, "grouping": 8, "minblocks": 18, "algorithm": "medium", "perf": 3145.5, "source": "autotuned"},
{"m": 4, "n": 45, "k": 7, "tile_m": 2, "tile_n": 3, "threads": 32, "grouping": 8, "minblocks": 23, "algorithm": "medium", "perf": 3400.34, "source": "autotuned"},
{"m": 4, "n": 45, "k": 8, "tile_m": 2, "tile_n": 3, "threads": 32, "grouping": 8, "minblocks": 11, "algorithm": "medium", "perf": 3205.45, "source": "autotuned"},
{"m": 4, "n": 45, "k": 9, "tile_m": 2, "tile_n": 3, "threads": 32, "grouping": 8, "minblocks": 16, "algorithm": "medium", "perf": 3353.1, "source": "autotuned"},
{"m": 4, "n": 45, "k": 10, "tile_m": 2, "tile_n": 3, "threads": 32, "grouping": 8, "minblocks": 15, "algorithm": "medium", "perf": 3481.59, "source": "autotuned"},
{"m": 4, "n": 45, "k": 13, "tile_m": 2, "tile_n": 3, "threads": 32, "grouping": 11, "minblocks": 3, "algorithm": "medium", "perf": 3802.36, "source": "autotuned"},
{"m": 4, "n": 45, "k": 15, "tile_m": 2, "tile_n": 3, "threads": 32, "grouping": 11, "minblocks": 10, "algorithm": "medium", "perf": 3856.97, "source": "autotuned"},
{"m": 4, "n": 45, "k": 16, "tile_m": 2, "tile_n": 3, "threads": 32, "grouping": 11, "minblocks": 6, "algorithm": "medium", "perf": 3968.18, "source": "autotuned"},
{"m": 4, "n": 45, "k": 22, "tile_m": 2, "tile_n": 3, "threads": 32, "grouping": 11, "minblocks": 2, "algorithm": "medium", "perf": 4104.91, "source": "autotuned"},
{"m": 4, "n": 45, "k": 25, "tile_m": 2, "tile_n": 3, "threads": 32, "grouping": 11, "minblocks": 5, "algorithm": "medium", "perf": 4051.67, "source": "autotuned"},
{"m": 4, "n": 45, "k": 26, "tile_m": 2, "tile_n": 3, "threads": 32, "grouping": 16, "minblocks": 2, "algorithm": "medium", "perf": 3784.53, "source": "autotuned"},
{"m": 4, "n": 45, "k": 28, "tile_m": 2, "tile_n": 3, "threads": 32, "grouping": 16, "minblocks": 1, "algorithm": "medium", "perf": 3857.36, "source": "autotuned"},
{"m": 4, "n": 45, "k": 32, "tile_m": 2, "tile_n": 3, "threads": 32, "grouping": 16, "minblocks": 1, "algorithm": "medium", "perf": 3941.04, "source": "autotuned"},
{"m": 4, "n": 45, "k": 45, "tile_m": 1, "tile_n": 6, "w": 18, "v": 32, "threads": 32, "grouping": 16, "minblocks": 2, "algorithm": "largeDB2", "perf": 3790.36, "source": "autotuned"},
{"m": 5, "n": 4, "k": 4, "tile_m": 1, "tile_n": 1, "threads": 32, "grouping": 8, "minblocks": 16, "algorithm": "medium", "perf": 454.903, "source": "autotuned"},
{"m": 5, "n": 4, "k": 5, "tile_m": 1, "tile_n": 1, "threads": 32, "grouping": 9, "minblocks": 20, "algorithm": "medium", "perf": 538.776, "source": "autotuned"},
{"m": 5, "n": 4, "k": 6, "tile_m": 1, "tile_n": 1, "threads": 32, "grouping": 9, "minblocks": 17, "algorithm": "medium", "perf": 639.97, "source": "autotuned"},
{"m": 5, "n": 4, "k": 7, "tile_m": 1, "tile_n": 1, "threads": 64, "grouping": 9, "minblocks": 15, "algorithm": "medium", "perf": 647.542, "source": "autotuned"},
{"m": 5, "n": 4, "k": 8, "tile_m": 1, "tile_n": 1, "threads": 64, "grouping": 11, "minblocks": 7, "algorithm": "medium", "perf": 713.243, "source": "autotuned"},
{"m": 5, "n": 4, "k": 9, "tile_m": 1, "tile_n": 1, "threads": 64, "grouping": 4, "minblocks": 26, "algorithm": "medium", "perf": 777.513, "source": "autotuned"},
{"m": 5, "n": 4, "k": 10, "tile_m": 1, "tile_n": 1, "threads": 64, "grouping": 4, "minblocks": 26, "algorithm": "medium", "perf": 814.009, "source": "autotuned"},
{"m": 5, "n": 4, "k": 13, "tile_m": 1, "tile_n": 1, "threads": 96, "grouping": 8, "minblocks": 20, "algorithm": "medium", "perf": 902.016, "source": "autotuned"},
{"m": 5, "n": 4, "k": 15, "tile_m": 1, "tile_n": 1, "threads": 96, "grouping": 9, "minblocks": 20, "algorithm": "medium", "perf": 987.547, "source": "autotuned"},
{"m": 5, "n": 4, "k": 16, "tile_m": 1, "tile_n": 1, "threads": 96, "grouping": 9, "minblocks": 17, "algorithm": "medium", "perf": 1029.85, "source": "autotuned"},
{"m": 5, "n": 4, "k": 22, "tile_m": 1, "tile_n": 1, "threads": 128, "grouping": 4, "minblocks": 8, "algorithm": "medium", "perf": 1139.09, "source": "autotuned"},
{"m": 5, "n": 4, "k": 23, "tile_m": 1, "tile_n": 1, "threads": 128, "grouping": 3, "minblocks": 16, "algorithm": "medium", "perf": 1144.95, "source": "autotuned"},
{"m": 5, "n": 4, "k": 25, "tile_m": 1, "tile_n": 1, "threads": 128, "grouping": 3, "minblocks": 14, "algorithm": "medium", "perf": 1195.97, "source": "autotuned"},
{"m": 5, "n": 4, "k": 26, "tile_m": 1, "tile_n": 1, "threads": 160, "grouping": 11, "minblocks": 12, "algorithm": "medium", "perf": 1151.76, "source": "autotuned"},
{"m": 5, "n": 4, "k": 28, "tile_m": 1, "tile_n": 1, "threads": 160, "grouping": 18, "minblocks": 4, "algorithm": "medium", "perf": 1187.27, "source": "autotuned"},
{"m": 5, "n": 4, "k": 32, "tile_m": 1, "tile_n": 1, "threads": 32, "grouping": 4, "minblocks": 18, "algorithm": "medium", "perf": 1238.68, "source": "autotuned"},
{"m": 5, "n": 4, "k": 45, "tile_m": 1, "tile_n": 1, "threads": 64, "grouping": 2, "minblocks": 18, "algorithm": "medium", "perf": 1304.76, "source": "autotuned"},
{"m": 5, "n": 5, "k": 4, "tile_m": 1, "tile_n": 1, "threads": 32, "grouping": 8, "minblocks": 2, "algorithm": "medium", "perf": 566.814, "source": "autotuned"},
{"m": 5, "n": 5, "k": 5, "tile_m": 1, "tile_n": 1, "threads": 32, "grouping": 8, "minblocks": 8, "algorithm": "medium", "perf": 693.467, "source": "autotuned"},
{"m": 5, "n": 5, "k": 6, "tile_m": 1, "tile_n": 1, "threads": 32, "grouping": 9, "minblocks": 4, "algorithm": "medium", "perf": 822.799, "source": "autotuned"},
{"m": 5, "n": 5, "k": 7, "tile_m": 1, "tile_n": 1, "threads": 64, "grouping": 9, "minblocks": 7, "algorithm": "medium", "perf": 809.488, "source": "autotuned"},
{"m": 5, "n": 5, "k": 8, "tile_m": 1, "tile_n": 1, "threads": 64, "grouping": 9, "minblocks": 25, "algorithm": "medium", "perf": 888.912, "source": "autotuned"},
{"m": 5, "n": 5, "k": 9, "tile_m": 1, "tile_n": 1, "threads": 64, "grouping": 9, "minblocks": 12, "algorithm": "medium", "perf": 960.496, "source": "autotuned"},
{"m": 5, "n": 5, "k": 10, "threads": 64, "grouping": 9, "minblocks": 1, "algorithm": "tiny", "perf": 996.01, "source": "autotuned"},
{"m": 5, "n": 5, "k": 12, "tile_m": 1, "tile_n": 1, "threads": 64, "grouping": 4, "minblocks": 26, "algorithm": "medium", "perf": 1136.61, "source": "autotuned"},
{"m": 5, "n": 5, "k": 13, "tile_m": 1, "tile_n": 1, "threads": 32, "grouping": 4, "minblocks": 21, "algorithm": "small", "perf": 1143.77, "source": "autotuned"},
{"m": 5, "n": 5, "k": 14, "tile_m": 1, "tile_n": 1, "threads": 32, "grouping": 4, "minblocks": 2, "algorithm": "small", "perf": 1187.5, "source": "autotuned"},
{"m": 5, "n": 5, "k": 15, "tile_m": 1, "tile_n": 1, "threads": 32, "grouping": 2, "minblocks": 1, "algorithm": "small", "perf": 1250.01, "source": "autotuned"},
{"m": 5, "n": 5, "k": 16, "tile_m": 1, "tile_n": 1, "threads": 32, "grouping": 3, "minblocks": 10, "algorithm": "small", "perf": 1300.61, "source": "autotuned"},
{"m": 5, "n": 5, "k": 22, "tile_m": 1, "tile_n": 1, "threads": 128, "grouping": 4, "minblocks": 12, "algorithm": "medium", "perf": 1382.82, "source": "autotuned"},
{"m": 5, "n": 5, "k": 23, "tile_m": 1, "tile_n": 1, "threads": 128, "grouping": 4, "minblocks": 16, "algorithm": "medium", "perf": 1407.62, "source": "autotuned"},
{"m": 5, "n": 5, "k": 24, "tile_m": 1, "tile_n": 1, "threads": 128, "grouping": 4, "minblocks": 13, "algorithm": "medium", "perf": 1450.95, "source": "autotuned"},
{"m": 5, "n": 5, "k": 25, "tile_m": 1, "tile_n": 1, "threads": 128, "grouping": 4, "minblocks": 15, "algorithm": "medium", "perf": 1474.34, "source": "autotuned"},
{"m": 5, "n": 5, "k": 26, "tile_m": 1, "tile_n": 1, "threads": 32, "grouping": 4, "minblocks": 24, "algorithm": "medium", "perf": 1447.94, "source": "autotuned"},
{"m": 5, "n": 5, "k": 28, "tile_m": 1, "tile_n": 1, "threads": 32, "grouping": 4, "minblocks": 17, "algorithm": "medium", "perf": 1510.24, "source": "autotuned"},
{"m": 5, "n": 5, "k": 32, "tile_m": 1, "tile_n": 1, "threads": 32, "grouping": 4, "minblocks": 17, "algorithm": "medium", "perf": 1596.03, "source": "autotuned"},
{"m": 5, "n": 5, "k": 45, "tile_m": 1, "tile_n": 1, "threads": 32, "grouping": 2, "minblocks": 11, "algorithm": "medium", "perf": 1651.62, "source": "autotuned"},
{"m": 5, "n": 6, "k": 4, "tile_m": 1, "tile_n": 1, "threads": 32, "grouping": 8, "minblocks": 16, "algorithm": "medium", "perf": 677.111, "source": "autotuned"},
{"m": 5, "n": 6, "k": 5, "tile_m": 1, "tile_n": 1, "threads": 32, "grouping": 9, "minblocks": 2, "algorithm": "medium", "perf": 820.955, "source": "autotuned"},
{"m": 5, "n": 6, "k": 6, "tile_m": 1, "tile_n": 1, "threads": 64, "grouping": 8, "minblocks": 10, "algorithm": "medium", "perf": 892.456, "source": "autotuned"},
{"m": 5, "n": 6, "k": 7, "tile_m": 1, "tile_n": 1, "threads": 64, "grouping": 8, "minblocks": 10, "algorithm": "medium", "perf": 988.505, "source": "autotuned"},
{"m": 5, "n": 6, "k": 8, "tile_m": 1, "tile_n": 1, "threads": 64, "grouping": 8, "minblocks": 10, "algorithm": "medium", "perf": 1091.73, "source": "autotuned"},
{"m": 5, "n": 6, "k": 9, "tile_m": 1, "tile_n": 1, "threads": 64, "grouping": 4, "minblocks": 27, "algorithm": "medium", "perf": 1141.06, "source": "autotuned"},
{"m": 5, "n": 6, "k": 10, "tile_m": 1, "tile_n": 1, "threads": 64, "grouping": 8, "minblocks": 10, "algorithm": "medium", "perf": 1226.34, "source": "autotuned"},
{"m": 5, "n": 6, "k": 13, "tile_m": 1, "tile_n": 1, "threads": 96, "grouping": 8, "minblocks": 21, "algorithm": "medium", "perf": 1325.4, "source": "autotuned"},
{"m": 5, "n": 6, "k": 14, "tile_m": 1, "tile_n": 1, "threads": 96, "grouping": 9, "minblocks": 17, "algorithm": "medium", "perf": 1385.94, "source": "autotuned"},
{"m": 5, "n": 6, "k": 15, "tile_m": 1, "tile_n": 1, "threads": 96, "grouping": 9, "minblocks": 17, "algorithm": "medium", "perf": 1444.64, "source": "autotuned"},
{"m": 5, "n": 6, "k": 22, "tile_m": 1, "tile_n": 1, "threads": 160, "grouping": 11, "minblocks": 11, "algorithm": "medium", "perf": 1571.3, "source": "autotuned"},
{"m": 5, "n": 6, "k": 26, "tile_m": 1, "tile_n": 1, "threads": 160, "grouping": 18, "minblocks": 8, "algorithm": "medium", "perf": 1675.47, "source": "autotuned"},
{"m": 5, "n": 6, "k": 32, "tile_m": 1, "tile_n": 1, "threads": 32, "grouping": 2, "minblocks": 16, "algorithm": "medium", "perf": 1746.0, "source": "autotuned"},
{"m": 5, "n": 6, "k": 45, "tile_m": 1, "tile_n": 1, "w": 18, "v": 6, "threads": 32, "grouping": 16, "minblocks": 1, "algorithm": "largeDB2", "perf": 1942.12, "source": "autotuned"},
{"m": 5, "n": 7, "k": 4, "tile_m": 3, "tile_n": 1, "threads": 32, "grouping": 9, "minblocks": 18, "algorithm": "medium", "perf": 736.071, "source": "autotuned"},
{"m": 5, "n": 7, "k": 5, "tile_m": 1, "tile_n": 1, "threads": 64, "grouping": 11, "minblocks": 25, "algorithm": "medium", "perf": 787.535, "source": "autotuned"},
{"m": 5, "n": 7, "k": 6, "tile_m": 3, "tile_n": 1, "threads": 32, "grouping": 5, "minblocks": 22, "algorithm": "medium", "perf": 887.813, "source": "autotuned"},
{"m": 5, "n": 7, "k": 7, "tile_m": 2, "tile_n": 1, "threads": 64, "grouping": 9, "minblocks": 24, "algorithm": "medium", "perf": 993.791, "source": "autotuned"},
{"m": 5, "n": 7, "k": 8, "tile_m": 2, "tile_n": 1, "threads": 64, "grouping": 9, "minblocks": 21, "algorithm": "medium", "perf": 1075.29, "source": "autotuned"},
{"m": 5, "n": 7, "k": 9, "tile_m": 2, "tile_n": 1, "threads": 64, "grouping": 9, "minblocks": 24, "algorithm": "medium", "perf": 1159.76, "source": "autotuned"},
{"m": 5, "n": 7, "k": 10, "tile_m": 3, "tile_n": 1, "threads": 96, "grouping": 11, "minblocks": 11, "algorithm": "medium", "perf": 1206.92, "source": "autotuned"},
{"m": 5, "n": 7, "k": 13, "tile_m": 3, "tile_n": 1, "threads": 96, "grouping": 11, "minblocks": 15, "algorithm": "medium", "perf": 1429.43, "source": "autotuned"},
{"m": 5, "n": 7, "k": 15, "tile_m": 3, "tile_n": 1, "threads": 32, "grouping": 4, "minblocks": 21, "algorithm": "small", "perf": 1436.75, "source": "autotuned"},
{"m": 5, "n": 7, "k": 22, "tile_m": 3, "tile_n": 1, "threads": 160, "grouping": 16, "minblocks": 8, "algorithm": "medium", "perf": 1644.5, "source": "autotuned"},
{"m": 5, "n": 7, "k": 25, "tile_m": 3, "tile_n": 1, "threads": 32, "grouping": 3, "minblocks": 25, "algorithm": "medium", "perf": 1728.81, "source": "autotuned"},
{"m": 5, "n": 7, "k": 26, "tile_m": 3, "tile_n": 1, "threads": 32, "grouping": 8, "minblocks": 2, "algorithm": "medium", "perf": 1707.6, "source": "autotuned"},
{"m": 5, "n": 7, "k": 28, "tile_m": 3, "tile_n": 1, "threads": 32, "grouping": 8, "minblocks": 18, "algorithm": "medium", "perf": 1725.64, "source": "autotuned"},
{"m": 5, "n": 7, "k": 32, "tile_m": 3, "tile_n": 1, "threads": 32, "grouping": 4, "minblocks": 18, "algorithm": "medium", "perf": 1838.28, "source": "autotuned"},
{"m": 5, "n": 7, "k": 45, "tile_m": 3, "tile_n": 1, "w": 18, "v": 4, "threads": 32, "grouping": 16, "minblocks": 12, "algorithm": "largeDB2", "perf": 2022.08, "source": "autotuned"},
{"m": 5, "n": 8, "k": 4, "tile_m": 1, "tile_n": 2, "threads": 64, "grouping": 9, "minblocks": 1, "algorithm": "medium", "perf": 774.147, "source": "autotuned"},
{"m": 5, "n": 8, "k": 5, "tile_m": 2, "tile_n": 1, "threads": 64, "grouping": 9, "minblocks": 23, "algorithm": "medium", "perf": 906.385, "source": "autotuned"},
{"m": 5, "n": 8, "k": 6, "tile_m": 1, "tile_n": 2, "threads": 64, "grouping": 9, "minblocks": 17, "algorithm": "medium", "perf": 1050.66, "source": "autotuned"},
{"m": 5, "n": 8, "k": 7, "tile_m": 2, "tile_n": 1, "threads": 64, "grouping": 9, "minblocks": 24, "algorithm": "medium", "perf": 1134.9, "source": "autotuned"},
{"m": 5, "n": 8, "k": 8, "tile_m": 1, "tile_n": 2, "threads": 64, "grouping": 5, "minblocks": 26, "algorithm": "small", "perf": 1120.84, "source": "autotuned"},
{"m": 5, "n": 8, "k": 9, "tile_m": 3, "tile_n": 1, "threads": 96, "grouping": 8, "minblocks": 15, "algorithm": "medium", "perf": 1303.51, "source": "autotuned"},
{"m": 5, "n": 8, "k": 10, "tile_m": 4, "tile_n": 1, "threads": 96, "grouping": 8, "minblocks": 14, "algorithm": "medium", "perf": 1400.46, "source": "autotuned"},
{"m": 5, "n": 8, "k": 13, "tile_m": 3, "tile_n": 1, "threads": 128, "grouping": 8, "minblocks": 15, "algorithm": "medium", "perf": 1490.79, "source": "autotuned"},
{"m": 5, "n": 8, "k": 15, "tile_m": 3, "tile_n": 1, "threads": 128, "grouping": 11, "minblocks": 11, "algorithm": "medium", "perf": 1632.72, "source": "autotuned"},
{"m": 5, "n": 8, "k": 22, "tile_m": 3, "tile_n": 1, "threads": 32, "grouping": 3, "minblocks": 25, "algorithm": "medium", "perf": 1839.11, "source": "autotuned"},
{"m": 5, "n": 8, "k": 26, "tile_m": 3, "tile_n": 1, "threads": 32, "grouping": 8, "minblocks": 7, "algorithm": "medium", "perf": 1914.41, "source": "autotuned"},
{"m": 5, "n": 8, "k": 32, "tile_m": 3, "tile_n": 1, "threads": 32, "grouping": 4, "minblocks": 17, "algorithm": "medium", "perf": 2106.69, "source": "autotuned"},
{"m": 5, "n": 8, "k": 45, "tile_m": 3, "tile_n": 1, "w": 20, "v": 6, "threads": 32, "grouping": 16, "minblocks": 1, "algorithm": "largeDB2", "perf": 2237.19, "source": "autotuned"},
{"m": 5, "n": 9, "k": 4, "tile_m": 1, "tile_n": 1, "threads": 64, "grouping": 9, "minblocks": 14, "algorithm": "medium", "perf": 861.215, "source": "autotuned"},
{"m": 5, "n": 9, "k": 5, "tile_m": 1, "tile_n": 1, "threads": 64, "grouping": 11, "minblocks": 26, "algorithm": "medium", "perf": 1007.15, "source": "autotuned"},
{"m": 5, "n": 9, "k": 6, "tile_m": 2, "tile_n": 1, "threads": 64, "grouping": 9, "minblocks": 22, "algorithm": "medium", "perf": 1119.57, "source": "autotuned"},
{"m": 5, "n": 9, "k": 7, "tile_m": 2, "tile_n": 1, "threads": 64, "grouping": 9, "minblocks": 22, "algorithm": "medium", "perf": 1231.22, "source": "autotuned"},
{"m": 5, "n": 9, "k": 8, "tile_m": 3, "tile_n": 1, "threads": 96, "grouping": 8, "minblocks": 16, "algorithm": "medium", "perf": 1350.07, "source": "autotuned"},
{"m": 5, "n": 9, "k": 9, "tile_m": 3, "tile_n": 1, "threads": 96, "grouping": 8, "minblocks": 16, "algorithm": "medium", "perf": 1448.09, "source": "autotuned"},
{"m": 5, "n": 9, "k": 10, "tile_m": 3, "tile_n": 1, "threads": 96, "grouping": 11, "minblocks": 16, "algorithm": "medium", "perf": 1521.89, "source": "autotuned"},
{"m": 5, "n": 9, "k": 13, "tile_m": 3, "tile_n": 1, "threads": 128, "grouping": 8, "minblocks": 15, "algorithm": "medium", "perf": 1670.59, "source": "autotuned"},
{"m": 5, "n": 9, "k": 14, "tile_m": 3, "tile_n": 1, "threads": 128, "grouping": 11, "minblocks": 12, "algorithm": "medium", "perf": 1734.32, "source": "autotuned"},
{"m": 5, "n": 9, "k": 15, "tile_m": 3, "tile_n": 1, "threads": 32, "grouping": 6, "minblocks": 24, "algorithm": "medium", "perf": 1696.98, "source": "autotuned"},
{"m": 5, "n": 9, "k": 16, "tile_m": 3, "tile_n": 1, "threads": 32, "grouping": 6, "minblocks": 22, "algorithm": "medium", "perf": 1765.0, "source": "autotuned"},
{"m": 5, "n": 9, "k": 22, "tile_m": 3, "tile_n": 1, "threads": 32, "grouping": 8, "minblocks": 22, "algorithm": "medium", "perf": 1994.58, "source": "autotuned"},
{"m": 5, "n": 9, "k": 23, "tile_m": 3, "tile_n": 1, "threads": 32, "grouping": 8, "minblocks": 22, "algorithm": "medium", "perf": 2023.43, "source": "autotuned"},
{"m": 5, "n": 9, "k": 25, "tile_m": 3, "tile_n": 1, "threads": 32, "grouping": 8, "minblocks": 21, "algorithm": "medium", "perf": 2090.67, "source": "autotuned"},
{"m": 5, "n": 9, "k": 26, "tile_m": 3, "tile_n": 1, "threads": 32, "grouping": 8, "minblocks": 9, "algorithm": "medium", "perf": 2070.34, "source": "autotuned"},
{"m": 5, "n": 9, "k": 28, "tile_m": 3, "tile_n": 1, "threads": 32, "grouping": 8, "minblocks": 20, "algorithm": "medium", "perf": 2139.89, "source": "autotuned"},
{"m": 5, "n": 9, "k": 32, "tile_m": 3, "tile_n": 1, "threads": 32, "grouping": 8, "minblocks": 15, "algorithm": "medium", "perf": 2280.55, "source": "autotuned"},
{"m": 5, "n": 9, "k": 45, "tile_m": 3, "tile_n": 1, "w": 20, "v": 6, "threads": 32, "grouping": 16, "minblocks": 8, "algorithm": "largeDB2", "perf": 2402.89, "source": "autotuned"},
{"m": 5, "n": 10, "k": 4, "tile_m": 1, "tile_n": 2, "threads": 64, "grouping": 9, "minblocks": 18, "algorithm": "medium", "perf": 956.351, "source": "autotuned"},
{"m": 5, "n": 10, "k": 5, "tile_m": 1, "tile_n": 2, "threads": 64, "grouping": 9, "minblocks": 18, "algorithm": "medium", "perf": 1112.65, "source": "autotuned"},
{"m": 5, "n": 10, "k": 6, "tile_m": 1, "tile_n": 2, "threads": 64, "grouping": 13, "minblocks": 13, "algorithm": "medium", "perf": 1247.1, "source": "autotuned"},
{"m": 5, "n": 10, "k": 7, "tile_m": 3, "tile_n": 1, "threads": 96, "grouping": 11, "minblocks": 11, "algorithm": "medium", "perf": 1347.17, "source": "autotuned"},
{"m": 5, "n": 10, "k": 8, "tile_m": 3, "tile_n": 1, "threads": 96, "grouping": 8, "minblocks": 16, "algorithm": "medium", "perf": 1463.76, "source": "autotuned"},
{"m": 5, "n": 10, "k": 9, "tile_m": 3, "tile_n": 1, "threads": 96, "grouping": 11, "minblocks": 11, "algorithm": "medium", "perf": 1597.08, "source": "autotuned"},
{"m": 5, "n": 10, "k": 10, "tile_m": 3, "tile_n": 1, "threads": 128, "grouping": 8, "minblocks": 14, "algorithm": "medium", "perf": 1580.77, "source": "autotuned"},
{"m": 5, "n": 10, "k": 13, "tile_m": 3, "tile_n": 1, "threads": 32, "grouping": 6, "minblocks": 24, "algorithm": "medium", "perf": 1722.51, "source": "autotuned"},
{"m": 5, "n": 10, "k": 14, "tile_m": 3, "tile_n": 1, "threads": 32, "grouping": 6, "minblocks": 24, "algorithm": "medium", "perf": 1784.4, "source": "autotuned"},
{"m": 5, "n": 10, "k": 15, "tile_m": 3, "tile_n": 1, "threads": 32, "grouping": 6, "minblocks": 22, "algorithm": "medium", "perf": 1864.23, "source": "autotuned"},
{"m": 5, "n": 10, "k": 22, "tile_m": 3, "tile_n": 1, "threads": 32, "grouping": 8, "minblocks": 5, "algorithm": "medium", "perf": 2164.09, "source": "autotuned"},
{"m": 5, "n": 10, "k": 26, "tile_m": 3, "tile_n": 1, "w": 12, "v": 10, "threads": 32, "grouping": 16, "minblocks": 12, "algorithm": "largeDB2", "perf": 2321.23, "source": "autotuned"},
{"m": 5, "n": 10, "k": 32, "tile_m": 3, "tile_n": 1, "threads": 32, "grouping": 8, "minblocks": 4, "algorithm": "medium", "perf": 2460.69, "source": "autotuned"},
{"m": 5, "n": 10, "k": 45, "tile_m": 3, "tile_n": 1, "w": 18, "v": 10, "threads": 32, "grouping": 16, "minblocks": 2, "algorithm": "largeDB2", "perf": 2617.1, "source": "autotuned"},
{"m": 5, "n": 12, "k": 5, "tile_m": 1, "tile_n": 2, "threads": 64, "grouping": 11, "minblocks": 23, "algorithm": "medium", "perf": 1301.86, "source": "autotuned"},
{"m": 5, "n": 12, "k": 12, "tile_m": 3, "tile_n": 1, "threads": 32, "grouping": 5, "minblocks": 27, "algorithm": "medium", "perf": 2004.88, "source": "autotuned"},
{"m": 5, "n": 12, "k": 13, "tile_m": 3, "tile_n": 1, "threads": 32, "grouping": 6, "minblocks": 24, "algorithm": "medium", "perf": 2029.57, "source": "autotuned"},
{"m": 5, "n": 12, "k": 26, "tile_m": 3, "tile_n": 1, "threads": 32, "grouping": 8, "minblocks": 1, "algorithm": "medium", "perf": 2668.64, "source": "autotuned"},
{"m": 5, "n": 12, "k": 32, "tile_m": 3, "tile_n": 1, "threads": 32, "grouping": 8, "minblocks": 9, "algorithm": "medium", "perf": 2846.04, "source": "autotuned"},
{"m": 5, "n": 13, "k": 4, "tile_m": 3, "tile_n": 1, "threads": 64, "grouping": 9, "minblocks": 4, "algorithm": "medium", "perf": 1170.77, "source": "autotuned"},
{"m": 5, "n": 13, "k": 5, "tile_m": 3, "tile_n": 1, "threads": 96, "grouping": 8, "minblocks": 15, "algorithm": "medium", "perf": 1349.26, "source": "autotuned"},
{"m": 5, "n": 13, "k": 6, "tile_m": 3, "tile_n": 1, "threads": 96, "grouping": 8, "minblocks": 16, "algorithm": "medium", "perf": 1538.56, "source": "autotuned"},
{"m": 5, "n": 13, "k": 7, "tile_m": 3, "tile_n": 1, "threads": 96, "grouping": 8, "minblocks": 14, "algorithm": "medium", "perf": 1713.45, "source": "autotuned"},
{"m": 5, "n": 13, "k": 8, "tile_m": 3, "tile_n": 1, "threads": 128, "grouping": 8, "minblocks": 16, "algorithm": "medium", "perf": 1728.83, "source": "autotuned"},
{"m": 5, "n": 13, "k": 9, "tile_m": 3, "tile_n": 1, "threads": 128, "grouping": 11, "minblocks": 11, "algorithm": "medium", "perf": 1862.23, "source": "autotuned"},
{"m": 5, "n": 13, "k": 10, "tile_m": 3, "tile_n": 1, "threads": 32, "grouping": 5, "minblocks": 27, "algorithm": "medium", "perf": 1888.68, "source": "autotuned"},
{"m": 5, "n": 13, "k": 12, "tile_m": 3, "tile_n": 1, "threads": 32, "grouping": 6, "minblocks": 23, "algorithm": "medium", "perf": 2128.18, "source": "autotuned"},
{"m": 5, "n": 13, "k": 13, "tile_m": 3, "tile_n": 1, "threads": 32, "grouping": 6, "minblocks": 26, "algorithm": "medium", "perf": 2097.06, "source": "autotuned"},
{"m": 5, "n": 13, "k": 14, "tile_m": 3, "tile_n": 1, "threads": 32, "grouping": 6, "minblocks": 27, "algorithm": "medium", "perf": 2206.96, "source": "autotuned"},
{"m": 5, "n": 13, "k": 15, "tile_m": 3, "tile_n": 1, "threads": 32, "grouping": 8, "minblocks": 6, "algorithm": "medium", "perf": 2247.25, "source": "autotuned"},
{"m": 5, "n": 13, "k": 16, "tile_m": 3, "tile_n": 1, "threads": 96, "grouping": 11, "minblocks": 11, "algorithm": "medium", "perf": 2359.91, "source": "autotuned"},
{"m": 5, "n": 13, "k": 22, "tile_m": 3, "tile_n": 1, "threads": 32, "grouping": 8, "minblocks": 1, "algorithm": "medium", "perf": 2714.32, "source": "autotuned"},
{"m": 5, "n": 13, "k": 23, "tile_m": 3, "tile_n": 1, "threads": 32, "grouping": 8, "minblocks": 19, "algorithm": "medium", "perf": 2715.33, "source": "autotuned"},
{"m": 5, "n": 13, "k": 24, "tile_m": 3, "tile_n": 1, "threads": 32, "grouping": 8, "minblocks": 7, "algorithm": "medium", "perf": 2769.28, "source": "autotuned"},
{"m": 5, "n": 13, "k": 25, "tile_m": 3, "tile_n": 1, "threads": 32, "grouping": 8, "minblocks": 17, "algorithm": "medium", "perf": 2784.08, "source": "autotuned"},
{"m": 5, "n": 13, "k": 26, "tile_m": 3, "tile_n": 1, "threads": 32, "grouping": 8, "minblocks": 6, "algorithm": "medium", "perf": 2787.68, "source": "autotuned"},
{"m": 5, "n": 13, "k": 28, "tile_m": 3, "tile_n": 1, "threads": 32, "grouping": 8, "minblocks": 10, "algorithm": "medium", "perf": 2848.35, "source": "autotuned"},
{"m": 5, "n": 13, "k": 32, "tile_m": 3, "tile_n": 1, "threads": 32, "grouping": 8, "minblocks": 4, "algorithm": "medium", "perf": 2985.86, "source": "autotuned"},
{"m": 5, "n": 13, "k": 45, "tile_m": 3, "tile_n": 1, "threads": 32, "grouping": 11, "minblocks": 5, "algorithm": "medium", "perf": 3118.48, "source": "autotuned"},
{"m": 5, "n": 14, "k": 5, "tile_m": 3, "tile_n": 1, "threads": 96, "grouping": 8, "minblocks": 15, "algorithm": "medium", "perf": 1451.19, "source": "autotuned"},
{"m": 5, "n": 14, "k": 6, "tile_m": 3, "tile_n": 1, "threads": 96, "grouping": 8, "minblocks": 14, "algorithm": "medium", "perf": 1659.24, "source": "autotuned"},
{"m": 5, "n": 14, "k": 9, "tile_m": 3, "tile_n": 1, "threads": 128, "grouping": 11, "minblocks": 12, "algorithm": "medium", "perf": 2008.68, "source": "autotuned"},
{"m": 5, "n": 14, "k": 10, "tile_m": 3, "tile_n": 1, "threads": 32, "grouping": 6, "minblocks": 22, "algorithm": "medium", "perf": 2029.62, "source": "autotuned"},
{"m": 5, "n": 14, "k": 13, "tile_m": 3, "tile_n": 1, "threads": 96, "grouping": 8, "minblocks": 16, "algorithm": "medium", "perf": 2245.91, "source": "autotuned"},
{"m": 5, "n": 14, "k": 14, "tile_m": 3, "tile_n": 1, "threads": 96, "grouping": 11, "minblocks": 11, "algorithm": "medium", "perf": 2307.06, "source": "autotuned"},
{"m": 5, "n": 15, "k": 4, "tile_m": 3, "tile_n": 1, "threads": 64, "grouping": 9, "minblocks": 7, "algorithm": "medium", "perf": 1351.18, "source": "autotuned"},
{"m": 5, "n": 15, "k": 5, "tile_m": 3, "tile_n": 1, "threads": 96, "grouping": 9, "minblocks": 15, "algorithm": "medium", "perf": 1541.96, "source": "autotuned"},
{"m": 5, "n": 15, "k": 6, "tile_m": 3, "tile_n": 1, "threads": 96, "grouping": 8, "minblocks": 14, "algorithm": "medium", "perf": 1778.69, "source": "autotuned"},
{"m": 5, "n": 15, "k": 7, "tile_m": 3, "tile_n": 1, "threads": 128, "grouping": 8, "minblocks": 14, "algorithm": "medium", "perf": 1789.45, "source": "autotuned"},
{"m": 5, "n": 15, "k": 8, "tile_m": 3, "tile_n": 1, "threads": 128, "grouping": 11, "minblocks": 12, "algorithm": "medium", "perf": 1973.98, "source": "autotuned"},
{"m": 5, "n": 15, "k": 9, "tile_m": 3, "tile_n": 1, "threads": 32, "grouping": 5, "minblocks": 27, "algorithm": "medium", "perf": 1981.06, "source": "autotuned"},
{"m": 5, "n": 15, "k": 10, "tile_m": 3, "tile_n": 1, "threads": 32, "grouping": 6, "minblocks": 26, "algorithm": "medium", "perf": 2127.95, "source": "autotuned"},
{"m": 5, "n": 15, "k": 13, "tile_m": 3, "tile_n": 1, "threads": 32, "grouping": 6, "minblocks": 27, "algorithm": "medium", "perf": 2331.87, "source": "autotuned"},
{"m": 5, "n": 15, "k": 15, "tile_m": 3, "tile_n": 1, "threads": 96, "grouping": 11, "minblocks": 13, "algorithm": "medium", "perf": 2543.43, "source": "autotuned"},
{"m": 5, "n": 15, "k": 16, "tile_m": 3, "tile_n": 1, "threads": 96, "grouping": 8, "minblocks": 14, "algorithm": "medium", "perf": 2637.61, "source": "autotuned"},
{"m": 5, "n": 15, "k": 22, "tile_m": 3, "tile_n": 1, "threads": 32, "grouping": 8, "minblocks": 3, "algorithm": "medium", "perf": 2985.43, "source": "autotuned"},
{"m": 5, "n": 15, "k": 25, "tile_m": 3, "tile_n": 1, "threads": 32, "grouping": 8, "minblocks": 10, "algorithm": "medium", "perf": 3085.69, "source": "autotuned"},
{"m": 5, "n": 15, "k": 26, "tile_m": 3, "tile_n": 1, "w": 12, "v": 10, "threads": 32, "grouping": 16, "minblocks": 12, "algorithm": "largeDB2", "perf": 3117.65, "source": "autotuned"},
{"m": 5, "n": 15, "k": 45, "tile_m": 3, "tile_n": 1, "threads": 32, "grouping": 11, "minblocks": 7, "algorithm": "medium", "perf": 3388.48, "source": "autotuned"},
{"m": 5, "n": 16, "k": 4, "tile_m": 3, "tile_n": 1, "threads": 96, "grouping": 8, "minblocks": 16, "algorithm": "medium", "perf": 1382.95, "source": "autotuned"},
{"m": 5, "n": 16, "k": 5, "tile_m": 3, "tile_n": 1, "threads": 96, "grouping": 8, "minblocks": 16, "algorithm": "medium", "perf": 1671.23, "source": "autotuned"},
{"m": 5, "n": 16, "k": 9, "tile_m": 3, "tile_n": 1, "threads": 32, "grouping": 5, "minblocks": 27, "algorithm": "medium", "perf": 2153.33, "source": "autotuned"},
{"m": 5, "n": 16, "k": 13, "tile_m": 3, "tile_n": 1, "threads": 32, "grouping": 7, "minblocks": 26, "algorithm": "medium", "perf": 2497.28, "source": "autotuned"},
{"m": 5, "n": 16, "k": 15, "tile_m": 3, "tile_n": 1, "threads": 96, "grouping": 11, "minblocks": 13, "algorithm": "medium", "perf": 2721.94, "source": "autotuned"},
{"m": 5, "n": 16, "k": 16, "tile_m": 3, "tile_n": 1, "w": 6, "v": 16, "threads": 32, "grouping": 16, "minblocks": 2, "algorithm": "largeDB2", "perf": 2978.44, "source": "autotuned"},
{"m": 5, "n": 16, "k": 22, "tile_m": 3, "tile_n": 1, "w": 10, "v": 16, "threads": 32, "grouping": 16, "minblocks": 12, "algorithm": "largeDB2", "perf": 3303.1, "source": "autotuned"},
{"m": 5, "n": 16, "k": 23, "tile_m": 3, "tile_n": 1, "w": 10, "v": 16, "threads": 32, "grouping": 16, "minblocks": 1, "algorithm": "largeDB2", "perf": 3330.35, "source": "autotuned"},
{"m": 5, "n": 16, "k": 25, "tile_m": 3, "tile_n": 1, "threads": 32, "grouping": 8, "minblocks": 3, "algorithm": "medium", "perf": 3242.5, "source": "autotuned"},
{"m": 5, "n": 16, "k": 26, "tile_m": 3, "tile_n": 1, "w": 10, "v": 16, "threads": 32, "grouping": 16, "minblocks": 12, "algorithm": "largeDB2", "perf": 3301.75, "source": "autotuned"},
{"m": 5, "n": 16, "k": 32, "tile_m": 3, "tile_n": 1, "threads": 32, "grouping": 8, "minblocks": 6, "algorithm": "medium", "perf": 3372.8, "source": "autotuned"},
{"m": 5, "n": 16, "k": 45, "tile_m": 3, "tile_n": 1, "threads": 32, "grouping": 11, "minblocks": 7, "algorithm": "medium", "perf": 3613.17, "source": "autotuned"},
{"m": 5, "n": 22, "k": 4, "tile_m": 3, "tile_n": 2, "threads": 96, "grouping": 12, "minblocks": 12, "algorithm": "medium", "perf": 1690.98, "source": "autotuned"},
{"m": 5, "n": 22, "k": 5, "tile_m": 5, "tile_n": 1, "threads": 32, "grouping": 8, "minblocks": 5, "algorithm": "medium", "perf": 1910.02, "source": "autotuned"},
{"m": 5, "n": 22, "k": 6, "tile_m": 3, "tile_n": 2, "threads": 32, "grouping": 8, "minblocks": 10, "algorithm": "medium", "perf": 2189.74, "source": "autotuned"},
{"m": 5, "n": 22, "k": 7, "tile_m": 3, "tile_n": 1, "threads": 64, "grouping": 7, "minblocks": 23, "algorithm": "medium", "perf": 2147.39, "source": "autotuned"},
{"m": 5, "n": 22, "k": 8, "tile_m": 3, "tile_n": 2, "threads": 32, "grouping": 5, "minblocks": 25, "algorithm": "medium", "perf": 2386.03, "source": "autotuned"},
{"m": 5, "n": 22, "k": 9, "tile_m": 5, "tile_n": 1, "threads": 64, "grouping": 9, "minblocks": 15, "algorithm": "medium", "perf": 2350.42, "source": "autotuned"},
{"m": 5, "n": 22, "k": 10, "tile_m": 3, "tile_n": 2, "threads": 32, "grouping": 5, "minblocks": 25, "algorithm": "medium", "perf": 2624.41, "source": "autotuned"},
{"m": 5, "n": 22, "k": 13, "tile_m": 3, "tile_n": 2, "w": 6, "v": 22, "threads": 32, "grouping": 16, "minblocks": 2, "algorithm": "largeDB2", "perf": 2904.46, "source": "autotuned"},
{"m": 5, "n": 22, "k": 15, "tile_m": 3, "tile_n": 2, "w": 6, "v": 22, "threads": 32, "grouping": 16, "minblocks": 4, "algorithm": "largeDB2", "perf": 2954.89, "source": "autotuned"},
{"m": 5, "n": 22, "k": 16, "tile_m": 3, "tile_n": 2, "threads": 32, "grouping": 8, "minblocks": 3, "algorithm": "medium", "perf": 3303.1, "source": "autotuned"},
{"m": 5, "n": 22, "k": 22, "tile_m": 3, "tile_n": 2, "threads": 32, "grouping": 8, "minblocks": 13, "algorithm": "medium", "perf": 3444.45, "source": "autotuned"},
{"m": 5, "n": 22, "k": 23, "tile_m": 3, "tile_n": 2, "w": 10, "v": 22, "threads": 32, "grouping": 16, "minblocks": 4, "algorithm": "largeDB2", "perf": 3289.95, "source": "autotuned"},
{"m": 5, "n": 22, "k": 25, "tile_m": 3, "tile_n": 2, "w": 12, "v": 22, "threads": 32, "grouping": 16, "minblocks": 8, "algorithm": "largeDB2", "perf": 3373.22, "source": "autotuned"},
{"m": 5, "n": 22, "k": 26, "tile_m": 3, "tile_n": 2, "w": 12, "v": 16, "threads": 32, "grouping": 16, "minblocks": 12, "algorithm": "largeDB2", "perf": 3289.33, "source": "autotuned"},
{"m": 5, "n": 22, "k": 32, "tile_m": 3, "tile_n": 2, "threads": 32, "grouping": 12, "minblocks": 8, "algorithm": "medium", "perf": 3635.0, "source": "autotuned"},
{"m": 5, "n": 22, "k": 45, "tile_m": 3, "tile_n": 2, "w": 20, "v": 22, "threads": 32, "grouping": 16, "minblocks": 4, "algorithm": "largeDB2", "perf": 3850.35, "source": "autotuned"},
{"m": 5, "n": 23, "k": 4, "tile_m": 5, "tile_n": 1, "threads": 96, "grouping": 8, "minblocks": 15, "algorithm": "medium", "perf": 1747.87, "source": "autotuned"},
{"m": 5, "n": 23, "k": 5, "tile_m": 3, "tile_n": 2, "threads": 32, "grouping": 8, "minblocks": 3, "algorithm": "medium", "perf": 1973.66, "source": "autotuned"},
{"m": 5, "n": 23, "k": 9, "tile_m": 3, "tile_n": 2, "threads": 32, "grouping": 5, "minblocks": 25, "algorithm": "medium", "perf": 2453.86, "source": "autotuned"},
{"m": 5, "n": 23, "k": 13, "tile_m": 3, "tile_n": 2, "threads": 32, "grouping": 8, "minblocks": 4, "algorithm": "medium", "perf": 2969.41, "source": "autotuned"},
{"m": 5, "n": 23, "k": 16, "tile_m": 3, "tile_n": 2, "threads": 32, "grouping": 8, "minblocks": 11, "algorithm": "medium", "perf": 3272.13, "source": "autotuned"},
{"m": 5, "n": 23, "k": 22, "tile_m": 5, "tile_n": 1, "threads": 32, "grouping": 8, "minblocks": 13, "algorithm": "medium", "perf": 3238.38, "source": "autotuned"},
{"m": 5, "n": 23, "k": 23, "tile_m": 5, "tile_n": 1, "w": 10, "v": 16, "threads": 32, "grouping": 16, "minblocks": 1, "algorithm": "largeDB2", "perf": 3242.43, "source": "autotuned"},
{"m": 5, "n": 23, "k": 26, "tile_m": 3, "tile_n": 2, "threads": 32, "grouping": 12, "minblocks": 9, "algorithm": "medium", "perf": 3464.74, "source": "autotuned"},
{"m": 5, "n": 24, "k": 5, "tile_m": 5, "tile_n": 1, "threads": 32, "grouping": 5, "minblocks": 27, "algorithm": "medium", "perf": 2054.73, "source": "autotuned"},
{"m": 5, "n": 24, "k": 13, "tile_m": 3, "tile_n": 2, "w": 6, "v": 24, "threads": 32, "grouping": 16, "minblocks": 8, "algorithm": "largeDB2", "perf": 3169.31, "source": "autotuned"},
{"m": 5, "n": 24, "k": 24, "tile_m": 3, "tile_n": 2, "threads": 32, "grouping": 12, "minblocks": 3, "algorithm": "medium", "perf": 3600.0, "source": "autotuned"},
{"m": 5, "n": 24, "k": 26, "tile_m": 3, "tile_n": 2, "threads": 32, "grouping": 12, "minblocks": 7, "algorithm": "medium", "perf": 3722.09, "source": "autotuned"},
{"m": 5, "n": 24, "k": 32, "tile_m": 3, "tile_n": 2, "threads": 32, "grouping": 12, "minblocks": 2, "algorithm": "medium", "perf": 3833.53, "source": "autotuned"},
{"m": 5, "n": 25, "k": 4, "tile_m": 3, "tile_n": 2, "threads": 32, "grouping": 8, "minblocks": 8, "algorithm": "medium", "perf": 1809.54, "source": "autotuned"},
{"m": 5, "n": 25, "k": 5, "tile_m": 3, "tile_n": 2, "threads": 32, "grouping": 8, "minblocks": 5, "algorithm": "medium", "perf": 2149.55, "source": "autotuned"},
{"m": 5, "n": 25, "k": 7, "tile_m": 5, "tile_n": 1, "threads": 64, "grouping": 9, "minblocks": 15, "algorithm": "medium", "perf": 2375.23, "source": "autotuned"},
{"m": 5, "n": 25, "k": 9, "tile_m": 5, "tile_n": 1, "threads": 64, "grouping": 9, "minblocks": 15, "algorithm": "medium", "perf": 2636.61, "source": "autotuned"},
{"m": 5, "n": 25, "k": 13, "tile_m": 3, "tile_n": 2, "threads": 32, "grouping": 8, "minblocks": 11, "algorithm": "medium", "perf": 3119.98, "source": "autotuned"},
{"m": 5, "n": 25, "k": 15, "tile_m": 3, "tile_n": 2, "threads": 32, "grouping": 8, "minblocks": 14, "algorithm": "medium", "perf": 3332.4, "source": "autotuned"},
{"m": 5, "n": 25, "k": 16, "tile_m": 3, "tile_n": 2, "threads": 32, "grouping": 8, "minblocks": 16, "algorithm": "medium", "perf": 3392.81, "source": "autotuned"},
{"m": 5, "n": 25, "k": 22, "tile_m": 3, "tile_n": 2, "w": 10, "v": 14, "threads": 32, "grouping": 16, "minblocks": 8, "algorithm": "largeDB2", "perf": 3368.06, "source": "autotuned"},
{"m": 5, "n": 25, "k": 25, "tile_m": 3, "tile_n": 2, "threads": 32, "grouping": 11, "minblocks": 5, "algorithm": "medium", "perf": 3541.18, "source": "autotuned"},
{"m": 5, "n": 25, "k": 26, "tile_m": 3, "tile_n": 2, "threads": 32, "grouping": 12, "minblocks": 8, "algorithm": "medium", "perf": 3644.64, "source": "autotuned"},
{"m": 5, "n": 25, "k": 28, "tile_m": 3, "tile_n": 2, "threads": 32, "grouping": 12, "minblocks": 3, "algorithm": "medium", "perf": 3662.23, "source": "autotuned"},
{"m": 5, "n": 25, "k": 32, "tile_m": 3, "tile_n": 2, "threads": 32, "grouping": 12, "minblocks": 1, "algorithm": "medium", "perf": 3801.06, "source": "autotuned"},
{"m": 5, "n": 25, "k": 45, "tile_m": 3, "tile_n": 2, "w": 16, "v": 24, "threads": 32, "grouping": 16, "minblocks": 12, "algorithm": "largeDB2", "perf": 3992.5, "source": "autotuned"},
{"m": 5, "n": 26, "k": 4, "tile_m": 3, "tile_n": 2, "threads": 32, "grouping": 8, "minblocks": 8, "algorithm": "medium", "perf": 1939.7, "source": "autotuned"},
{"m": 5, "n": 26, "k": 5, "tile_m": 5, "tile_n": 1, "threads": 32, "grouping": 8, "minblocks": 2, "algorithm": "medium", "perf": 2202.11, "source": "autotuned"},
{"m": 5, "n": 26, "k": 6, "tile_m": 3, "tile_n": 2, "threads": 32, "grouping": 8, "minblocks": 6, "algorithm": "medium", "perf": 2637.07, "source": "autotuned"},
{"m": 5, "n": 26, "k": 7, "tile_m": 5, "tile_n": 1, "threads": 64, "grouping": 9, "minblocks": 16, "algorithm": "medium", "perf": 2433.92, "source": "autotuned"},
{"m": 5, "n": 26, "k": 8, "tile_m": 3, "tile_n": 2, "threads": 32, "grouping": 5, "minblocks": 25, "algorithm": "medium", "perf": 2708.59, "source": "autotuned"},
{"m": 5, "n": 26, "k": 9, "tile_m": 5, "tile_n": 1, "threads": 64, "grouping": 9, "minblocks": 15, "algorithm": "medium", "perf": 2718.62, "source": "autotuned"},
{"m": 5, "n": 26, "k": 10, "tile_m": 3, "tile_n": 2, "threads": 32, "grouping": 5, "minblocks": 25, "algorithm": "medium", "perf": 2981.06, "source": "autotuned"},
{"m": 5, "n": 26, "k": 12, "tile_m": 3, "tile_n": 2, "threads": 32, "grouping": 8, "minblocks": 15, "algorithm": "medium", "perf": 3301.75, "source": "autotuned"},
{"m": 5, "n": 26, "k": 13, "tile_m": 3, "tile_n": 2, "w": 6, "v": 26, "threads": 32, "grouping": 16, "minblocks": 1, "algorithm": "largeDB2", "perf": 3366.63, "source": "autotuned"},
{"m": 5, "n": 26, "k": 15, "tile_m": 3, "tile_n": 2, "w": 6, "v": 26, "threads": 32, "grouping": 16, "minblocks": 8, "algorithm": "largeDB2", "perf": 3550.87, "source": "autotuned"},
{"m": 5, "n": 26, "k": 16, "tile_m": 3, "tile_n": 2, "threads": 32, "grouping": 8, "minblocks": 14, "algorithm": "medium", "perf": 3750.05, "source": "autotuned"},
{"m": 5, "n": 26, "k": 22, "tile_m": 3, "tile_n": 2, "w": 10, "v": 26, "threads": 32, "grouping": 16, "minblocks": 4, "algorithm": "largeDB2", "perf": 3493.15, "source": "autotuned"},
{"m": 5, "n": 26, "k": 23, "tile_m": 3, "tile_n": 2, "threads": 32, "grouping": 11, "minblocks": 7, "algorithm": "medium", "perf": 3640.82, "source": "autotuned"},
{"m": 5, "n": 26, "k": 24, "tile_m": 3, "tile_n": 2, "threads": 32, "grouping": 12, "minblocks": 4, "algorithm": "medium", "perf": 3848.3, "source": "autotuned"},
{"m": 5, "n": 26, "k": 25, "tile_m": 3, "tile_n": 2, "threads": 32, "grouping": 11, "minblocks": 2, "algorithm": "medium", "perf": 3681.78, "source": "autotuned"},
{"m": 5, "n": 26, "k": 26, "tile_m": 3, "tile_n": 2, "threads": 32, "grouping": 12, "minblocks": 9, "algorithm": "medium", "perf": 3831.95, "source": "autotuned"},
{"m": 5, "n": 26, "k": 28, "tile_m": 3, "tile_n": 2, "threads": 32, "grouping": 12, "minblocks": 6, "algorithm": "medium", "perf": 3865.33, "source": "autotuned"},
{"m": 5, "n": 26, "k": 32, "tile_m": 3, "tile_n": 2, "threads": 32, "grouping": 12, "minblocks": 3, "algorithm": "medium", "perf": 4074.38, "source": "autotuned"},
{"m": 5, "n": 26, "k": 45, "tile_m": 3, "tile_n": 2, "w": 18, "v": 26, "threads": 32, "grouping": 16, "minblocks": 1, "algorithm": "largeDB2", "perf": 4125.85, "source": "autotuned"},
{"m": 5, "n": 28, "k": 4, "tile_m": 3, "tile_n": 2, "threads": 32, "grouping": 8, "minblocks": 13, "algorithm": "medium", "perf": 2050.56, "source": "autotuned"},
{"m": 5, "n": 28, "k": 5, "tile_m": 5, "tile_n": 1, "threads": 32, "grouping": 8, "minblocks": 15, "algorithm": "medium", "perf": 2359.04, "source": "autotuned"},
{"m": 5, "n": 28, "k": 7, "tile_m": 5, "tile_n": 1, "threads": 64, "grouping": 9, "minblocks": 15, "algorithm": "medium", "perf": 2499.19, "source": "autotuned"},
{"m": 5, "n": 28, "k": 9, "tile_m": 5, "tile_n": 1, "threads": 64, "grouping": 9, "minblocks": 17, "algorithm": "medium", "perf": 2919.08, "source": "autotuned"},
{"m": 5, "n": 28, "k": 13, "tile_m": 3, "tile_n": 2, "w": 6, "v": 28, "threads": 32, "grouping": 16, "minblocks": 8, "algorithm": "largeDB2", "perf": 3512.35, "source": "autotuned"},
{"m": 5, "n": 28, "k": 25, "tile_m": 3, "tile_n": 2, "threads": 32, "grouping": 11, "minblocks": 7, "algorithm": "medium", "perf": 3870.04, "source": "autotuned"},
{"m": 5, "n": 28, "k": 26, "tile_m": 3, "tile_n": 2, "threads": 32, "grouping": 12, "minblocks": 7, "algorithm": "medium", "perf": 4033.76, "source": "autotuned"},
{"m": 5, "n": 28, "k": 28, "tile_m": 3, "tile_n": 2, "threads": 32, "grouping": 12, "minblocks": 1, "algorithm": "medium", "perf": 4062.04, "source": "autotuned"},
{"m": 5, "n": 28, "k": 32, "tile_m": 3, "tile_n": 2, "threads": 32, "grouping": 12, "minblocks": 1, "algorithm": "medium", "perf": 4242.41, "source": "autotuned"},
{"m": 5, "n": 28, "k": 45, "tile_m": 3, "tile_n": 2, "w": 18, "v": 28, "threads": 32, "grouping": 16, "minblocks": 12, "algorithm": "largeDB2", "perf": 4234.25, "source": "autotuned"},
{"m": 5, "n": 32, "k": 4, "tile_m": 3, "tile_n": 2, "threads": 32, "grouping": 8, "minblocks": 9, "algorithm": "medium", "perf": 2251.3, "source": "autotuned"},
{"m": 5, "n": 32, "k": 5, "tile_m": 5, "tile_n": 1, "threads": 32, "grouping": 8, "minblocks": 4, "algorithm": "medium", "perf": 2603.85, "source": "autotuned"},
{"m": 5, "n": 32, "k": 6, "tile_m": 3, "tile_n": 2, "threads": 32, "grouping": 8, "minblocks": 22, "algorithm": "medium", "perf": 3023.47, "source": "autotuned"},
{"m": 5, "n": 32, "k": 7, "tile_m": 5, "tile_n": 1, "threads": 64, "grouping": 9, "minblocks": 18, "algorithm": "medium", "perf": 2878.06, "source": "autotuned"},
{"m": 5, "n": 32, "k": 8, "tile_m": 5, "tile_n": 1, "threads": 64, "grouping": 9, "minblocks": 20, "algorithm": "medium", "perf": 3116.17, "source": "autotuned"},
{"m": 5, "n": 32, "k": 9, "tile_m": 3, "tile_n": 2, "w": 4, "v": 32, "threads": 32, "grouping": 16, "minblocks": 1, "algorithm": "largeDB2", "perf": 3350.86, "source": "autotuned"},
{"m": 5, "n": 32, "k": 10, "tile_m": 3, "tile_n": 2, "w": 4, "v": 32, "threads": 32, "grouping": 16, "minblocks": 4, "algorithm": "largeDB2", "perf": 3636.32, "source": "autotuned"},
{"m": 5, "n": 32, "k": 12, "tile_m": 3, "tile_n": 2, "w": 4, "v": 32, "threads": 32, "grouping": 16, "minblocks": 2, "algorithm": "largeDB2", "perf": 4029.23, "source": "autotuned"},
{"m": 5, "n": 32, "k": 13, "tile_m": 3, "tile_n": 2, "w": 6, "v": 32, "threads": 32, "grouping": 16, "minblocks": 2, "algorithm": "largeDB2", "perf": 4002.53, "source": "autotuned"},
{"m": 5, "n": 32, "k": 16, "tile_m": 3, "tile_n": 2, "threads": 32, "grouping": 8, "minblocks": 13, "algorithm": "medium", "perf": 4168.99, "source": "autotuned"},
{"m": 5, "n": 32, "k": 22, "tile_m": 3, "tile_n": 2, "threads": 32, "grouping": 12, "minblocks": 2, "algorithm": "medium", "perf": 4280.11, "source": "autotuned"},
{"m": 5, "n": 32, "k": 24, "tile_m": 3, "tile_n": 2, "threads": 32, "grouping": 12, "minblocks": 6, "algorithm": "medium", "perf": 4365.0, "source": "autotuned"},
{"m": 5, "n": 32, "k": 25, "tile_m": 3, "tile_n": 2, "threads": 32, "grouping": 11, "minblocks": 2, "algorithm": "medium", "perf": 4220.73, "source": "autotuned"},
{"m": 5, "n": 32, "k": 26, "tile_m": 3, "tile_n": 2, "threads": 32, "grouping": 12, "minblocks": 6, "algorithm": "medium", "perf": 4380.32, "source": "autotuned"},
{"m": 5, "n": 32, "k": 28, "tile_m": 3, "tile_n": 2, "threads": 32, "grouping": 12, "minblocks": 5, "algorithm": "medium", "perf": 4392.09, "source": "autotuned"},
{"m": 5, "n": 32, "k": 32, "tile_m": 3, "tile_n": 2, "threads": 32, "grouping": 12, "minblocks": 4, "algorithm": "medium", "perf": 4576.94, "source": "autotuned"},
{"m": 5, "n": 32, "k": 45, "tile_m": 3, "tile_n": 2, "w": 22, "v": 32, "threads": 32, "grouping": 16, "minblocks": 8, "algorithm": "largeDB2", "perf": 4466.97, "source": "autotuned"},
{"m": 5, "n": 45, "k": 4, "tile_m": 3, "tile_n": 3, "threads": 32, "grouping": 8, "minblocks": 9, "algorithm": "medium", "perf": 2608.93, "source": "autotuned"},
{"m": 5, "n": 45, "k": 5, "tile_m": 3, "tile_n": 3, "threads": 32, "grouping": 8, "minblocks": 14, "algorithm": "medium", "perf": 3064.83, "source": "autotuned"},
{"m": 5, "n": 45, "k": 6, "tile_m": 3, "tile_n": 3, "threads": 32, "grouping": 8, "minblocks": 2, "algorithm": "medium", "perf": 3472.51, "source": "autotuned"},
{"m": 5, "n": 45, "k": 7, "tile_m": 5, "tile_n": 2, "threads": 32, "grouping": 8, "minblocks": 1, "algorithm": "medium", "perf": 3246.52, "source": "autotuned"},
{"m": 5, "n": 45, "k": 8, "tile_m": 3, "tile_n": 3, "threads": 96, "grouping": 11, "minblocks": 11, "algorithm": "medium", "perf": 3499.64, "source": "autotuned"},
{"m": 5, "n": 45, "k": 9, "tile_m": 3, "tile_n": 3, "threads": 32, "grouping": 8, "minblocks": 15, "algorithm": "medium", "perf": 3684.09, "source": "autotuned"},
{"m": 5, "n": 45, "k": 10, "tile_m": 3, "tile_n": 3, "threads": 32, "grouping": 8, "minblocks": 16, "algorithm": "medium", "perf": 3843.41, "source": "autotuned"},
{"m": 5, "n": 45, "k": 13, "tile_m": 3, "tile_n": 3, "threads": 32, "grouping": 11, "minblocks": 9, "algorithm": "medium", "perf": 4153.18, "source": "autotuned"},
{"m": 5, "n": 45, "k": 15, "tile_m": 3, "tile_n": 3, "threads": 32, "grouping": 11, "minblocks": 7, "algorithm": "medium", "perf": 4293.41, "source": "autotuned"},
{"m": 5, "n": 45, "k": 16, "tile_m": 3, "tile_n": 3, "threads": 32, "grouping": 11, "minblocks": 9, "algorithm": "medium", "perf": 4389.83, "source": "autotuned"},
{"m": 5, "n": 45, "k": 22, "tile_m": 3, "tile_n": 3, "threads": 32, "grouping": 16, "minblocks": 1, "algorithm": "medium", "perf": 4157.47, "source": "autotuned"},
{"m": 5, "n": 45, "k": 25, "tile_m": 3, "tile_n": 3, "threads": 32, "grouping": 16, "minblocks": 1, "algorithm": "medium", "perf": 4321.63, "source": "autotuned"},
{"m": 5, "n": 45, "k": 26, "tile_m": 3, "tile_n": 3, "threads": 32, "grouping": 16, "minblocks": 5, "algorithm": "medium", "perf": 4358.36, "source": "autotuned"},
{"m": 5, "n": 45, "k": 28, "tile_m": 3, "tile_n": 3, "threads": 32, "grouping": 16, "minblocks": 5, "algorithm": "medium", "perf": 4416.24, "source": "autotuned"},
{"m": 5, "n": 45, "k": 32, "tile_m": 3, "tile_n": 3, "threads": 32, "grouping": 16, "minblocks": 1, "algorithm": "medium", "perf": 4593.27, "source": "autotuned"},
{"m": 5, "n": 45, "k": 45, "tile_m": 3, "tile_n": 3, "w": 16, "v": 26, "threads": 32, "grouping": 16, "minblocks": 4, "algorithm": "largeDB2", "perf": 4542.46, "source": "autotuned"},
{"m": 6, "n": 4, "k": 4, "tile_m": 1, "tile_n": 1, "threads": 32, "grouping": 8, "minblocks": 13, "algorithm": "medium", "perf": 554.052, "source": "autotuned"},
{"m": 6, "n": 4, "k": 5, "tile_m": 1, "tile_n": 1, "threads": 32, "grouping": 8, "minblocks": 9, "algorithm": "medium", "perf": 660.559, "source": "autotuned"},
{"m": 6, "n": 4, "k": 6, "tile_m": 1, "tile_n": 1, "threads": 64, "grouping": 9, "minblocks": 23, "algorithm": "medium", "perf": 729.256, "source": "autotuned"},
{"m": 6, "n": 4, "k": 7, "tile_m": 1, "tile_n": 1, "threads": 64, "grouping": 9, "minblocks": 16, "algorithm": "medium", "perf": 824.825, "source": "autotuned"},
{"m": 6, "n": 4, "k": 8, "tile_m": 1, "tile_n": 1, "threads": 64, "grouping": 9, "minblocks": 3, "algorithm": "medium", "perf": 912.099, "source": "autotuned"},
{"m": 6, "n": 4, "k": 9, "tile_m": 1, "tile_n": 1, "threads": 64, "grouping": 9, "minblocks": 27, "algorithm": "medium", "perf": 958.506, "source": "autotuned"},
{"m": 6, "n": 4, "k": 10, "tile_m": 1, "tile_n": 1, "threads": 64, "grouping": 4, "minblocks": 25, "algorithm": "medium", "perf": 1035.75, "source": "autotuned"},
{"m": 6, "n": 4, "k": 13, "tile_m": 1, "tile_n": 1, "threads": 96, "grouping": 8, "minblocks": 17, "algorithm": "medium", "perf": 1177.73, "source": "autotuned"},
{"m": 6, "n": 4, "k": 15, "tile_m": 1, "tile_n": 2, "threads": 96, "grouping": 8, "minblocks": 14, "algorithm": "medium", "perf": 1281.41, "source": "autotuned"},
{"m": 6, "n": 4, "k": 22, "tile_m": 1, "tile_n": 1, "threads": 32, "grouping": 4, "minblocks": 19, "algorithm": "medium", "perf": 1402.75, "source": "autotuned"},
{"m": 6, "n": 4, "k": 26, "tile_m": 1, "tile_n": 1, "threads": 160, "grouping": 11, "minblocks": 11, "algorithm": "medium", "perf": 1518.35, "source": "autotuned"},
{"m": 6, "n": 4, "k": 32, "tile_m": 1, "tile_n": 1, "threads": 32, "grouping": 3, "minblocks": 11, "algorithm": "medium", "perf": 1612.26, "source": "autotuned"},
{"m": 6, "n": 4, "k": 45, "tile_m": 1, "tile_n": 1, "w": 16, "v": 4, "threads": 32, "grouping": 16, "minblocks": 2, "algorithm": "largeDB2", "perf": 1826.86, "source": "autotuned"},
{"m": 6, "n": 5, "k": 4, "tile_m": 1, "tile_n": 1, "threads": 32, "grouping": 7, "minblocks": 3, "algorithm": "medium", "perf": 683.787, "source": "autotuned"},
{"m": 6, "n": 5, "k": 5, "tile_m": 1, "tile_n": 1, "threads": 32, "grouping": 8, "minblocks": 6, "algorithm": "medium", "perf": 843.417, "source": "autotuned"},
{"m": 6, "n": 5, "k": 6, "tile_m": 1, "tile_n": 1, "threads": 64, "grouping": 8, "minblocks": 10, "algorithm": "medium", "perf": 925.912, "source": "autotuned"},
{"m": 6, "n": 5, "k": 7, "tile_m": 1, "tile_n": 1, "threads": 64, "grouping": 8, "minblocks": 10, "algorithm": "medium", "perf": 1020.74, "source": "autotuned"},
{"m": 6, "n": 5, "k": 8, "tile_m": 1, "tile_n": 1, "threads": 64, "grouping": 8, "minblocks": 10, "algorithm": "medium", "perf": 1159.78, "source": "autotuned"},
{"m": 6, "n": 5, "k": 9, "tile_m": 1, "tile_n": 1, "threads": 64, "grouping": 8, "minblocks": 10, "algorithm": "medium", "perf": 1241.4, "source": "autotuned"},
{"m": 6, "n": 5, "k": 10, "tile_m": 1, "tile_n": 1, "threads": 64, "grouping": 4, "minblocks": 25, "algorithm": "medium", "perf": 1304.06, "source": "autotuned"},
{"m": 6, "n": 5, "k": 13, "tile_m": 1, "tile_n": 1, "threads": 96, "grouping": 8, "minblocks": 17, "algorithm": "medium", "perf": 1455.51, "source": "autotuned"},
{"m": 6, "n": 5, "k": 14, "tile_m": 1, "tile_n": 1, "threads": 96, "grouping": 8, "minblocks": 21, "algorithm": "medium", "perf": 1476.11, "source": "autotuned"},
{"m": 6, "n": 5, "k": 15, "tile_m": 1, "tile_n": 1, "threads": 96, "grouping": 8, "minblocks": 21, "algorithm": "medium", "perf": 1581.7, "source": "autotuned"},
{"m": 6, "n": 5, "k": 22, "tile_m": 1, "tile_n": 1, "threads": 160, "grouping": 11, "minblocks": 11, "algorithm": "medium", "perf": 1718.79, "source": "autotuned"},
{"m": 6, "n": 5, "k": 26, "tile_m": 1, "tile_n": 1, "threads": 160, "grouping": 11, "minblocks": 10, "algorithm": "medium", "perf": 1856.89, "source": "autotuned"},
{"m": 6, "n": 5, "k": 32, "tile_m": 1, "tile_n": 1, "threads": 32, "grouping": 2, "minblocks": 18, "algorithm": "medium", "perf": 1944.84, "source": "autotuned"},
{"m": 6, "n": 5, "k": 45, "tile_m": 1, "tile_n": 1, "threads": 32, "grouping": 8, "minblocks": 6, "algorithm": "medium", "perf": 2061.01, "source": "autotuned"},
{"m": 6, "n": 6, "k": 4, "tile_m": 1, "tile_n": 2, "threads": 32, "grouping": 10, "minblocks": 16, "algorithm": "medium", "perf": 796.392, "source": "autotuned"},
{"m": 6, "n": 6, "k": 5, "tile_m": 1, "tile_n": 2, "threads": 32, "grouping": 10, "minblocks": 16, "algorithm": "medium", "perf": 930.976, "source": "autotuned"},
{"m": 6, "n": 6, "k": 6, "tile_m": 1, "tile_n": 2, "threads": 64, "grouping": 9, "minblocks": 18, "algorithm": "medium", "perf": 1009.74, "source": "autotuned"},
{"m": 6, "n": 6, "k": 7, "tile_m": 1, "tile_n": 2, "threads": 64, "grouping": 9, "minblocks": 19, "algorithm": "medium", "perf": 1131.64, "source": "autotuned"},
{"m": 6, "n": 6, "k": 8, "tile_m": 1, "tile_n": 2, "threads": 64, "grouping": 9, "minblocks": 2, "algorithm": "medium", "perf": 1239.41, "source": "autotuned"},
{"m": 6, "n": 6, "k": 9, "tile_m": 1, "tile_n": 2, "threads": 64, "grouping": 9, "minblocks": 23, "algorithm": "medium", "perf": 1299.41, "source": "autotuned"},
{"m": 6, "n": 6, "k": 10, "tile_m": 1, "tile_n": 2, "threads": 64, "grouping": 9, "minblocks": 21, "algorithm": "medium", "perf": 1415.47, "source": "autotuned"},
{"m": 6, "n": 6, "k": 13, "tile_m": 1, "tile_n": 2, "threads": 32, "grouping": 6, "minblocks": 14, "algorithm": "small", "perf": 1591.29, "source": "autotuned"},
{"m": 6, "n": 6, "k": 14, "tile_m": 1, "tile_n": 2, "threads": 32, "grouping": 7, "minblocks": 6, "algorithm": "small", "perf": 1626.75, "source": "autotuned"},
{"m": 6, "n": 6, "k": 15, "tile_m": 1, "tile_n": 2, "threads": 96, "grouping": 9, "minblocks": 14, "algorithm": "medium", "perf": 1684.14, "source": "autotuned"},
{"m": 6, "n": 6, "k": 22, "tile_m": 1, "tile_n": 2, "threads": 32, "grouping": 8, "minblocks": 27, "algorithm": "medium", "perf": 1860.32, "source": "autotuned"},
{"m": 6, "n": 6, "k": 26, "tile_m": 1, "tile_n": 2, "threads": 32, "grouping": 8, "minblocks": 25, "algorithm": "medium", "perf": 1984.32, "source": "autotuned"},
{"m": 6, "n": 6, "k": 32, "tile_m": 1, "tile_n": 2, "threads": 32, "grouping": 4, "minblocks": 10, "algorithm": "medium", "perf": 2109.78, "source": "autotuned"},
{"m": 6, "n": 6, "k": 45, "tile_m": 1, "tile_n": 2, "threads": 32, "grouping": 8, "minblocks": 5, "algorithm": "medium", "perf": 2366.69, "source": "autotuned"},
{"m": 6, "n": 7, "k": 4, "tile_m": 1, "tile_n": 2, "threads": 32, "grouping": 9, "minblocks": 9, "algorithm": "medium", "perf": 889.676, "source": "autotuned"},
{"m": 6, "n": 7, "k": 5, "tile_m": 1, "tile_n": 2, "threads": 64, "grouping": 8, "minblocks": 21, "algorithm": "medium", "perf": 1002.17, "source": "autotuned"},
{"m": 6, "n": 7, "k": 6, "tile_m": 1, "tile_n": 2, "threads": 64, "grouping": 8, "minblocks": 24, "algorithm": "medium", "perf": 1146.45, "source": "autotuned"},
{"m": 6, "n": 7, "k": 7, "tile_m": 1, "tile_n": 2, "threads": 64, "grouping": 9, "minblocks": 21, "algorithm": "medium", "perf": 1279.85, "source": "autotuned"},
{"m": 6, "n": 7, "k": 8, "tile_m": 1, "tile_n": 2, "threads": 64, "grouping": 9, "minblocks": 22, "algorithm": "medium", "perf": 1402.17, "source": "autotuned"},
{"m": 6, "n": 7, "k": 9, "tile_m": 1, "tile_n": 2, "threads": 64, "grouping": 9, "minblocks": 24, "algorithm": "medium", "perf": 1513.94, "source": "autotuned"},
{"m": 6, "n": 7, "k": 10, "tile_m": 1, "tile_n": 2, "threads": 96, "grouping": 8, "minblocks": 21, "algorithm": "medium", "perf": 1519.75, "source": "autotuned"},
{"m": 6, "n": 7, "k": 13, "tile_m": 1, "tile_n": 2, "threads": 96, "grouping": 8, "minblocks": 18, "algorithm": "medium", "perf": 1776.95, "source": "autotuned"},
{"m": 6, "n": 7, "k": 15, "tile_m": 1, "tile_n": 2, "threads": 128, "grouping": 8, "minblocks": 13, "algorithm": "medium", "perf": 1813.93, "source": "autotuned"},
{"m": 6, "n": 7, "k": 22, "tile_m": 1, "tile_n": 2, "threads": 160, "grouping": 16, "minblocks": 8, "algorithm": "medium", "perf": 2045.58, "source": "autotuned"},
{"m": 6, "n": 7, "k": 26, "tile_m": 1, "tile_n": 2, "threads": 32, "grouping": 8, "minblocks": 3, "algorithm": "medium", "perf": 2107.66, "source": "autotuned"},
{"m": 6, "n": 7, "k": 32, "tile_m": 1, "tile_n": 2, "threads": 32, "grouping": 4, "minblocks": 15, "algorithm": "medium", "perf": 2253.64, "source": "autotuned"},
{"m": 6, "n": 7, "k": 45, "tile_m": 1, "tile_n": 2, "threads": 32, "grouping": 8, "minblocks": 4, "algorithm": "medium", "perf": 2403.8, "source": "autotuned"},
{"m": 6, "n": 8, "k": 4, "tile_m": 1, "tile_n": 2, "threads": 64, "grouping": 9, "minblocks": 18, "algorithm": "medium", "perf": 1017.1, "source": "autotuned"},
{"m": 6, "n": 8, "k": 5, "tile_m": 1, "tile_n": 2, "threads": 64, "grouping": 9, "minblocks": 18, "algorithm": "medium", "perf": 1192.58, "source": "autotuned"},
{"m": 6, "n": 8, "k": 6, "tile_m": 1, "tile_n": 2, "threads": 64, "grouping": 9, "minblocks": 18, "algorithm": "medium", "perf": 1388.15, "source": "autotuned"},
{"m": 6, "n": 8, "k": 7, "tile_m": 1, "tile_n": 2, "threads": 64, "grouping": 13, "minblocks": 13, "algorithm": "medium", "perf": 1510.13, "source": "autotuned"},
{"m": 6, "n": 8, "k": 8, "tile_m": 1, "tile_n": 2, "threads": 64, "grouping": 5, "minblocks": 25, "algorithm": "small", "perf": 1446.95, "source": "autotuned"},
{"m": 6, "n": 8, "k": 9, "tile_m": 1, "tile_n": 2, "threads": 96, "grouping": 8, "minblocks": 14, "algorithm": "medium", "perf": 1629.82, "source": "autotuned"},
{"m": 6, "n": 8, "k": 10, "tile_m": 1, "tile_n": 2, "threads": 96, "grouping": 9, "minblocks": 14, "algorithm": "medium", "perf": 1752.86, "source": "autotuned"},
{"m": 6, "n": 8, "k": 13, "tile_m": 1, "tile_n": 2, "threads": 128, "grouping": 8, "minblocks": 13, "algorithm": "medium", "perf": 1927.42, "source": "autotuned"},
{"m": 6, "n": 8, "k": 15, "tile_m": 1, "tile_n": 2, "threads": 128, "grouping": 8, "minblocks": 16, "algorithm": "medium", "perf": 2085.83, "source": "autotuned"},
{"m": 6, "n": 8, "k": 22, "tile_m": 1, "tile_n": 2, "threads": 32, "grouping": 8, "minblocks": 23, "algorithm": "medium", "perf": 2235.4, "source": "autotuned"},
{"m": 6, "n": 8, "k": 26, "tile_m": 1, "tile_n": 2, "threads": 32, "grouping": 8, "minblocks": 21, "algorithm": "medium", "perf": 2393.39, "source": "autotuned"},
{"m": 6, "n": 8, "k": 32, "tile_m": 1, "tile_n": 2, "w": 14, "v": 8, "threads": 32, "grouping": 16, "minblocks": 12, "algorithm": "largeDB2", "perf": 2669.82, "source": "autotuned"},
{"m": 6, "n": 8, "k": 45, "tile_m": 1, "tile_n": 2, "w": 20, "v": 8, "threads": 32, "grouping": 16, "minblocks": 8, "algorithm": "largeDB2", "perf": 2726.75, "source": "autotuned"},
{"m": 6, "n": 9, "k": 4, "tile_m": 1, "tile_n": 2, "threads": 64, "grouping": 9, "minblocks": 23, "algorithm": "medium", "perf": 1072.16, "source": "autotuned"},
{"m": 6, "n": 9, "k": 5, "tile_m": 1, "tile_n": 2, "threads": 64, "grouping": 9, "minblocks": 23, "algorithm": "medium", "perf": 1286.12, "source": "autotuned"},
{"m": 6, "n": 9, "k": 6, "tile_m": 1, "tile_n": 2, "threads": 64, "grouping": 9, "minblocks": 23, "algorithm": "medium", "perf": 1466.17, "source": "autotuned"},
{"m": 6, "n": 9, "k": 7, "tile_m": 1, "tile_n": 2, "threads": 64, "grouping": 13, "minblocks": 13, "algorithm": "medium", "perf": 1633.45, "source": "autotuned"},
{"m": 6, "n": 9, "k": 8, "tile_m": 1, "tile_n": 2, "threads": 96, "grouping": 8, "minblocks": 19, "algorithm": "medium", "perf": 1677.73, "source": "autotuned"},
{"m": 6, "n": 9, "k": 9, "tile_m": 1, "tile_n": 2, "threads": 96, "grouping": 8, "minblocks": 15, "algorithm": "medium", "perf": 1775.83, "source": "autotuned"},
{"m": 6, "n": 9, "k": 10, "tile_m": 1, "tile_n": 2, "threads": 96, "grouping": 8, "minblocks": 18, "algorithm": "medium", "perf": 1918.75, "source": "autotuned"},
{"m": 6, "n": 9, "k": 13, "tile_m": 1, "tile_n": 2, "threads": 128, "grouping": 8, "minblocks": 14, "algorithm": "medium", "perf": 2097.28, "source": "autotuned"},
{"m": 6, "n": 9, "k": 14, "tile_m": 1, "tile_n": 2, "threads": 128, "grouping": 8, "minblocks": 16, "algorithm": "medium", "perf": 2190.8, "source": "autotuned"},
{"m": 6, "n": 9, "k": 15, "tile_m": 1, "tile_n": 2, "threads": 96, "grouping": 8, "minblocks": 16, "algorithm": "medium", "perf": 2146.93, "source": "autotuned"},
{"m": 6, "n": 9, "k": 22, "tile_m": 1, "tile_n": 2, "threads": 32, "grouping": 8, "minblocks": 21, "algorithm": "medium", "perf": 2401.72, "source": "autotuned"},
{"m": 6, "n": 9, "k": 26, "tile_m": 1, "tile_n": 2, "threads": 32, "grouping": 8, "minblocks": 7, "algorithm": "medium", "perf": 2550.63, "source": "autotuned"},
{"m": 6, "n": 9, "k": 32, "tile_m": 1, "tile_n": 2, "threads": 32, "grouping": 8, "minblocks": 4, "algorithm": "medium", "perf": 2785.4, "source": "autotuned"},
{"m": 6, "n": 9, "k": 45, "tile_m": 1, "tile_n": 2, "threads": 32, "grouping": 8, "minblocks": 11, "algorithm": "medium", "perf": 2889.63, "source": "autotuned"},
{"m": 6, "n": 10, "k": 4, "tile_m": 1, "tile_n": 2, "threads": 64, "grouping": 9, "minblocks": 1, "algorithm": "medium", "perf": 1201.65, "source": "autotuned"},
{"m": 6, "n": 10, "k": 5, "tile_m": 1, "tile_n": 2, "threads": 64, "grouping": 9, "minblocks": 2, "algorithm": "medium", "perf": 1432.35, "source": "autotuned"},
{"m": 6, "n": 10, "k": 6, "tile_m": 1, "tile_n": 2, "threads": 64, "grouping": 9, "minblocks": 19, "algorithm": "medium", "perf": 1652.56, "source": "autotuned"},
{"m": 6, "n": 10, "k": 7, "tile_m": 1, "tile_n": 2, "threads": 96, "grouping": 12, "minblocks": 12, "algorithm": "medium", "perf": 1686.34, "source": "autotuned"},
{"m": 6, "n": 10, "k": 8, "tile_m": 1, "tile_n": 2, "threads": 96, "grouping": 9, "minblocks": 16, "algorithm": "medium", "perf": 1882.94, "source": "autotuned"},
{"m": 6, "n": 10, "k": 9, "tile_m": 1, "tile_n": 2, "threads": 96, "grouping": 8, "minblocks": 14, "algorithm": "medium", "perf": 1986.87, "source": "autotuned"},
{"m": 6, "n": 10, "k": 10, "tile_m": 1, "tile_n": 2, "threads": 128, "grouping": 8, "minblocks": 13, "algorithm": "medium", "perf": 1994.64, "source": "autotuned"},
{"m": 6, "n": 10, "k": 13, "tile_m": 1, "tile_n": 2, "threads": 96, "grouping": 8, "minblocks": 16, "algorithm": "medium", "perf": 2161.34, "source": "autotuned"},
{"m": 6, "n": 10, "k": 14, "tile_m": 1, "tile_n": 2, "threads": 96, "grouping": 8, "minblocks": 15, "algorithm": "medium", "perf": 2268.79, "source": "autotuned"},
{"m": 6, "n": 10, "k": 15, "tile_m": 1, "tile_n": 2, "threads": 96, "grouping": 8, "minblocks": 15, "algorithm": "medium", "perf": 2358.18, "source": "autotuned"},
{"m": 6, "n": 10, "k": 22, "tile_m": 1, "tile_n": 2, "threads": 32, "grouping": 8, "minblocks": 21, "algorithm": "medium", "perf": 2683.77, "source": "autotuned"},
{"m": 6, "n": 10, "k": 26, "tile_m": 1, "tile_n": 2, "w": 12, "v": 10, "threads": 32, "grouping": 16, "minblocks": 4, "algorithm": "largeDB2", "perf": 2858.04, "source": "autotuned"},
{"m": 6, "n": 10, "k": 32, "tile_m": 1, "tile_n": 2, "w": 14, "v": 10, "threads": 32, "grouping": 16, "minblocks": 8, "algorithm": "largeDB2", "perf": 3082.0, "source": "autotuned"},
{"m": 6, "n": 10, "k": 45, "tile_m": 1, "tile_n": 2, "threads": 32, "grouping": 8, "minblocks": 9, "algorithm": "medium", "perf": 3139.6, "source": "autotuned"},
{"m": 6, "n": 13, "k": 4, "tile_m": 4, "tile_n": 1, "threads": 64, "grouping": 9, "minblocks": 5, "algorithm": "medium", "perf": 1411.25, "source": "autotuned"},
{"m": 6, "n": 13, "k": 5, "tile_m": 3, "tile_n": 1, "threads": 96, "grouping": 8, "minblocks": 15, "algorithm": "medium", "perf": 1616.25, "source": "autotuned"},
{"m": 6, "n": 13, "k": 6, "tile_m": 3, "tile_n": 1, "threads": 96, "grouping": 11, "minblocks": 12, "algorithm": "medium", "perf": 1825.68, "source": "autotuned"},
{"m": 6, "n": 13, "k": 7, "tile_m": 3, "tile_n": 1, "threads": 96, "grouping": 11, "minblocks": 12, "algorithm": "medium", "perf": 2035.19, "source": "autotuned"},
{"m": 6, "n": 13, "k": 8, "tile_m": 3, "tile_n": 1, "threads": 128, "grouping": 11, "minblocks": 12, "algorithm": "medium", "perf": 2078.57, "source": "autotuned"},
{"m": 6, "n": 13, "k": 9, "tile_m": 3, "tile_n": 1, "threads": 128, "grouping": 9, "minblocks": 14, "algorithm": "medium", "perf": 2209.46, "source": "autotuned"},
{"m": 6, "n": 13, "k": 10, "tile_m": 3, "tile_n": 1, "threads": 32, "grouping": 5, "minblocks": 25, "algorithm": "medium", "perf": 2226.48, "source": "autotuned"},
{"m": 6, "n": 13, "k": 13, "tile_m": 3, "tile_n": 1, "threads": 96, "grouping": 8, "minblocks": 15, "algorithm": "medium", "perf": 2500.37, "source": "autotuned"},
{"m": 6, "n": 13, "k": 14, "tile_m": 3, "tile_n": 1, "threads": 32, "grouping": 6, "minblocks": 21, "algorithm": "medium", "perf": 2622.38, "source": "autotuned"},
{"m": 6, "n": 13, "k": 15, "tile_m": 3, "tile_n": 1, "threads": 32, "grouping": 7, "minblocks": 27, "algorithm": "medium", "perf": 2676.34, "source": "autotuned"},
{"m": 6, "n": 13, "k": 22, "tile_m": 3, "tile_n": 1, "threads": 32, "grouping": 8, "minblocks": 17, "algorithm": "medium", "perf": 3148.78, "source": "autotuned"},
{"m": 6, "n": 13, "k": 26, "tile_m": 3, "tile_n": 1, "threads": 32, "grouping": 8, "minblocks": 10, "algorithm": "medium", "perf": 3325.63, "source": "autotuned"},
{"m": 6, "n": 13, "k": 32, "tile_m": 3, "tile_n": 1, "threads": 32, "grouping": 8, "minblocks": 5, "algorithm": "medium", "perf": 3422.12, "source": "autotuned"},
{"m": 6, "n": 13, "k": 45, "tile_m": 3, "tile_n": 1, "threads": 32, "grouping": 11, "minblocks": 7, "algorithm": "medium", "perf": 3651.05, "source": "autotuned"},
{"m": 6, "n": 14, "k": 5, "tile_m": 3, "tile_n": 1, "threads": 96, "grouping": 8, "minblocks": 16, "algorithm": "medium", "perf": 1731.88, "source": "autotuned"},
{"m": 6, "n": 14, "k": 6, "tile_m": 3, "tile_n": 1, "threads": 96, "grouping": 8, "minblocks": 16, "algorithm": "medium", "perf": 1988.13, "source": "autotuned"},
{"m": 6, "n": 14, "k": 9, "tile_m": 3, "tile_n": 1, "threads": 128, "grouping": 8, "minblocks": 14, "algorithm": "medium", "perf": 2369.72, "source": "autotuned"},
{"m": 6, "n": 14, "k": 10, "tile_m": 3, "tile_n": 1, "threads": 32, "grouping": 5, "minblocks": 27, "algorithm": "medium", "perf": 2423.0, "source": "autotuned"},
{"m": 6, "n": 14, "k": 13, "tile_m": 3, "tile_n": 1, "threads": 96, "grouping": 11, "minblocks": 12, "algorithm": "medium", "perf": 2700.17, "source": "autotuned"},
{"m": 6, "n": 14, "k": 14, "tile_m": 3, "tile_n": 1, "threads": 32, "grouping": 7, "minblocks": 27, "algorithm": "medium", "perf": 2735.74, "source": "autotuned"},
{"m": 6, "n": 15, "k": 4, "tile_m": 3, "tile_n": 1, "threads": 64, "grouping": 9, "minblocks": 11, "algorithm": "medium", "perf": 1615.92, "source": "autotuned"},
{"m": 6, "n": 15, "k": 5, "tile_m": 3, "tile_n": 1, "threads": 96, "grouping": 11, "minblocks": 12, "algorithm": "medium", "perf": 1858.95, "source": "autotuned"},
{"m": 6, "n": 15, "k": 6, "tile_m": 3, "tile_n": 1, "threads": 96, "grouping": 8, "minblocks": 16, "algorithm": "medium", "perf": 2095.44, "source": "autotuned"},
{"m": 6, "n": 15, "k": 7, "tile_m": 3, "tile_n": 1, "threads": 128, "grouping": 8, "minblocks": 15, "algorithm": "medium", "perf": 2146.22, "source": "autotuned"},
{"m": 6, "n": 15, "k": 8, "tile_m": 3, "tile_n": 1, "threads": 128, "grouping": 8, "minblocks": 16, "algorithm": "medium", "perf": 2352.77, "source": "autotuned"},
{"m": 6, "n": 15, "k": 9, "tile_m": 3, "tile_n": 1, "threads": 32, "grouping": 6, "minblocks": 23, "algorithm": "medium", "perf": 2427.36, "source": "autotuned"},
{"m": 6, "n": 15, "k": 10, "tile_m": 3, "tile_n": 1, "threads": 32, "grouping": 6, "minblocks": 22, "algorithm": "medium", "perf": 2568.84, "source": "autotuned"},
{"m": 6, "n": 15, "k": 13, "tile_m": 3, "tile_n": 1, "threads": 32, "grouping": 7, "minblocks": 21, "algorithm": "medium", "perf": 2785.92, "source": "autotuned"},
{"m": 6, "n": 15, "k": 15, "tile_m": 3, "tile_n": 1, "threads": 96, "grouping": 11, "minblocks": 13, "algorithm": "medium", "perf": 3010.6, "source": "autotuned"},
{"m": 6, "n": 22, "k": 4, "tile_m": 3, "tile_n": 2, "threads": 96, "grouping": 13, "minblocks": 11, "algorithm": "medium", "perf": 2017.24, "source": "autotuned"},
{"m": 6, "n": 22, "k": 5, "tile_m": 3, "tile_n": 2, "threads": 32, "grouping": 8, "minblocks": 9, "algorithm": "medium", "perf": 2359.75, "source": "autotuned"},
{"m": 6, "n": 22, "k": 6, "tile_m": 3, "tile_n": 1, "threads": 64, "grouping": 8, "minblocks": 23, "algorithm": "medium", "perf": 2281.82, "source": "autotuned"},
{"m": 6, "n": 22, "k": 7, "tile_m": 3, "tile_n": 2, "threads": 32, "grouping": 5, "minblocks": 27, "algorithm": "medium", "perf": 2527.5, "source": "autotuned"},
{"m": 6, "n": 22, "k": 8, "tile_m": 3, "tile_n": 2, "threads": 32, "grouping": 5, "minblocks": 26, "algorithm": "medium", "perf": 2775.83, "source": "autotuned"},
{"m": 6, "n": 22, "k": 9, "tile_m": 3, "tile_n": 2, "threads": 32, "grouping": 5, "minblocks": 25, "algorithm": "medium", "perf": 2902.01, "source": "autotuned"},
{"m": 6, "n": 22, "k": 10, "tile_m": 3, "tile_n": 2, "threads": 32, "grouping": 5, "minblocks": 25, "algorithm": "medium", "perf": 3187.69, "source": "autotuned"},
{"m": 6, "n": 22, "k": 13, "tile_m": 3, "tile_n": 2, "threads": 32, "grouping": 8, "minblocks": 1, "algorithm": "medium", "perf": 3598.61, "source": "autotuned"},
{"m": 6, "n": 22, "k": 22, "tile_m": 3, "tile_n": 2, "threads": 32, "grouping": 8, "minblocks": 13, "algorithm": "medium", "perf": 4110.23, "source": "autotuned"},
{"m": 6, "n": 22, "k": 32, "tile_m": 3, "tile_n": 2, "threads": 32, "grouping": 12, "minblocks": 8, "algorithm": "medium", "perf": 4296.94, "source": "autotuned"},
{"m": 6, "n": 26, "k": 4, "tile_m": 3, "tile_n": 2, "threads": 32, "grouping": 8, "minblocks": 14, "algorithm": "medium", "perf": 2277.25, "source": "autotuned"},
{"m": 6, "n": 26, "k": 5, "tile_m": 3, "tile_n": 2, "threads": 32, "grouping": 8, "minblocks": 23, "algorithm": "medium", "perf": 2690.5, "source": "autotuned"},
{"m": 6, "n": 26, "k": 6, "tile_m": 3, "tile_n": 1, "threads": 64, "grouping": 8, "minblocks": 23, "algorithm": "medium", "perf": 2658.76, "source": "autotuned"},
{"m": 6, "n": 26, "k": 7, "tile_m": 3, "tile_n": 1, "threads": 64, "grouping": 7, "minblocks": 22, "algorithm": "medium", "perf": 2912.2, "source": "autotuned"},
{"m": 6, "n": 26, "k": 8, "tile_m": 3, "tile_n": 2, "threads": 32, "grouping": 5, "minblocks": 27, "algorithm": "medium", "perf": 3126.45, "source": "autotuned"},
{"m": 6, "n": 26, "k": 9, "tile_m": 3, "tile_n": 2, "threads": 32, "grouping": 5, "minblocks": 27, "algorithm": "medium", "perf": 3268.99, "source": "autotuned"},
{"m": 6, "n": 26, "k": 10, "tile_m": 3, "tile_n": 2, "threads": 32, "grouping": 8, "minblocks": 9, "algorithm": "medium", "perf": 3520.56, "source": "autotuned"},
{"m": 6, "n": 26, "k": 13, "tile_m": 3, "tile_n": 2, "threads": 32, "grouping": 8, "minblocks": 12, "algorithm": "medium", "perf": 4019.75, "source": "autotuned"},
{"m": 6, "n": 26, "k": 26, "tile_m": 3, "tile_n": 2, "threads": 32, "grouping": 12, "minblocks": 4, "algorithm": "medium", "perf": 4548.51, "source": "autotuned"},
{"m": 6, "n": 26, "k": 45, "tile_m": 3, "tile_n": 2, "w": 16, "v": 26, "threads": 32, "grouping": 16, "minblocks": 4, "algorithm": "largeDB2", "perf": 4793.31, "source": "autotuned"},
{"m": 6, "n": 32, "k": 4, "tile_m": 3, "tile_n": 2, "threads": 32, "grouping": 8, "minblocks": 25, "algorithm": "medium", "perf": 2665.19, "source": "autotuned"},
{"m": 6, "n": 32, "k": 5, "tile_m": 3, "tile_n": 2, "threads": 32, "grouping": 8, "minblocks": 25, "algorithm": "medium", "perf": 3162.08, "source": "autotuned"},
{"m": 6, "n": 32, "k": 6, "tile_m": 3, "tile_n": 1, "threads": 64, "grouping": 9, "minblocks": 24, "algorithm": "medium", "perf": 3161.48, "source": "autotuned"},
{"m": 6, "n": 32, "k": 7, "tile_m": 3, "tile_n": 1, "threads": 64, "grouping": 9, "minblocks": 21, "algorithm": "medium", "perf": 3307.76, "source": "autotuned"},
{"m": 6, "n": 32, "k": 8, "tile_m": 3, "tile_n": 2, "threads": 96, "grouping": 8, "minblocks": 16, "algorithm": "medium", "perf": 3683.5, "source": "autotuned"},
{"m": 6, "n": 32, "k": 9, "tile_m": 3, "tile_n": 2, "w": 4, "v": 32, "threads": 32, "grouping": 16, "minblocks": 1, "algorithm": "largeDB2", "perf": 3989.38, "source": "autotuned"},
{"m": 6, "n": 32, "k": 10, "tile_m": 3, "tile_n": 2, "w": 4, "v": 32, "threads": 32, "grouping": 16, "minblocks": 2, "algorithm": "largeDB2", "perf": 4312.72, "source": "autotuned"},
{"m": 6, "n": 32, "k": 13, "tile_m": 3, "tile_n": 2, "threads": 32, "grouping": 8, "minblocks": 4, "algorithm": "medium", "perf": 4666.88, "source": "autotuned"},
{"m": 6, "n": 32, "k": 22, "tile_m": 3, "tile_n": 2, "threads": 32, "grouping": 12, "minblocks": 8, "algorithm": "medium", "perf": 4998.41, "source": "autotuned"},
{"m": 6, "n": 32, "k": 32, "tile_m": 3, "tile_n": 2, "threads": 32, "grouping": 12, "minblocks": 3, "algorithm": "medium", "perf": 5362.93, "source": "autotuned"},
{"m": 6, "n": 45, "k": 4, "tile_m": 3, "tile_n": 3, "threads": 32, "grouping": 8, "minblocks": 6, "algorithm": "medium", "perf": 3206.61, "source": "autotuned"},
{"m": 6, "n": 45, "k": 5, "tile_m": 3, "tile_n": 3, "threads": 32, "grouping": 8, "minblocks": 11, "algorithm": "medium", "perf": 3700.91, "source": "autotuned"},
{"m": 6, "n": 45, "k": 6, "tile_m": 3, "tile_n": 3, "threads": 32, "grouping": 7, "minblocks": 20, "algorithm": "medium", "perf": 3551.52, "source": "autotuned"},
{"m": 6, "n": 45, "k": 7, "tile_m": 3, "tile_n": 3, "threads": 32, "grouping": 8, "minblocks": 13, "algorithm": "medium", "perf": 3892.77, "source": "autotuned"},
{"m": 6, "n": 45, "k": 8, "tile_m": 3, "tile_n": 3, "threads": 32, "grouping": 8, "minblocks": 14, "algorithm": "medium", "perf": 4205.28, "source": "autotuned"},
{"m": 6, "n": 45, "k": 9, "tile_m": 3, "tile_n": 3, "threads": 32, "grouping": 8, "minblocks": 14, "algorithm": "medium", "perf": 4442.18, "source": "autotuned"},
{"m": 6, "n": 45, "k": 10, "tile_m": 3, "tile_n": 3, "threads": 32, "grouping": 8, "minblocks": 13, "algorithm": "medium", "perf": 4560.31, "source": "autotuned"},
{"m": 6, "n": 45, "k": 13, "tile_m": 3, "tile_n": 3, "threads": 32, "grouping": 11, "minblocks": 11, "algorithm": "medium", "perf": 4984.99, "source": "autotuned"},
{"m": 6, "n": 45, "k": 26, "tile_m": 3, "tile_n": 3, "threads": 32, "grouping": 16, "minblocks": 3, "algorithm": "medium", "perf": 5160.85, "source": "autotuned"},
{"m": 6, "n": 45, "k": 45, "tile_m": 3, "tile_n": 3, "w": 18, "v": 30, "threads": 32, "grouping": 16, "minblocks": 8, "algorithm": "largeDB2", "perf": 5330.61, "source": "autotuned"},
{"m": 7, "n": 4, "k": 4, "tile_m": 1, "tile_n": 1, "threads": 32, "grouping": 8, "minblocks": 27, "algorithm": "medium", "perf": 634.873, "source": "autotuned"},
{"m": 7, "n": 4, "k": 5, "tile_m": 1, "tile_n": 1, "threads": 64, "grouping": 8, "minblocks": 8, "algorithm": "medium", "perf": 716.11, "source": "autotuned"},
{"m": 7, "n": 4, "k": 6, "tile_m": 1, "tile_n": 1, "threads": 64, "grouping": 8, "minblocks": 8, "algorithm": "medium", "perf": 826.964, "source": "autotuned"},
{"m": 7, "n": 4, "k": 7, "tile_m": 1, "tile_n": 1, "threads": 64, "grouping": 8, "minblocks": 8, "algorithm": "medium", "perf": 887.729, "source": "autotuned"},
{"m": 7, "n": 4, "k": 8, "tile_m": 1, "tile_n": 1, "threads": 64, "grouping": 8, "minblocks": 8, "algorithm": "medium", "perf": 982.215, "source": "autotuned"},
{"m": 7, "n": 4, "k": 9, "tile_m": 1, "tile_n": 1, "threads": 64, "grouping": 4, "minblocks": 26, "algorithm": "medium", "perf": 1070.91, "source": "autotuned"},
{"m": 7, "n": 4, "k": 10, "tile_m": 1, "tile_n": 1, "threads": 96, "grouping": 8, "minblocks": 19, "algorithm": "medium", "perf": 1074.07, "source": "autotuned"},
{"m": 7, "n": 4, "k": 13, "tile_m": 1, "tile_n": 1, "threads": 96, "grouping": 9, "minblocks": 18, "algorithm": "medium", "perf": 1222.7, "source": "autotuned"},
{"m": 7, "n": 4, "k": 15, "tile_m": 1, "tile_n": 1, "threads": 64, "grouping": 6, "minblocks": 26, "algorithm": "medium", "perf": 1264.14, "source": "autotuned"},
{"m": 7, "n": 4, "k": 22, "tile_m": 1, "tile_n": 1, "threads": 96, "grouping": 7, "minblocks": 17, "algorithm": "medium", "perf": 1487.67, "source": "autotuned"},
{"m": 7, "n": 4, "k": 25, "tile_m": 1, "tile_n": 1, "threads": 64, "grouping": 6, "minblocks": 23, "algorithm": "medium", "perf": 1478.54, "source": "autotuned"},
{"m": 7, "n": 4, "k": 26, "tile_m": 1, "tile_n": 1, "threads": 128, "grouping": 8, "minblocks": 15, "algorithm": "medium", "perf": 1507.17, "source": "autotuned"},
{"m": 7, "n": 4, "k": 28, "tile_m": 1, "tile_n": 1, "threads": 128, "grouping": 8, "minblocks": 14, "algorithm": "medium", "perf": 1556.87, "source": "autotuned"},
{"m": 7, "n": 4, "k": 32, "tile_m": 1, "tile_n": 1, "threads": 32, "grouping": 4, "minblocks": 4, "algorithm": "medium", "perf": 1618.28, "source": "autotuned"},
{"m": 7, "n": 4, "k": 45, "tile_m": 1, "tile_n": 1, "w": 16, "v": 4, "threads": 32, "grouping": 16, "minblocks": 12, "algorithm": "largeDB2", "perf": 1814.1, "source": "autotuned"},
{"m": 7, "n": 5, "k": 4, "tile_m": 4, "tile_n": 1, "threads": 32, "grouping": 8, "minblocks": 5, "algorithm": "medium", "perf": 734.51, "source": "autotuned"},
{"m": 7, "n": 5, "k": 5, "tile_m": 2, "tile_n": 1, "threads": 64, "grouping": 9, "minblocks": 22, "algorithm": "medium", "perf": 822.778, "source": "autotuned"},
{"m": 7, "n": 5, "k": 6, "tile_m": 2, "tile_n": 1, "threads": 64, "grouping": 9, "minblocks": 24, "algorithm": "medium", "perf": 938.787, "source": "autotuned"},
{"m": 7, "n": 5, "k": 7, "tile_m": 2, "tile_n": 1, "threads": 64, "grouping": 9, "minblocks": 21, "algorithm": "medium", "perf": 1044.97, "source": "autotuned"},
{"m": 7, "n": 5, "k": 8, "tile_m": 2, "tile_n": 1, "threads": 64, "grouping": 9, "minblocks": 24, "algorithm": "medium", "perf": 1143.0, "source": "autotuned"},
{"m": 7, "n": 5, "k": 9, "tile_m": 2, "tile_n": 1, "threads": 64, "grouping": 9, "minblocks": 21, "algorithm": "medium", "perf": 1231.59, "source": "autotuned"},
{"m": 7, "n": 5, "k": 10, "tile_m": 2, "tile_n": 1, "threads": 96, "grouping": 8, "minblocks": 17, "algorithm": "medium", "perf": 1231.29, "source": "autotuned"},
{"m": 7, "n": 5, "k": 13, "tile_m": 2, "tile_n": 1, "threads": 96, "grouping": 8, "minblocks": 20, "algorithm": "medium", "perf": 1441.84, "source": "autotuned"},
{"m": 7, "n": 5, "k": 15, "tile_m": 2, "tile_n": 1, "threads": 128, "grouping": 8, "minblocks": 15, "algorithm": "medium", "perf": 1478.97, "source": "autotuned"},
{"m": 7, "n": 5, "k": 22, "tile_m": 2, "tile_n": 1, "threads": 160, "grouping": 16, "minblocks": 8, "algorithm": "medium", "perf": 1635.55, "source": "autotuned"},
{"m": 7, "n": 5, "k": 25, "tile_m": 2, "tile_n": 1, "threads": 32, "grouping": 8, "minblocks": 25, "algorithm": "medium", "perf": 1691.58, "source": "autotuned"},
{"m": 7, "n": 5, "k": 26, "tile_m": 4, "tile_n": 1, "threads": 32, "grouping": 8, "minblocks": 6, "algorithm": "medium", "perf": 1700.98, "source": "autotuned"},
{"m": 7, "n": 5, "k": 28, "tile_m": 4, "tile_n": 1, "threads": 32, "grouping": 8, "minblocks": 17, "algorithm": "medium", "perf": 1733.27, "source": "autotuned"},
{"m": 7, "n": 5, "k": 32, "tile_m": 4, "tile_n": 1, "threads": 32, "grouping": 8, "minblocks": 2, "algorithm": "medium", "perf": 1823.86, "source": "autotuned"},
{"m": 7, "n": 5, "k": 45, "tile_m": 2, "tile_n": 1, "w": 18, "v": 4, "threads": 32, "grouping": 16, "minblocks": 2, "algorithm": "largeDB2", "perf": 1989.98, "source": "autotuned"},
{"m": 7, "n": 6, "k": 4, "tile_m": 4, "tile_n": 1, "threads": 32, "grouping": 8, "minblocks": 3, "algorithm": "medium", "perf": 882.792, "source": "autotuned"},
{"m": 7, "n": 6, "k": 5, "tile_m": 2, "tile_n": 1, "threads": 64, "grouping": 8, "minblocks": 24, "algorithm": "medium", "perf": 987.402, "source": "autotuned"},
{"m": 7, "n": 6, "k": 6, "tile_m": 2, "tile_n": 1, "threads": 64, "grouping": 9, "minblocks": 14, "algorithm": "medium", "perf": 1112.18, "source": "autotuned"},
{"m": 7, "n": 6, "k": 7, "tile_m": 2, "tile_n": 1, "threads": 64, "grouping": 9, "minblocks": 23, "algorithm": "medium", "perf": 1243.64, "source": "autotuned"},
{"m": 7, "n": 6, "k": 8, "tile_m": 2, "tile_n": 1, "threads": 64, "grouping": 9, "minblocks": 3, "algorithm": "medium", "perf": 1360.6, "source": "autotuned"},
{"m": 7, "n": 6, "k": 9, "tile_m": 2, "tile_n": 1, "threads": 64, "grouping": 9, "minblocks": 24, "algorithm": "medium", "perf": 1458.89, "source": "autotuned"},
{"m": 7, "n": 6, "k": 10, "tile_m": 2, "tile_n": 1, "threads": 96, "grouping": 8, "minblocks": 20, "algorithm": "medium", "perf": 1478.98, "source": "autotuned"},
{"m": 7, "n": 6, "k": 13, "tile_m": 4, "tile_n": 1, "threads": 96, "grouping": 8, "minblocks": 16, "algorithm": "medium", "perf": 1728.39, "source": "autotuned"},
{"m": 7, "n": 6, "k": 15, "tile_m": 2, "tile_n": 1, "threads": 128, "grouping": 8, "minblocks": 13, "algorithm": "medium", "perf": 1741.38, "source": "autotuned"},
{"m": 7, "n": 6, "k": 22, "tile_m": 2, "tile_n": 1, "threads": 160, "grouping": 16, "minblocks": 8, "algorithm": "medium", "perf": 1953.46, "source": "autotuned"},
{"m": 7, "n": 6, "k": 26, "tile_m": 4, "tile_n": 1, "threads": 32, "grouping": 8, "minblocks": 5, "algorithm": "medium", "perf": 2038.99, "source": "autotuned"},
{"m": 7, "n": 6, "k": 32, "tile_m": 4, "tile_n": 1, "threads": 32, "grouping": 8, "minblocks": 19, "algorithm": "medium", "perf": 2154.52, "source": "autotuned"},
{"m": 7, "n": 6, "k": 45, "tile_m": 4, "tile_n": 1, "threads": 32, "grouping": 8, "minblocks": 13, "algorithm": "medium", "perf": 2297.19, "source": "autotuned"},
{"m": 7, "n": 7, "k": 4, "tile_m": 2, "tile_n": 1, "threads": 32, "grouping": 10, "minblocks": 18, "algorithm": "medium", "perf": 1013.03, "source": "autotuned"},
{"m": 7, "n": 7, "k": 5, "tile_m": 2, "tile_n": 1, "threads": 64, "grouping": 9, "minblocks": 2, "algorithm": "medium", "perf": 1112.3, "source": "autotuned"},
{"m": 7, "n": 7, "k": 6, "tile_m": 2, "tile_n": 1, "threads": 64, "grouping": 9, "minblocks": 23, "algorithm": "medium", "perf": 1258.85, "source": "autotuned"},
{"m": 7, "n": 7, "k": 7, "tile_m": 2, "tile_n": 1, "threads": 64, "grouping": 9, "minblocks": 24, "algorithm": "medium", "perf": 1381.79, "source": "autotuned"},
{"m": 7, "n": 7, "k": 8, "tile_m": 2, "tile_n": 1, "threads": 64, "grouping": 9, "minblocks": 22, "algorithm": "medium", "perf": 1517.77, "source": "autotuned"},
{"m": 7, "n": 7, "k": 9, "tile_m": 4, "tile_n": 1, "threads": 32, "grouping": 5, "minblocks": 28, "algorithm": "small", "perf": 1622.04, "source": "autotuned"},
{"m": 7, "n": 7, "k": 10, "tile_m": 4, "tile_n": 1, "threads": 32, "grouping": 5, "minblocks": 26, "algorithm": "small", "perf": 1732.72, "source": "autotuned"},
{"m": 7, "n": 7, "k": 13, "tile_m": 4, "tile_n": 1, "threads": 32, "grouping": 4, "minblocks": 31, "algorithm": "small", "perf": 2007.09, "source": "autotuned"},
{"m": 7, "n": 7, "k": 15, "tile_m": 2, "tile_n": 1, "threads": 128, "grouping": 8, "minblocks": 13, "algorithm": "medium", "perf": 1968.33, "source": "autotuned"},
{"m": 7, "n": 7, "k": 22, "tile_m": 4, "tile_n": 1, "threads": 32, "grouping": 8, "minblocks": 18, "algorithm": "medium", "perf": 2310.87, "source": "autotuned"},
{"m": 7, "n": 7, "k": 25, "tile_m": 4, "tile_n": 1, "threads": 32, "grouping": 8, "minblocks": 22, "algorithm": "medium", "perf": 2349.28, "source": "autotuned"},
{"m": 7, "n": 7, "k": 26, "tile_m": 4, "tile_n": 1, "threads": 32, "grouping": 8, "minblocks": 7, "algorithm": "medium", "perf": 2414.14, "source": "autotuned"},
{"m": 7, "n": 7, "k": 28, "tile_m": 4, "tile_n": 1, "threads": 32, "grouping": 8, "minblocks": 18, "algorithm": "medium", "perf": 2400.28, "source": "autotuned"},
{"m": 7, "n": 7, "k": 32, "tile_m": 4, "tile_n": 1, "threads": 32, "grouping": 4, "minblocks": 17, "algorithm": "medium", "perf": 2542.12, "source": "autotuned"},
{"m": 7, "n": 7, "k": 45, "tile_m": 4, "tile_n": 1, "threads": 32, "grouping": 8, "minblocks": 6, "algorithm": "medium", "perf": 2771.66, "source": "autotuned"},
{"m": 7, "n": 8, "k": 4, "tile_m": 2, "tile_n": 1, "threads": 64, "grouping": 9, "minblocks": 7, "algorithm": "medium", "perf": 1082.46, "source": "autotuned"},
{"m": 7, "n": 8, "k": 5, "tile_m": 2, "tile_n": 1, "threads": 64, "grouping": 9, "minblocks": 23, "algorithm": "medium", "perf": 1290.59, "source": "autotuned"},
{"m": 7, "n": 8, "k": 6, "tile_m": 2, "tile_n": 1, "threads": 64, "grouping": 9, "minblocks": 23, "algorithm": "medium", "perf": 1476.07, "source": "autotuned"},
{"m": 7, "n": 8, "k": 7, "tile_m": 2, "tile_n": 1, "threads": 64, "grouping": 9, "minblocks": 23, "algorithm": "medium", "perf": 1609.4, "source": "autotuned"},
{"m": 7, "n": 8, "k": 8, "tile_m": 2, "tile_n": 1, "threads": 64, "grouping": 7, "minblocks": 6, "algorithm": "small", "perf": 1597.75, "source": "autotuned"},
{"m": 7, "n": 8, "k": 9, "tile_m": 2, "tile_n": 1, "threads": 96, "grouping": 9, "minblocks": 21, "algorithm": "medium", "perf": 1786.74, "source": "autotuned"},
{"m": 7, "n": 8, "k": 10, "tile_m": 4, "tile_n": 1, "threads": 96, "grouping": 8, "minblocks": 16, "algorithm": "medium", "perf": 1916.32, "source": "autotuned"},
{"m": 7, "n": 8, "k": 13, "tile_m": 2, "tile_n": 1, "threads": 128, "grouping": 9, "minblocks": 15, "algorithm": "medium", "perf": 2079.95, "source": "autotuned"},
{"m": 7, "n": 8, "k": 15, "tile_m": 2, "tile_n": 1, "threads": 128, "grouping": 9, "minblocks": 13, "algorithm": "medium", "perf": 2226.7, "source": "autotuned"},
{"m": 7, "n": 8, "k": 22, "tile_m": 4, "tile_n": 1, "threads": 32, "grouping": 8, "minblocks": 6, "algorithm": "medium", "perf": 2450.56, "source": "autotuned"},
{"m": 7, "n": 8, "k": 26, "tile_m": 4, "tile_n": 1, "threads": 32, "grouping": 8, "minblocks": 3, "algorithm": "medium", "perf": 2581.79, "source": "autotuned"},
{"m": 7, "n": 8, "k": 32, "tile_m": 4, "tile_n": 1, "w": 14, "v": 8, "threads": 32, "grouping": 16, "minblocks": 4, "algorithm": "largeDB2", "perf": 2853.64, "source": "autotuned"},
{"m": 7, "n": 8, "k": 45, "tile_m": 4, "tile_n": 1, "w": 16, "v": 8, "threads": 32, "grouping": 16, "minblocks": 12, "algorithm": "largeDB2", "perf": 2889.15, "source": "autotuned"},
{"m": 7, "n": 9, "k": 4, "tile_m": 1, "tile_n": 1, "threads": 64, "grouping": 11, "minblocks": 20, "algorithm": "medium", "perf": 1134.03, "source": "autotuned"},
{"m": 7, "n": 9, "k": 5, "tile_m": 2, "tile_n": 2, "threads": 64, "grouping": 9, "minblocks": 18, "algorithm": "medium", "perf": 1309.55, "source": "autotuned"},
{"m": 7, "n": 9, "k": 6, "tile_m": 2, "tile_n": 2, "threads": 64, "grouping": 9, "minblocks": 10, "algorithm": "medium", "perf": 1466.26, "source": "autotuned"},
{"m": 7, "n": 9, "k": 7, "tile_m": 4, "tile_n": 1, "threads": 64, "grouping": 9, "minblocks": 14, "algorithm": "medium", "perf": 1627.39, "source": "autotuned"},
{"m": 7, "n": 9, "k": 8, "tile_m": 4, "tile_n": 1, "threads": 96, "grouping": 8, "minblocks": 15, "algorithm": "medium", "perf": 1792.83, "source": "autotuned"},
{"m": 7, "n": 9, "k": 9, "tile_m": 4, "tile_n": 1, "threads": 96, "grouping": 8, "minblocks": 14, "algorithm": "medium", "perf": 1923.52, "source": "autotuned"},
{"m": 7, "n": 9, "k": 10, "tile_m": 4, "tile_n": 1, "threads": 96, "grouping": 8, "minblocks": 15, "algorithm": "medium", "perf": 1641.14, "source": "autotuned"},
{"m": 7, "n": 9, "k": 13, "tile_m": 4, "tile_n": 1, "threads": 128, "grouping": 8, "minblocks": 13, "algorithm": "medium", "perf": 2136.45, "source": "autotuned"},
{"m": 7, "n": 9, "k": 15, "tile_m": 4, "tile_n": 1, "threads": 32, "grouping": 8, "minblocks": 18, "algorithm": "medium", "perf": 2172.32, "source": "autotuned"},
{"m": 7, "n": 9, "k": 22, "tile_m": 4, "tile_n": 1, "threads": 32, "grouping": 8, "minblocks": 5, "algorithm": "medium", "perf": 2515.71, "source": "autotuned"},
{"m": 7, "n": 9, "k": 25, "tile_m": 4, "tile_n": 1, "threads": 32, "grouping": 8, "minblocks": 4, "algorithm": "medium", "perf": 2564.16, "source": "autotuned"},
{"m": 7, "n": 9, "k": 26, "tile_m": 4, "tile_n": 1, "threads": 32, "grouping": 8, "minblocks": 19, "algorithm": "medium", "perf": 2612.66, "source": "autotuned"},
{"m": 7, "n": 9, "k": 28, "tile_m": 4, "tile_n": 1, "w": 12, "v": 6, "threads": 32, "grouping": 16, "minblocks": 8, "algorithm": "largeDB2", "perf": 2662.04, "source": "autotuned"},
{"m": 7, "n": 9, "k": 32, "tile_m": 4, "tile_n": 1, "threads": 32, "grouping": 8, "minblocks": 15, "algorithm": "medium", "perf": 2838.33, "source": "autotuned"},
{"m": 7, "n": 9, "k": 45, "tile_m": 4, "tile_n": 1, "w": 18, "v": 8, "threads": 32, "grouping": 16, "minblocks": 12, "algorithm": "largeDB2", "perf": 2957.9, "source": "autotuned"},
{"m": 7, "n": 10, "k": 4, "tile_m": 2, "tile_n": 2, "threads": 64, "grouping": 9, "minblocks": 1, "algorithm": "medium", "perf": 1249.5, "source": "autotuned"},
{"m": 7, "n": 10, "k": 5, "tile_m": 4, "tile_n": 1, "threads": 64, "grouping": 9, "minblocks": 16, "algorithm": "medium", "perf": 1437.57, "source": "autotuned"},
{"m": 7, "n": 10, "k": 6, "tile_m": 2, "tile_n": 2, "threads": 64, "grouping": 9, "minblocks": 15, "algorithm": "medium", "perf": 1647.8, "source": "autotuned"},
{"m": 7, "n": 10, "k": 7, "tile_m": 4, "tile_n": 1, "threads": 96, "grouping": 8, "minblocks": 14, "algorithm": "medium", "perf": 1785.49, "source": "autotuned"},
{"m": 7, "n": 10, "k": 8, "tile_m": 4, "tile_n": 1, "threads": 96, "grouping": 8, "minblocks": 16, "algorithm": "medium", "perf": 1972.13, "source": "autotuned"},
{"m": 7, "n": 10, "k": 9, "tile_m": 4, "tile_n": 1, "threads": 96, "grouping": 8, "minblocks": 16, "algorithm": "medium", "perf": 2076.25, "source": "autotuned"},
{"m": 7, "n": 10, "k": 10, "tile_m": 4, "tile_n": 1, "threads": 128, "grouping": 8, "minblocks": 16, "algorithm": "medium", "perf": 2029.62, "source": "autotuned"},
{"m": 7, "n": 10, "k": 13, "tile_m": 4, "tile_n": 1, "threads": 32, "grouping": 5, "minblocks": 25, "algorithm": "medium", "perf": 2223.54, "source": "autotuned"},
{"m": 7, "n": 10, "k": 15, "tile_m": 4, "tile_n": 1, "threads": 32, "grouping": 8, "minblocks": 19, "algorithm": "medium", "perf": 2370.46, "source": "autotuned"},
{"m": 7, "n": 10, "k": 22, "tile_m": 4, "tile_n": 1, "threads": 32, "grouping": 8, "minblocks": 21, "algorithm": "medium", "perf": 2747.18, "source": "autotuned"},
{"m": 7, "n": 10, "k": 26, "tile_m": 4, "tile_n": 1, "w": 12, "v": 10, "threads": 32, "grouping": 16, "minblocks": 4, "algorithm": "largeDB2", "perf": 2962.68, "source": "autotuned"},
{"m": 7, "n": 10, "k": 32, "tile_m": 4, "tile_n": 1, "w": 14, "v": 10, "threads": 32, "grouping": 16, "minblocks": 4, "algorithm": "largeDB2", "perf": 3087.21, "source": "autotuned"},
{"m": 7, "n": 10, "k": 45, "tile_m": 4, "tile_n": 1, "w": 18, "v": 10, "threads": 32, "grouping": 16, "minblocks": 2, "algorithm": "largeDB2", "perf": 3210.92, "source": "autotuned"},
{"m": 7, "n": 13, "k": 4, "tile_m": 4, "tile_n": 1, "threads": 64, "grouping": 9, "minblocks": 1, "algorithm": "medium", "perf": 1599.67, "source": "autotuned"},
{"m": 7, "n": 13, "k": 5, "tile_m": 4, "tile_n": 1, "threads": 96, "grouping": 8, "minblocks": 16, "algorithm": "medium", "perf": 1812.25, "source": "autotuned"},
{"m": 7, "n": 13, "k": 6, "tile_m": 4, "tile_n": 1, "threads": 96, "grouping": 8, "minblocks": 15, "algorithm": "medium", "perf": 2034.16, "source": "autotuned"},
{"m": 7, "n": 13, "k": 7, "tile_m": 4, "tile_n": 1, "threads": 96, "grouping": 8, "minblocks": 14, "algorithm": "medium", "perf": 2237.85, "source": "autotuned"},
{"m": 7, "n": 13, "k": 8, "tile_m": 4, "tile_n": 1, "threads": 128, "grouping": 8, "minblocks": 14, "algorithm": "medium", "perf": 2267.37, "source": "autotuned"},
{"m": 7, "n": 13, "k": 9, "tile_m": 4, "tile_n": 1, "threads": 128, "grouping": 8, "minblocks": 14, "algorithm": "medium", "perf": 2444.57, "source": "autotuned"},
{"m": 7, "n": 13, "k": 10, "tile_m": 4, "tile_n": 1, "threads": 32, "grouping": 5, "minblocks": 27, "algorithm": "medium", "perf": 2450.55, "source": "autotuned"},
{"m": 7, "n": 13, "k": 13, "tile_m": 4, "tile_n": 1, "threads": 32, "grouping": 8, "minblocks": 17, "algorithm": "medium", "perf": 2752.02, "source": "autotuned"},
{"m": 7, "n": 13, "k": 15, "tile_m": 4, "tile_n": 1, "threads": 32, "grouping": 8, "minblocks": 3, "algorithm": "medium", "perf": 2918.96, "source": "autotuned"},
{"m": 7, "n": 13, "k": 22, "tile_m": 4, "tile_n": 1, "threads": 32, "grouping": 8, "minblocks": 1, "algorithm": "medium", "perf": 3436.02, "source": "autotuned"},
{"m": 7, "n": 13, "k": 25, "tile_m": 4, "tile_n": 1, "threads": 32, "grouping": 8, "minblocks": 3, "algorithm": "medium", "perf": 3478.62, "source": "autotuned"},
{"m": 7, "n": 13, "k": 26, "tile_m": 4, "tile_n": 1, "w": 12, "v": 10, "threads": 32, "grouping": 16, "minblocks": 2, "algorithm": "largeDB2", "perf": 3535.61, "source": "autotuned"},
{"m": 7, "n": 13, "k": 28, "tile_m": 4, "tile_n": 1, "w": 12, "v": 8, "threads": 32, "grouping": 16, "minblocks": 12, "algorithm": "largeDB2", "perf": 3615.31, "source": "autotuned"},
{"m": 7, "n": 13, "k": 32, "tile_m": 4, "tile_n": 1, "w": 12, "v": 10, "threads": 32, "grouping": 16, "minblocks": 8, "algorithm": "largeDB2", "perf": 3619.65, "source": "autotuned"},
{"m": 7, "n": 13, "k": 45, "tile_m": 4, "tile_n": 1, "w": 18, "v": 10, "threads": 32, "grouping": 16, "minblocks": 8, "algorithm": "largeDB2", "perf": 3875.38, "source": "autotuned"},
{"m": 7, "n": 15, "k": 4, "tile_m": 4, "tile_n": 1, "threads": 64, "grouping": 9, "minblocks": 5, "algorithm": "medium", "perf": 1849.67, "source": "autotuned"},
{"m": 7, "n": 15, "k": 5, "tile_m": 4, "tile_n": 1, "threads": 96, "grouping": 8, "minblocks": 15, "algorithm": "medium", "perf": 2058.41, "source": "autotuned"},
{"m": 7, "n": 15, "k": 6, "tile_m": 4, "tile_n": 1, "threads": 96, "grouping": 8, "minblocks": 16, "algorithm": "medium", "perf": 2354.25, "source": "autotuned"},
{"m": 7, "n": 15, "k": 8, "tile_m": 4, "tile_n": 1, "threads": 128, "grouping": 8, "minblocks": 13, "algorithm": "medium", "perf": 2600.28, "source": "autotuned"},
{"m": 7, "n": 15, "k": 9, "tile_m": 4, "tile_n": 1, "threads": 32, "grouping": 5, "minblocks": 25, "algorithm": "medium", "perf": 2635.39, "source": "autotuned"},
{"m": 7, "n": 15, "k": 10, "tile_m": 4, "tile_n": 1, "threads": 32, "grouping": 5, "minblocks": 25, "algorithm": "medium", "perf": 2690.64, "source": "autotuned"},
{"m": 7, "n": 15, "k": 13, "tile_m": 4, "tile_n": 1, "threads": 32, "grouping": 8, "minblocks": 4, "algorithm": "medium", "perf": 3051.61, "source": "autotuned"},
{"m": 7, "n": 15, "k": 15, "tile_m": 4, "tile_n": 1, "threads": 32, "grouping": 8, "minblocks": 18, "algorithm": "medium", "perf": 3197.58, "source": "autotuned"},
{"m": 7, "n": 22, "k": 4, "tile_m": 2, "tile_n": 3, "threads": 96, "grouping": 11, "minblocks": 12, "algorithm": "medium", "perf": 2300.51, "source": "autotuned"},
{"m": 7, "n": 22, "k": 5, "tile_m": 2, "tile_n": 3, "threads": 128, "grouping": 13, "minblocks": 10, "algorithm": "medium", "perf": 2385.11, "source": "autotuned"},
{"m": 7, "n": 22, "k": 6, "tile_m": 4, "tile_n": 1, "threads": 64, "grouping": 8, "minblocks": 23, "algorithm": "medium", "perf": 2577.38, "source": "autotuned"},
{"m": 7, "n": 22, "k": 7, "tile_m": 4, "tile_n": 1, "threads": 64, "grouping": 8, "minblocks": 23, "algorithm": "medium", "perf": 2804.19, "source": "autotuned"},
{"m": 7, "n": 22, "k": 8, "tile_m": 2, "tile_n": 3, "threads": 32, "grouping": 6, "minblocks": 21, "algorithm": "medium", "perf": 3098.0, "source": "autotuned"},
{"m": 7, "n": 22, "k": 9, "tile_m": 2, "tile_n": 3, "threads": 32, "grouping": 6, "minblocks": 21, "algorithm": "medium", "perf": 3210.99, "source": "autotuned"},
{"m": 7, "n": 22, "k": 10, "tile_m": 4, "tile_n": 2, "threads": 32, "grouping": 8, "minblocks": 13, "algorithm": "medium", "perf": 3392.2, "source": "autotuned"},
{"m": 7, "n": 22, "k": 13, "tile_m": 2, "tile_n": 3, "threads": 32, "grouping": 8, "minblocks": 15, "algorithm": "medium", "perf": 3832.78, "source": "autotuned"},
{"m": 7, "n": 22, "k": 22, "tile_m": 2, "tile_n": 3, "w": 10, "v": 22, "threads": 32, "grouping": 16, "minblocks": 4, "algorithm": "largeDB2", "perf": 4189.19, "source": "autotuned"},
{"m": 7, "n": 22, "k": 32, "tile_m": 2, "tile_n": 3, "threads": 32, "grouping": 11, "minblocks": 7, "algorithm": "medium", "perf": 4666.65, "source": "autotuned"},
{"m": 7, "n": 25, "k": 4, "tile_m": 4, "tile_n": 2, "threads": 32, "grouping": 8, "minblocks": 14, "algorithm": "medium", "perf": 2383.13, "source": "autotuned"},
{"m": 7, "n": 25, "k": 5, "tile_m": 4, "tile_n": 2, "threads": 128, "grouping": 16, "minblocks": 8, "algorithm": "medium", "perf": 2588.47, "source": "autotuned"},
{"m": 7, "n": 25, "k": 7, "tile_m": 4, "tile_n": 1, "threads": 64, "grouping": 8, "minblocks": 23, "algorithm": "medium", "perf": 3025.64, "source": "autotuned"},
{"m": 7, "n": 25, "k": 9, "tile_m": 4, "tile_n": 2, "threads": 32, "grouping": 8, "minblocks": 16, "algorithm": "medium", "perf": 3422.86, "source": "autotuned"},
{"m": 7, "n": 25, "k": 13, "tile_m": 4, "tile_n": 2, "threads": 32, "grouping": 8, "minblocks": 17, "algorithm": "medium", "perf": 4082.72, "source": "autotuned"},
{"m": 7, "n": 25, "k": 25, "tile_m": 4, "tile_n": 2, "threads": 32, "grouping": 11, "minblocks": 9, "algorithm": "medium", "perf": 4456.59, "source": "autotuned"},
{"m": 7, "n": 25, "k": 26, "tile_m": 4, "tile_n": 2, "threads": 32, "grouping": 12, "minblocks": 9, "algorithm": "medium", "perf": 4598.94, "source": "autotuned"},
{"m": 7, "n": 25, "k": 28, "tile_m": 4, "tile_n": 2, "threads": 32, "grouping": 12, "minblocks": 7, "algorithm": "medium", "perf": 4668.12, "source": "autotuned"},
{"m": 7, "n": 25, "k": 32, "tile_m": 4, "tile_n": 2, "w": 14, "v": 22, "threads": 32, "grouping": 16, "minblocks": 12, "algorithm": "largeDB2", "perf": 4725.89, "source": "autotuned"},
{"m": 7, "n": 25, "k": 45, "tile_m": 4, "tile_n": 2, "w": 16, "v": 24, "threads": 32, "grouping": 16, "minblocks": 12, "algorithm": "largeDB2", "perf": 5167.81, "source": "autotuned"},
{"m": 7, "n": 26, "k": 4, "tile_m": 4, "tile_n": 2, "threads": 32, "grouping": 8, "minblocks": 1, "algorithm": "medium", "perf": 2535.3, "source": "autotuned"},
{"m": 7, "n": 26, "k": 5, "tile_m": 4, "tile_n": 1, "threads": 64, "grouping": 8, "minblocks": 22, "algorithm": "medium", "perf": 2586.04, "source": "autotuned"},
{"m": 7, "n": 26, "k": 6, "tile_m": 4, "tile_n": 1, "threads": 64, "grouping": 8, "minblocks": 24, "algorithm": "medium", "perf": 2909.38, "source": "autotuned"},
{"m": 7, "n": 26, "k": 7, "tile_m": 4, "tile_n": 1, "threads": 64, "grouping": 8, "minblocks": 22, "algorithm": "medium", "perf": 3092.37, "source": "autotuned"},
{"m": 7, "n": 26, "k": 8, "tile_m": 4, "tile_n": 2, "threads": 32, "grouping": 8, "minblocks": 16, "algorithm": "medium", "perf": 3387.1, "source": "autotuned"},
{"m": 7, "n": 26, "k": 9, "tile_m": 4, "tile_n": 2, "threads": 32, "grouping": 8, "minblocks": 19, "algorithm": "medium", "perf": 3510.74, "source": "autotuned"},
{"m": 7, "n": 26, "k": 10, "tile_m": 4, "tile_n": 2, "threads": 32, "grouping": 8, "minblocks": 13, "algorithm": "medium", "perf": 3919.42, "source": "autotuned"},
{"m": 7, "n": 26, "k": 13, "tile_m": 4, "tile_n": 2, "w": 6, "v": 26, "threads": 32, "grouping": 16, "minblocks": 4, "algorithm": "largeDB2", "perf": 4422.16, "source": "autotuned"},
{"m": 7, "n": 26, "k": 25, "tile_m": 4, "tile_n": 2, "threads": 32, "grouping": 11, "minblocks": 1, "algorithm": "medium", "perf": 4619.17, "source": "autotuned"},
{"m": 7, "n": 26, "k": 26, "tile_m": 4, "tile_n": 2, "threads": 32, "grouping": 12, "minblocks": 7, "algorithm": "medium", "perf": 4861.5, "source": "autotuned"},
{"m": 7, "n": 26, "k": 28, "tile_m": 4, "tile_n": 2, "threads": 32, "grouping": 12, "minblocks": 5, "algorithm": "medium", "perf": 4893.69, "source": "autotuned"},
{"m": 7, "n": 26, "k": 32, "tile_m": 4, "tile_n": 2, "w": 12, "v": 26, "threads": 32, "grouping": 16, "minblocks": 8, "algorithm": "largeDB2", "perf": 5017.93, "source": "autotuned"},
{"m": 7, "n": 26, "k": 45, "tile_m": 4, "tile_n": 2, "w": 18, "v": 26, "threads": 32, "grouping": 16, "minblocks": 12, "algorithm": "largeDB2", "perf": 5355.78, "source": "autotuned"},
{"m": 7, "n": 28, "k": 4, "tile_m": 4, "tile_n": 2, "threads": 32, "grouping": 8, "minblocks": 25, "algorithm": "medium", "perf": 2721.81, "source": "autotuned"},
{"m": 7, "n": 28, "k": 5, "tile_m": 4, "tile_n": 1, "threads": 64, "grouping": 9, "minblocks": 19, "algorithm": "medium", "perf": 2720.55, "source": "autotuned"},
{"m": 7, "n": 28, "k": 7, "tile_m": 4, "tile_n": 2, "threads": 32, "grouping": 7, "minblocks": 23, "algorithm": "medium", "perf": 3207.44, "source": "autotuned"},
{"m": 7, "n": 28, "k": 9, "tile_m": 4, "tile_n": 2, "threads": 32, "grouping": 8, "minblocks": 18, "algorithm": "medium", "perf": 3742.99, "source": "autotuned"},
{"m": 7, "n": 28, "k": 13, "tile_m": 4, "tile_n": 2, "threads": 32, "grouping": 8, "minblocks": 15, "algorithm": "medium", "perf": 4310.86, "source": "autotuned"},
{"m": 7, "n": 28, "k": 25, "tile_m": 4, "tile_n": 2, "threads": 32, "grouping": 11, "minblocks": 2, "algorithm": "medium", "perf": 4829.09, "source": "autotuned"},
{"m": 7, "n": 28, "k": 26, "tile_m": 4, "tile_n": 2, "threads": 32, "grouping": 12, "minblocks": 1, "algorithm": "medium", "perf": 5067.19, "source": "autotuned"},
{"m": 7, "n": 28, "k": 28, "tile_m": 4, "tile_n": 2, "w": 12, "v": 28, "threads": 32, "grouping": 16, "minblocks": 12, "algorithm": "largeDB2", "perf": 4996.71, "source": "autotuned"},
{"m": 7, "n": 28, "k": 32, "tile_m": 4, "tile_n": 2, "w": 12, "v": 28, "threads": 32, "grouping": 16, "minblocks": 1, "algorithm": "largeDB2", "perf": 5219.6, "source": "autotuned"},
{"m": 7, "n": 28, "k": 45, "tile_m": 4, "tile_n": 2, "w": 16, "v": 28, "threads": 32, "grouping": 16, "minblocks": 12, "algorithm": "largeDB2", "perf": 5518.82, "source": "autotuned"},
{"m": 7, "n": 32, "k": 4, "tile_m": 4, "tile_n": 2, "threads": 32, "grouping": 8, "minblocks": 14, "algorithm": "medium", "perf": 2984.54, "source": "autotuned"},
{"m": 7, "n": 32, "k": 5, "tile_m": 4, "tile_n": 1, "threads": 64, "grouping": 9, "minblocks": 19, "algorithm": "medium", "perf": 3184.46, "source": "autotuned"},
{"m": 7, "n": 32, "k": 6, "tile_m": 7, "tile_n": 1, "threads": 64, "grouping": 8, "minblocks": 20, "algorithm": "medium", "perf": 3458.07, "source": "autotuned"},
{"m": 7, "n": 32, "k": 7, "tile_m": 7, "tile_n": 1, "threads": 64, "grouping": 9, "minblocks": 20, "algorithm": "medium", "perf": 3663.47, "source": "autotuned"},
{"m": 7, "n": 32, "k": 8, "tile_m": 4, "tile_n": 2, "threads": 32, "grouping": 8, "minblocks": 16, "algorithm": "medium", "perf": 4026.72, "source": "autotuned"},
{"m": 7, "n": 32, "k": 9, "tile_m": 4, "tile_n": 2, "w": 4, "v": 32, "threads": 32, "grouping": 16, "minblocks": 1, "algorithm": "largeDB2", "perf": 4401.52, "source": "autotuned"},
{"m": 7, "n": 32, "k": 10, "tile_m": 4, "tile_n": 2, "w": 4, "v": 32, "threads": 32, "grouping": 16, "minblocks": 2, "algorithm": "largeDB2", "perf": 4693.55, "source": "autotuned"},
{"m": 7, "n": 32, "k": 13, "tile_m": 4, "tile_n": 2, "w": 6, "v": 32, "threads": 32, "grouping": 16, "minblocks": 4, "algorithm": "largeDB2", "perf": 5074.76, "source": "autotuned"},
{"m": 7, "n": 32, "k": 22, "tile_m": 4, "tile_n": 2, "threads": 32, "grouping": 12, "minblocks": 7, "algorithm": "medium", "perf": 5469.16, "source": "autotuned"},
{"m": 7, "n": 32, "k": 25, "tile_m": 4, "tile_n": 2, "threads": 32, "grouping": 11, "minblocks": 7, "algorithm": "medium", "perf": 5403.62, "source": "autotuned"},
{"m": 7, "n": 32, "k": 26, "tile_m": 4, "tile_n": 2, "threads": 32, "grouping": 16, "minblocks": 7, "algorithm": "medium", "perf": 5312.3, "source": "autotuned"},
{"m": 7, "n": 32, "k": 28, "tile_m": 4, "tile_n": 2, "w": 12, "v": 32, "threads": 32, "grouping": 16, "minblocks": 2, "algorithm": "largeDB2", "perf": 5407.03, "source": "autotuned"},
{"m": 7, "n": 32, "k": 32, "tile_m": 4, "tile_n": 2, "threads": 32, "grouping": 16, "minblocks": 1, "algorithm": "medium", "perf": 5575.61, "source": "autotuned"},
{"m": 7, "n": 32, "k": 45, "tile_m": 4, "tile_n": 2, "w": 22, "v": 32, "threads": 32, "grouping": 16, "minblocks": 1, "algorithm": "largeDB2", "perf": 5817.2, "source": "autotuned"},
{"m": 7, "n": 45, "k": 4, "tile_m": 4, "tile_n": 3, "threads": 32, "grouping": 8, "minblocks": 9, "algorithm": "medium", "perf": 3571.64, "source": "autotuned"},
{"m": 7, "n": 45, "k": 5, "tile_m": 4, "tile_n": 2, "threads": 64, "grouping": 9, "minblocks": 14, "algorithm": "medium", "perf": 3753.73, "source": "autotuned"},
{"m": 7, "n": 45, "k": 6, "tile_m": 4, "tile_n": 3, "threads": 32, "grouping": 8, "minblocks": 1, "algorithm": "medium", "perf": 3967.66, "source": "autotuned"},
{"m": 7, "n": 45, "k": 7, "tile_m": 4, "tile_n": 3, "threads": 32, "grouping": 8, "minblocks": 13, "algorithm": "medium", "perf": 4414.91, "source": "autotuned"},
{"m": 7, "n": 45, "k": 8, "tile_m": 4, "tile_n": 3, "threads": 32, "grouping": 8, "minblocks": 16, "algorithm": "medium", "perf": 4716.16, "source": "autotuned"},
{"m": 7, "n": 45, "k": 9, "tile_m": 4, "tile_n": 3, "threads": 32, "grouping": 8, "minblocks": 15, "algorithm": "medium", "perf": 4951.35, "source": "autotuned"},
{"m": 7, "n": 45, "k": 10, "tile_m": 4, "tile_n": 3, "threads": 32, "grouping": 8, "minblocks": 15, "algorithm": "medium", "perf": 5041.58, "source": "autotuned"},
{"m": 7, "n": 45, "k": 13, "tile_m": 4, "tile_n": 3, "threads": 32, "grouping": 11, "minblocks": 8, "algorithm": "medium", "perf": 5396.94, "source": "autotuned"},
{"m": 7, "n": 45, "k": 25, "tile_m": 4, "tile_n": 3, "threads": 32, "grouping": 16, "minblocks": 4, "algorithm": "medium", "perf": 5667.24, "source": "autotuned"},
{"m": 7, "n": 45, "k": 26, "tile_m": 4, "tile_n": 3, "threads": 32, "grouping": 16, "minblocks": 4, "algorithm": "medium", "perf": 5726.39, "source": "autotuned"},
{"m": 7, "n": 45, "k": 28, "tile_m": 4, "tile_n": 3, "threads": 32, "grouping": 16, "minblocks": 3, "algorithm": "medium", "perf": 5817.2, "source": "autotuned"},
{"m": 7, "n": 45, "k": 32, "tile_m": 4, "tile_n": 3, "threads": 32, "grouping": 16, "minblocks": 1, "algorithm": "medium", "perf": 6053.52, "source": "autotuned"},
{"m": 7, "n": 45, "k": 45, "tile_m": 4, "tile_n": 3, "w": 18, "v": 32, "threads": 32, "grouping": 16, "minblocks": 1, "algorithm": "largeDB2", "perf": 6004.84, "source": "autotuned"},
{"m": 8, "n": 4, "k": 4, "tile_m": 1, "tile_n": 1, "threads": 32, "grouping": 6, "minblocks": 16, "algorithm": "medium", "perf": 596.078, "source": "autotuned"},
{"m": 8, "n": 4, "k": 5, "tile_m": 1, "tile_n": 1, "threads": 64, "grouping": 9, "minblocks": 24, "algorithm": "medium", "perf": 835.546, "source": "autotuned"},
{"m": 8, "n": 4, "k": 6, "tile_m": 1, "tile_n": 1, "threads": 64, "grouping": 9, "minblocks": 14, "algorithm": "medium", "perf": 974.011, "source": "autotuned"},
{"m": 8, "n": 4, "k": 7, "tile_m": 1, "tile_n": 1, "threads": 64, "grouping": 6, "minblocks": 16, "algorithm": "medium", "perf": 1080.47, "source": "autotuned"},
{"m": 8, "n": 4, "k": 8, "tile_m": 1, "tile_n": 1, "threads": 64, "grouping": 6, "minblocks": 5, "algorithm": "small", "perf": 1026.8, "source": "autotuned"},
{"m": 8, "n": 4, "k": 9, "tile_m": 1, "tile_n": 1, "threads": 96, "grouping": 11, "minblocks": 15, "algorithm": "medium", "perf": 1231.4, "source": "autotuned"},
{"m": 8, "n": 4, "k": 10, "tile_m": 1, "tile_n": 1, "threads": 96, "grouping": 8, "minblocks": 19, "algorithm": "medium", "perf": 1331.19, "source": "autotuned"},
{"m": 8, "n": 4, "k": 13, "tile_m": 1, "tile_n": 1, "threads": 128, "grouping": 11, "minblocks": 13, "algorithm": "medium", "perf": 1425.59, "source": "autotuned"},
{"m": 8, "n": 4, "k": 15, "tile_m": 1, "tile_n": 1, "threads": 128, "grouping": 4, "minblocks": 15, "algorithm": "medium", "perf": 1571.49, "source": "autotuned"},
{"m": 8, "n": 4, "k": 22, "tile_m": 1, "tile_n": 1, "threads": 96, "grouping": 6, "minblocks": 21, "algorithm": "medium", "perf": 1832.78, "source": "autotuned"},
{"m": 8, "n": 4, "k": 26, "tile_m": 1, "tile_n": 1, "threads": 32, "grouping": 3, "minblocks": 17, "algorithm": "medium", "perf": 1860.77, "source": "autotuned"},
{"m": 8, "n": 4, "k": 32, "tile_m": 1, "tile_n": 1, "w": 12, "v": 4, "threads": 32, "grouping": 16, "minblocks": 8, "algorithm": "largeDB2", "perf": 2166.34, "source": "autotuned"},
{"m": 8, "n": 4, "k": 45, "tile_m": 1, "tile_n": 1, "w": 20, "v": 4, "threads": 32, "grouping": 16, "minblocks": 8, "algorithm": "largeDB2", "perf": 2208.86, "source": "autotuned"},
{"m": 8, "n": 5, "k": 4, "tile_m": 2, "tile_n": 1, "threads": 64, "grouping": 9, "minblocks": 1, "algorithm": "medium", "perf": 810.696, "source": "autotuned"},
{"m": 8, "n": 5, "k": 5, "tile_m": 2, "tile_n": 1, "threads": 64, "grouping": 9, "minblocks": 12, "algorithm": "medium", "perf": 962.585, "source": "autotuned"},
{"m": 8, "n": 5, "k": 6, "tile_m": 2, "tile_n": 1, "threads": 64, "grouping": 9, "minblocks": 14, "algorithm": "medium", "perf": 1109.68, "source": "autotuned"},
{"m": 8, "n": 5, "k": 7, "tile_m": 2, "tile_n": 1, "threads": 64, "grouping": 9, "minblocks": 17, "algorithm": "medium", "perf": 1216.57, "source": "autotuned"},
{"m": 8, "n": 5, "k": 8, "tile_m": 1, "tile_n": 1, "threads": 64, "grouping": 7, "minblocks": 27, "algorithm": "medium", "perf": 1169.45, "source": "autotuned"},
{"m": 8, "n": 5, "k": 9, "tile_m": 1, "tile_n": 2, "threads": 96, "grouping": 8, "minblocks": 16, "algorithm": "medium", "perf": 1362.39, "source": "autotuned"},
{"m": 8, "n": 5, "k": 10, "tile_m": 1, "tile_n": 2, "threads": 96, "grouping": 8, "minblocks": 21, "algorithm": "medium", "perf": 1450.41, "source": "autotuned"},
{"m": 8, "n": 5, "k": 13, "tile_m": 1, "tile_n": 2, "threads": 128, "grouping": 9, "minblocks": 14, "algorithm": "medium", "perf": 1600.91, "source": "autotuned"},
{"m": 8, "n": 5, "k": 15, "tile_m": 1, "tile_n": 2, "threads": 128, "grouping": 8, "minblocks": 15, "algorithm": "medium", "perf": 1730.64, "source": "autotuned"},
{"m": 8, "n": 5, "k": 22, "tile_m": 1, "tile_n": 2, "threads": 32, "grouping": 8, "minblocks": 25, "algorithm": "medium", "perf": 1902.71, "source": "autotuned"},
{"m": 8, "n": 5, "k": 26, "tile_m": 1, "tile_n": 2, "threads": 32, "grouping": 8, "minblocks": 21, "algorithm": "medium", "perf": 1997.42, "source": "autotuned"},
{"m": 8, "n": 5, "k": 32, "tile_m": 1, "tile_n": 2, "threads": 32, "grouping": 4, "minblocks": 3, "algorithm": "medium", "perf": 2173.03, "source": "autotuned"},
{"m": 8, "n": 5, "k": 45, "tile_m": 1, "tile_n": 2, "w": 18, "v": 4, "threads": 32, "grouping": 16, "minblocks": 12, "algorithm": "largeDB2", "perf": 2296.64, "source": "autotuned"},
{"m": 8, "n": 6, "k": 4, "tile_m": 1, "tile_n": 2, "threads": 64, "grouping": 9, "minblocks": 18, "algorithm": "medium", "perf": 1005.14, "source": "autotuned"},
{"m": 8, "n": 6, "k": 5, "tile_m": 1, "tile_n": 2, "threads": 64, "grouping": 9, "minblocks": 18, "algorithm": "medium", "perf": 1202.22, "source": "autotuned"},
{"m": 8, "n": 6, "k": 6, "tile_m": 1, "tile_n": 2, "threads": 64, "grouping": 9, "minblocks": 18, "algorithm": "medium", "perf": 1355.35, "source": "autotuned"},
{"m": 8, "n": 6, "k": 7, "tile_m": 1, "tile_n": 2, "threads": 64, "grouping": 9, "minblocks": 24, "algorithm": "medium", "perf": 1495.6, "source": "autotuned"},
{"m": 8, "n": 6, "k": 8, "tile_m": 1, "tile_n": 2, "threads": 64, "grouping": 5, "minblocks": 29, "algorithm": "small", "perf": 1417.74, "source": "autotuned"},
{"m": 8, "n": 6, "k": 9, "tile_m": 1, "tile_n": 2, "threads": 96, "grouping": 8, "minblocks": 17, "algorithm": "medium", "perf": 1637.1, "source": "autotuned"},
{"m": 8, "n": 6, "k": 10, "tile_m": 1, "tile_n": 2, "threads": 96, "grouping": 8, "minblocks": 16, "algorithm": "medium", "perf": 1756.81, "source": "autotuned"},
{"m": 8, "n": 6, "k": 13, "tile_m": 1, "tile_n": 2, "threads": 128, "grouping": 8, "minblocks": 13, "algorithm": "medium", "perf": 1928.61, "source": "autotuned"},
{"m": 8, "n": 6, "k": 15, "tile_m": 1, "tile_n": 2, "threads": 128, "grouping": 8, "minblocks": 16, "algorithm": "medium", "perf": 2057.09, "source": "autotuned"},
{"m": 8, "n": 6, "k": 22, "tile_m": 1, "tile_n": 2, "threads": 32, "grouping": 8, "minblocks": 24, "algorithm": "medium", "perf": 2236.69, "source": "autotuned"},
{"m": 8, "n": 6, "k": 26, "tile_m": 1, "tile_n": 2, "threads": 32, "grouping": 8, "minblocks": 21, "algorithm": "medium", "perf": 2386.98, "source": "autotuned"},
{"m": 8, "n": 6, "k": 32, "tile_m": 1, "tile_n": 2, "w": 12, "v": 6, "threads": 32, "grouping": 16, "minblocks": 4, "algorithm": "largeDB2", "perf": 2658.84, "source": "autotuned"},
{"m": 8, "n": 6, "k": 45, "tile_m": 1, "tile_n": 2, "w": 20, "v": 6, "threads": 32, "grouping": 16, "minblocks": 2, "algorithm": "largeDB2", "perf": 2728.13, "source": "autotuned"},
{"m": 8, "n": 7, "k": 4, "tile_m": 1, "tile_n": 2, "threads": 64, "grouping": 9, "minblocks": 23, "algorithm": "medium", "perf": 1128.35, "source": "autotuned"},
{"m": 8, "n": 7, "k": 5, "tile_m": 1, "tile_n": 2, "threads": 64, "grouping": 9, "minblocks": 14, "algorithm": "medium", "perf": 1329.15, "source": "autotuned"},
{"m": 8, "n": 7, "k": 6, "tile_m": 1, "tile_n": 2, "threads": 64, "grouping": 9, "minblocks": 24, "algorithm": "medium", "perf": 1543.87, "source": "autotuned"},
{"m": 8, "n": 7, "k": 7, "tile_m": 1, "tile_n": 2, "threads": 64, "grouping": 9, "minblocks": 21, "algorithm": "medium", "perf": 1691.12, "source": "autotuned"},
{"m": 8, "n": 7, "k": 8, "tile_m": 1, "tile_n": 2, "threads": 64, "grouping": 7, "minblocks": 6, "algorithm": "small", "perf": 1610.08, "source": "autotuned"},
{"m": 8, "n": 7, "k": 9, "tile_m": 1, "tile_n": 2, "threads": 96, "grouping": 8, "minblocks": 21, "algorithm": "medium", "perf": 1862.65, "source": "autotuned"},
{"m": 8, "n": 7, "k": 10, "tile_m": 1, "tile_n": 2, "threads": 96, "grouping": 8, "minblocks": 20, "algorithm": "medium", "perf": 1994.8, "source": "autotuned"},
{"m": 8, "n": 7, "k": 13, "tile_m": 1, "tile_n": 2, "threads": 128, "grouping": 9, "minblocks": 13, "algorithm": "medium", "perf": 2188.03, "source": "autotuned"},
{"m": 8, "n": 7, "k": 15, "tile_m": 1, "tile_n": 2, "threads": 128, "grouping": 9, "minblocks": 13, "algorithm": "medium", "perf": 2382.28, "source": "autotuned"},
{"m": 8, "n": 7, "k": 22, "tile_m": 1, "tile_n": 2, "threads": 32, "grouping": 8, "minblocks": 21, "algorithm": "medium", "perf": 2563.73, "source": "autotuned"},
{"m": 8, "n": 7, "k": 26, "tile_m": 1, "tile_n": 2, "threads": 32, "grouping": 8, "minblocks": 6, "algorithm": "medium", "perf": 2695.89, "source": "autotuned"},
{"m": 8, "n": 7, "k": 32, "tile_m": 1, "tile_n": 2, "w": 12, "v": 6, "threads": 32, "grouping": 16, "minblocks": 1, "algorithm": "largeDB2", "perf": 2953.96, "source": "autotuned"},
{"m": 8, "n": 7, "k": 45, "tile_m": 1, "tile_n": 2, "w": 18, "v": 4, "threads": 32, "grouping": 16, "minblocks": 12, "algorithm": "largeDB2", "perf": 2997.37, "source": "autotuned"},
{"m": 8, "n": 8, "k": 4, "tile_m": 1, "tile_n": 1, "threads": 64, "grouping": 13, "minblocks": 27, "algorithm": "medium", "perf": 1241.6, "source": "autotuned"},
{"m": 8, "n": 8, "k": 5, "tile_m": 1, "tile_n": 2, "threads": 64, "grouping": 7, "minblocks": 26, "algorithm": "medium", "perf": 1503.72, "source": "autotuned"},
{"m": 8, "n": 8, "k": 6, "tile_m": 1, "tile_n": 2, "threads": 64, "grouping": 9, "minblocks": 5, "algorithm": "medium", "perf": 1806.56, "source": "autotuned"},
{"m": 8, "n": 8, "k": 7, "tile_m": 1, "tile_n": 2, "threads": 64, "grouping": 9, "minblocks": 24, "algorithm": "medium", "perf": 1962.02, "source": "autotuned"},
{"m": 8, "n": 8, "k": 8, "tile_m": 1, "tile_n": 2, "threads": 64, "grouping": 9, "minblocks": 5, "algorithm": "small", "perf": 2052.4, "source": "autotuned"},
{"m": 8, "n": 8, "k": 9, "tile_m": 1, "tile_n": 2, "threads": 32, "grouping": 4, "minblocks": 4, "algorithm": "small", "perf": 2158.75, "source": "autotuned"},
{"m": 8, "n": 8, "k": 10, "tile_m": 1, "tile_n": 2, "threads": 32, "grouping": 4, "minblocks": 7, "algorithm": "small", "perf": 2365.12, "source": "autotuned"},
{"m": 8, "n": 8, "k": 13, "tile_m": 1, "tile_n": 2, "threads": 128, "grouping": 13, "minblocks": 11, "algorithm": "medium", "perf": 2485.35, "source": "autotuned"},
{"m": 8, "n": 8, "k": 15, "tile_m": 1, "tile_n": 2, "threads": 128, "grouping": 9, "minblocks": 14, "algorithm": "medium", "perf": 2718.62, "source": "autotuned"},
{"m": 8, "n": 8, "k": 22, "tile_m": 1, "tile_n": 2, "threads": 32, "grouping": 8, "minblocks": 22, "algorithm": "medium", "perf": 3061.83, "source": "autotuned"},
{"m": 8, "n": 8, "k": 26, "tile_m": 1, "tile_n": 2, "threads": 32, "grouping": 8, "minblocks": 15, "algorithm": "medium", "perf": 3175.7, "source": "autotuned"},
{"m": 8, "n": 8, "k": 32, "tile_m": 1, "tile_n": 2, "threads": 32, "grouping": 8, "minblocks": 15, "algorithm": "medium", "perf": 3662.65, "source": "autotuned"},
{"m": 8, "n": 8, "k": 45, "tile_m": 1, "tile_n": 2, "threads": 32, "grouping": 8, "minblocks": 8, "algorithm": "medium", "perf": 3692.28, "source": "autotuned"},
{"m": 8, "n": 9, "k": 4, "tile_m": 4, "tile_n": 1, "threads": 64, "grouping": 9, "minblocks": 7, "algorithm": "medium", "perf": 1314.36, "source": "autotuned"},
{"m": 8, "n": 9, "k": 5, "tile_m": 4, "tile_n": 1, "threads": 64, "grouping": 9, "minblocks": 23, "algorithm": "medium", "perf": 1537.4, "source": "autotuned"},
{"m": 8, "n": 9, "k": 6, "tile_m": 4, "tile_n": 1, "threads": 64, "grouping": 9, "minblocks": 16, "algorithm": "medium", "perf": 1741.23, "source": "autotuned"},
{"m": 8, "n": 9, "k": 7, "tile_m": 4, "tile_n": 1, "threads": 64, "grouping": 9, "minblocks": 14, "algorithm": "medium", "perf": 1910.59, "source": "autotuned"},
{"m": 8, "n": 9, "k": 8, "tile_m": 4, "tile_n": 1, "threads": 96, "grouping": 8, "minblocks": 15, "algorithm": "medium", "perf": 2020.33, "source": "autotuned"},
{"m": 8, "n": 9, "k": 9, "tile_m": 4, "tile_n": 1, "threads": 96, "grouping": 8, "minblocks": 15, "algorithm": "medium", "perf": 2177.1, "source": "autotuned"},
{"m": 8, "n": 9, "k": 10, "tile_m": 4, "tile_n": 1, "threads": 96, "grouping": 8, "minblocks": 16, "algorithm": "medium", "perf": 2303.64, "source": "autotuned"},
{"m": 8, "n": 9, "k": 13, "tile_m": 4, "tile_n": 1, "threads": 128, "grouping": 8, "minblocks": 16, "algorithm": "medium", "perf": 2490.65, "source": "autotuned"},
{"m": 8, "n": 9, "k": 15, "tile_m": 4, "tile_n": 1, "threads": 32, "grouping": 8, "minblocks": 2, "algorithm": "medium", "perf": 2485.61, "source": "autotuned"},
{"m": 8, "n": 9, "k": 22, "tile_m": 4, "tile_n": 1, "threads": 32, "grouping": 8, "minblocks": 15, "algorithm": "medium", "perf": 2805.83, "source": "autotuned"},
{"m": 8, "n": 9, "k": 26, "tile_m": 4, "tile_n": 1, "threads": 32, "grouping": 8, "minblocks": 17, "algorithm": "medium", "perf": 2982.61, "source": "autotuned"},
{"m": 8, "n": 9, "k": 32, "tile_m": 4, "tile_n": 1, "w": 12, "v": 6, "threads": 32, "grouping": 16, "minblocks": 4, "algorithm": "largeDB2", "perf": 3237.88, "source": "autotuned"},
{"m": 8, "n": 9, "k": 45, "tile_m": 4, "tile_n": 1, "w": 16, "v": 6, "threads": 32, "grouping": 16, "minblocks": 2, "algorithm": "largeDB2", "perf": 3359.72, "source": "autotuned"},
{"m": 8, "n": 10, "k": 4, "tile_m": 1, "tile_n": 3, "threads": 64, "grouping": 8, "minblocks": 17, "algorithm": "medium", "perf": 1490.97, "source": "autotuned"},
{"m": 8, "n": 10, "k": 5, "tile_m": 1, "tile_n": 3, "threads": 64, "grouping": 9, "minblocks": 7, "algorithm": "medium", "perf": 1718.46, "source": "autotuned"},
{"m": 8, "n": 10, "k": 6, "tile_m": 1, "tile_n": 3, "threads": 64, "grouping": 9, "minblocks": 5, "algorithm": "medium", "perf": 1932.79, "source": "autotuned"},
{"m": 8, "n": 10, "k": 7, "tile_m": 4, "tile_n": 1, "threads": 96, "grouping": 8, "minblocks": 15, "algorithm": "medium", "perf": 2072.28, "source": "autotuned"},
{"m": 8, "n": 10, "k": 8, "tile_m": 4, "tile_n": 1, "threads": 96, "grouping": 8, "minblocks": 14, "algorithm": "medium", "perf": 2248.81, "source": "autotuned"},
{"m": 8, "n": 10, "k": 9, "tile_m": 4, "tile_n": 1, "threads": 96, "grouping": 8, "minblocks": 15, "algorithm": "medium", "perf": 2415.43, "source": "autotuned"},
{"m": 8, "n": 10, "k": 10, "tile_m": 4, "tile_n": 1, "threads": 128, "grouping": 8, "minblocks": 14, "algorithm": "medium", "perf": 2387.38, "source": "autotuned"},
{"m": 8, "n": 10, "k": 13, "tile_m": 1, "tile_n": 3, "threads": 160, "grouping": 16, "minblocks": 8, "algorithm": "medium", "perf": 2557.65, "source": "autotuned"},
{"m": 8, "n": 10, "k": 15, "tile_m": 1, "tile_n": 3, "threads": 160, "grouping": 16, "minblocks": 8, "algorithm": "medium", "perf": 2764.57, "source": "autotuned"},
{"m": 8, "n": 10, "k": 22, "tile_m": 4, "tile_n": 1, "threads": 32, "grouping": 8, "minblocks": 11, "algorithm": "medium", "perf": 3145.44, "source": "autotuned"},
{"m": 8, "n": 10, "k": 26, "tile_m": 1, "tile_n": 3, "w": 12, "v": 10, "threads": 32, "grouping": 16, "minblocks": 12, "algorithm": "largeDB2", "perf": 3428.7, "source": "autotuned"},
{"m": 8, "n": 10, "k": 32, "tile_m": 4, "tile_n": 1, "threads": 32, "grouping": 8, "minblocks": 10, "algorithm": "medium", "perf": 3516.37, "source": "autotuned"},
{"m": 8, "n": 10, "k": 45, "tile_m": 4, "tile_n": 1, "w": 16, "v": 10, "threads": 32, "grouping": 16, "minblocks": 1, "algorithm": "largeDB2", "perf": 3614.38, "source": "autotuned"},
{"m": 8, "n": 13, "k": 4, "tile_m": 4, "tile_n": 1, "threads": 64, "grouping": 9, "minblocks": 4, "algorithm": "medium", "perf": 1874.74, "source": "autotuned"},
{"m": 8, "n": 13, "k": 5, "tile_m": 4, "tile_n": 1, "threads": 96, "grouping": 8, "minblocks": 14, "algorithm": "medium", "perf": 2066.19, "source": "autotuned"},
{"m": 8, "n": 13, "k": 6, "tile_m": 4, "tile_n": 1, "threads": 96, "grouping": 12, "minblocks": 12, "algorithm": "medium", "perf": 2354.56, "source": "autotuned"},
{"m": 8, "n": 13, "k": 7, "tile_m": 4, "tile_n": 1, "threads": 96, "grouping": 8, "minblocks": 16, "algorithm": "medium", "perf": 2588.85, "source": "autotuned"},
{"m": 8, "n": 13, "k": 8, "tile_m": 4, "tile_n": 1, "threads": 128, "grouping": 8, "minblocks": 16, "algorithm": "medium", "perf": 2640.98, "source": "autotuned"},
{"m": 8, "n": 13, "k": 9, "tile_m": 4, "tile_n": 1, "threads": 128, "grouping": 8, "minblocks": 13, "algorithm": "medium", "perf": 2785.31, "source": "autotuned"},
{"m": 8, "n": 13, "k": 10, "tile_m": 4, "tile_n": 1, "threads": 160, "grouping": 16, "minblocks": 8, "algorithm": "medium", "perf": 2799.71, "source": "autotuned"},
{"m": 8, "n": 13, "k": 13, "tile_m": 4, "tile_n": 1, "threads": 32, "grouping": 8, "minblocks": 6, "algorithm": "medium", "perf": 3091.64, "source": "autotuned"},
{"m": 8, "n": 13, "k": 15, "tile_m": 4, "tile_n": 1, "threads": 32, "grouping": 8, "minblocks": 5, "algorithm": "medium", "perf": 3295.64, "source": "autotuned"},
{"m": 8, "n": 13, "k": 22, "tile_m": 4, "tile_n": 1, "w": 10, "v": 8, "threads": 32, "grouping": 16, "minblocks": 1, "algorithm": "largeDB2", "perf": 3884.44, "source": "autotuned"},
{"m": 8, "n": 13, "k": 26, "tile_m": 4, "tile_n": 1, "threads": 32, "grouping": 8, "minblocks": 14, "algorithm": "medium", "perf": 3930.03, "source": "autotuned"},
{"m": 8, "n": 13, "k": 32, "tile_m": 4, "tile_n": 1, "w": 12, "v": 8, "threads": 32, "grouping": 16, "minblocks": 1, "algorithm": "largeDB2", "perf": 4041.73, "source": "autotuned"},
{"m": 8, "n": 13, "k": 45, "tile_m": 4, "tile_n": 1, "w": 20, "v": 8, "threads": 32, "grouping": 16, "minblocks": 12, "algorithm": "largeDB2", "perf": 4272.71, "source": "autotuned"},
{"m": 8, "n": 15, "k": 4, "tile_m": 4, "tile_n": 1, "threads": 64, "grouping": 9, "minblocks": 3, "algorithm": "medium", "perf": 2147.95, "source": "autotuned"},
{"m": 8, "n": 15, "k": 5, "tile_m": 4, "tile_n": 1, "threads": 96, "grouping": 9, "minblocks": 15, "algorithm": "medium", "perf": 2375.1, "source": "autotuned"},
{"m": 8, "n": 15, "k": 6, "tile_m": 4, "tile_n": 1, "threads": 96, "grouping": 12, "minblocks": 12, "algorithm": "medium", "perf": 2679.76, "source": "autotuned"},
{"m": 8, "n": 15, "k": 7, "tile_m": 4, "tile_n": 1, "threads": 128, "grouping": 8, "minblocks": 15, "algorithm": "medium", "perf": 2680.26, "source": "autotuned"},
{"m": 8, "n": 15, "k": 8, "tile_m": 4, "tile_n": 1, "threads": 128, "grouping": 16, "minblocks": 8, "algorithm": "medium", "perf": 2993.02, "source": "autotuned"},
{"m": 8, "n": 15, "k": 9, "tile_m": 4, "tile_n": 1, "threads": 32, "grouping": 5, "minblocks": 27, "algorithm": "medium", "perf": 2991.87, "source": "autotuned"},
{"m": 8, "n": 15, "k": 10, "tile_m": 4, "tile_n": 1, "threads": 160, "grouping": 16, "minblocks": 8, "algorithm": "medium", "perf": 3147.29, "source": "autotuned"},
{"m": 8, "n": 15, "k": 13, "tile_m": 4, "tile_n": 1, "threads": 32, "grouping": 8, "minblocks": 2, "algorithm": "medium", "perf": 3443.83, "source": "autotuned"},
{"m": 8, "n": 15, "k": 15, "tile_m": 4, "tile_n": 1, "threads": 32, "grouping": 8, "minblocks": 4, "algorithm": "medium", "perf": 3669.62, "source": "autotuned"},
{"m": 8, "n": 22, "k": 4, "tile_m": 2, "tile_n": 3, "threads": 96, "grouping": 16, "minblocks": 2, "algorithm": "medium", "perf": 2589.6, "source": "autotuned"},
{"m": 8, "n": 22, "k": 5, "tile_m": 2, "tile_n": 3, "threads": 128, "grouping": 13, "minblocks": 10, "algorithm": "medium", "perf": 2780.65, "source": "autotuned"},
{"m": 8, "n": 22, "k": 6, "tile_m": 4, "tile_n": 1, "threads": 64, "grouping": 9, "minblocks": 17, "algorithm": "medium", "perf": 2993.98, "source": "autotuned"},
{"m": 8, "n": 22, "k": 7, "tile_m": 4, "tile_n": 1, "threads": 64, "grouping": 9, "minblocks": 20, "algorithm": "medium", "perf": 3285.48, "source": "autotuned"},
{"m": 8, "n": 22, "k": 8, "tile_m": 2, "tile_n": 3, "threads": 32, "grouping": 6, "minblocks": 21, "algorithm": "medium", "perf": 3464.8, "source": "autotuned"},
{"m": 8, "n": 22, "k": 9, "tile_m": 2, "tile_n": 3, "threads": 96, "grouping": 11, "minblocks": 11, "algorithm": "medium", "perf": 3585.99, "source": "autotuned"},
{"m": 8, "n": 22, "k": 10, "tile_m": 2, "tile_n": 3, "threads": 32, "grouping": 7, "minblocks": 24, "algorithm": "medium", "perf": 3896.25, "source": "autotuned"},
{"m": 8, "n": 22, "k": 13, "tile_m": 2, "tile_n": 3, "threads": 32, "grouping": 8, "minblocks": 6, "algorithm": "medium", "perf": 4362.78, "source": "autotuned"},
{"m": 8, "n": 22, "k": 22, "tile_m": 2, "tile_n": 3, "w": 10, "v": 22, "threads": 32, "grouping": 16, "minblocks": 1, "algorithm": "largeDB2", "perf": 4702.4, "source": "autotuned"},
{"m": 8, "n": 22, "k": 32, "tile_m": 2, "tile_n": 3, "threads": 32, "grouping": 11, "minblocks": 4, "algorithm": "medium", "perf": 5273.41, "source": "autotuned"},
{"m": 8, "n": 26, "k": 4, "tile_m": 4, "tile_n": 1, "threads": 128, "grouping": 9, "minblocks": 15, "algorithm": "medium", "perf": 2684.71, "source": "autotuned"},
{"m": 8, "n": 26, "k": 5, "tile_m": 4, "tile_n": 1, "threads": 64, "grouping": 9, "minblocks": 17, "algorithm": "medium", "perf": 2960.37, "source": "autotuned"},
{"m": 8, "n": 26, "k": 6, "tile_m": 4, "tile_n": 1, "threads": 64, "grouping": 8, "minblocks": 24, "algorithm": "medium", "perf": 3287.83, "source": "autotuned"},
{"m": 8, "n": 26, "k": 7, "tile_m": 4, "tile_n": 1, "threads": 64, "grouping": 8, "minblocks": 23, "algorithm": "medium", "perf": 3558.84, "source": "autotuned"},
{"m": 8, "n": 26, "k": 8, "tile_m": 2, "tile_n": 4, "threads": 32, "grouping": 8, "minblocks": 15, "algorithm": "medium", "perf": 3651.41, "source": "autotuned"},
{"m": 8, "n": 26, "k": 9, "tile_m": 4, "tile_n": 2, "threads": 32, "grouping": 8, "minblocks": 16, "algorithm": "medium", "perf": 3830.72, "source": "autotuned"},
{"m": 8, "n": 26, "k": 10, "tile_m": 4, "tile_n": 2, "threads": 32, "grouping": 8, "minblocks": 15, "algorithm": "medium", "perf": 4211.84, "source": "autotuned"},
{"m": 8, "n": 26, "k": 13, "tile_m": 4, "tile_n": 2, "w": 6, "v": 26, "threads": 32, "grouping": 16, "minblocks": 2, "algorithm": "largeDB2", "perf": 4802.21, "source": "autotuned"},
{"m": 8, "n": 26, "k": 26, "tile_m": 4, "tile_n": 2, "threads": 32, "grouping": 12, "minblocks": 9, "algorithm": "medium", "perf": 5377.43, "source": "autotuned"},
{"m": 8, "n": 26, "k": 45, "tile_m": 4, "tile_n": 2, "w": 18, "v": 16, "threads": 32, "grouping": 16, "minblocks": 12, "algorithm": "largeDB2", "perf": 5967.45, "source": "autotuned"},
{"m": 8, "n": 32, "k": 4, "tile_m": 4, "tile_n": 1, "threads": 64, "grouping": 9, "minblocks": 18, "algorithm": "medium", "perf": 3086.85, "source": "autotuned"},
{"m": 8, "n": 32, "k": 5, "tile_m": 4, "tile_n": 1, "threads": 64, "grouping": 9, "minblocks": 19, "algorithm": "medium", "perf": 3586.55, "source": "autotuned"},
{"m": 8, "n": 32, "k": 6, "tile_m": 4, "tile_n": 1, "threads": 64, "grouping": 9, "minblocks": 20, "algorithm": "medium", "perf": 3963.83, "source": "autotuned"},
{"m": 8, "n": 32, "k": 7, "tile_m": 4, "tile_n": 1, "threads": 64, "grouping": 9, "minblocks": 19, "algorithm": "medium", "perf": 4247.77, "source": "autotuned"},
{"m": 8, "n": 32, "k": 8, "tile_m": 2, "tile_n": 4, "threads": 32, "grouping": 8, "minblocks": 18, "algorithm": "medium", "perf": 4469.76, "source": "autotuned"},
{"m": 8, "n": 32, "k": 9, "tile_m": 4, "tile_n": 2, "w": 4, "v": 32, "threads": 32, "grouping": 16, "minblocks": 12, "algorithm": "largeDB2", "perf": 3935.66, "source": "autotuned"},
{"m": 8, "n": 32, "k": 10, "tile_m": 4, "tile_n": 2, "w": 4, "v": 32, "threads": 32, "grouping": 16, "minblocks": 2, "algorithm": "largeDB2", "perf": 5173.33, "source": "autotuned"},
{"m": 8, "n": 32, "k": 13, "tile_m": 4, "tile_n": 2, "threads": 32, "grouping": 8, "minblocks": 15, "algorithm": "medium", "perf": 5335.0, "source": "autotuned"},
{"m": 8, "n": 32, "k": 22, "tile_m": 4, "tile_n": 2, "threads": 32, "grouping": 12, "minblocks": 3, "algorithm": "medium", "perf": 6075.23, "source": "autotuned"},
{"m": 8, "n": 32, "k": 32, "tile_m": 4, "tile_n": 2, "threads": 32, "grouping": 16, "minblocks": 1, "algorithm": "medium", "perf": 6290.6, "source": "autotuned"},
{"m": 8, "n": 45, "k": 4, "tile_m": 2, "tile_n": 3, "threads": 64, "grouping": 9, "minblocks": 15, "algorithm": "medium", "perf": 3616.95, "source": "autotuned"},
{"m": 8, "n": 45, "k": 5, "tile_m": 2, "tile_n": 3, "threads": 64, "grouping": 9, "minblocks": 18, "algorithm": "medium", "perf": 4028.1, "source": "autotuned"},
{"m": 8, "n": 45, "k": 6, "tile_m": 4, "tile_n": 3, "threads": 32, "grouping": 8, "minblocks": 16, "algorithm": "medium", "perf": 4423.99, "source": "autotuned"},
{"m": 8, "n": 45, "k": 7, "tile_m": 4, "tile_n": 3, "threads": 32, "grouping": 8, "minblocks": 15, "algorithm": "medium", "perf": 4794.65, "source": "autotuned"},
{"m": 8, "n": 45, "k": 8, "tile_m": 4, "tile_n": 3, "threads": 32, "grouping": 8, "minblocks": 16, "algorithm": "medium", "perf": 5149.06, "source": "autotuned"},
{"m": 8, "n": 45, "k": 9, "tile_m": 4, "tile_n": 3, "threads": 32, "grouping": 8, "minblocks": 16, "algorithm": "medium", "perf": 5389.71, "source": "autotuned"},
{"m": 8, "n": 45, "k": 10, "tile_m": 4, "tile_n": 3, "threads": 32, "grouping": 8, "minblocks": 14, "algorithm": "medium", "perf": 5517.56, "source": "autotuned"},
{"m": 8, "n": 45, "k": 13, "tile_m": 4, "tile_n": 3, "threads": 32, "grouping": 11, "minblocks": 1, "algorithm": "medium", "perf": 6040.6, "source": "autotuned"},
{"m": 8, "n": 45, "k": 26, "tile_m": 4, "tile_n": 3, "threads": 32, "grouping": 16, "minblocks": 1, "algorithm": "medium", "perf": 6464.62, "source": "autotuned"},
{"m": 8, "n": 45, "k": 45, "tile_m": 4, "tile_n": 3, "w": 16, "v": 36, "threads": 32, "grouping": 16, "minblocks": 8, "algorithm": "largeDB2", "perf": 6725.02, "source": "autotuned"},
{"m": 9, "n": 4, "k": 4, "tile_m": 1, "tile_n": 1, "threads": 64, "grouping": 10, "minblocks": 16, "algorithm": "medium", "perf": 727.03, "source": "autotuned"},
{"m": 9, "n": 4, "k": 5, "tile_m": 1, "tile_n": 1, "threads": 64, "grouping": 10, "minblocks": 16, "algorithm": "medium", "perf": 826.001, "source": "autotuned"},
{"m": 9, "n": 4, "k": 6, "tile_m": 1, "tile_n": 2, "threads": 64, "grouping": 9, "minblocks": 21, "algorithm": "medium", "perf": 936.78, "source": "autotuned"},
{"m": 9, "n": 4, "k": 7, "tile_m": 2, "tile_n": 1, "threads": 64, "grouping": 9, "minblocks": 22, "algorithm": "medium", "perf": 999.422, "source": "autotuned"},
{"m": 9, "n": 4, "k": 8, "tile_m": 1, "tile_n": 2, "threads": 96, "grouping": 9, "minblocks": 21, "algorithm": "medium", "perf": 1062.42, "source": "autotuned"},
{"m": 9, "n": 4, "k": 9, "tile_m": 1, "tile_n": 4, "threads": 96, "grouping": 8, "minblocks": 15, "algorithm": "medium", "perf": 1139.72, "source": "autotuned"},
{"m": 9, "n": 4, "k": 10, "tile_m": 1, "tile_n": 4, "threads": 96, "grouping": 8, "minblocks": 16, "algorithm": "medium", "perf": 1241.89, "source": "autotuned"},
{"m": 9, "n": 4, "k": 13, "tile_m": 1, "tile_n": 4, "threads": 32, "grouping": 5, "minblocks": 25, "algorithm": "medium", "perf": 1324.61, "source": "autotuned"},
{"m": 9, "n": 4, "k": 15, "tile_m": 1, "tile_n": 4, "threads": 32, "grouping": 5, "minblocks": 25, "algorithm": "medium", "perf": 1351.3, "source": "autotuned"},
{"m": 9, "n": 4, "k": 16, "tile_m": 1, "tile_n": 2, "threads": 96, "grouping": 8, "minblocks": 15, "algorithm": "medium", "perf": 1390.3, "source": "autotuned"},
{"m": 9, "n": 4, "k": 22, "tile_m": 1, "tile_n": 4, "threads": 32, "grouping": 8, "minblocks": 11, "algorithm": "medium", "perf": 1527.47, "source": "autotuned"},
{"m": 9, "n": 4, "k": 23, "tile_m": 1, "tile_n": 4, "threads": 32, "grouping": 8, "minblocks": 17, "algorithm": "medium", "perf": 1559.61, "source": "autotuned"},
{"m": 9, "n": 4, "k": 25, "tile_m": 1, "tile_n": 4, "threads": 32, "grouping": 8, "minblocks": 2, "algorithm": "medium", "perf": 1547.08, "source": "autotuned"},
{"m": 9, "n": 4, "k": 26, "tile_m": 1, "tile_n": 2, "threads": 128, "grouping": 8, "minblocks": 16, "algorithm": "medium", "perf": 1627.46, "source": "autotuned"},
{"m": 9, "n": 4, "k": 28, "tile_m": 1, "tile_n": 4, "w": 10, "v": 4, "threads": 32, "grouping": 16, "minblocks": 12, "algorithm": "largeDB2", "perf": 1752.83, "source": "autotuned"},
{"m": 9, "n": 4, "k": 32, "tile_m": 1, "tile_n": 4, "threads": 32, "grouping": 8, "minblocks": 17, "algorithm": "medium", "perf": 1763.91, "source": "autotuned"},
{"m": 9, "n": 4, "k": 45, "tile_m": 1, "tile_n": 4, "w": 16, "v": 4, "threads": 32, "grouping": 16, "minblocks": 12, "algorithm": "largeDB2", "perf": 1837.31, "source": "autotuned"},
{"m": 9, "n": 5, "k": 4, "tile_m": 1, "tile_n": 1, "threads": 64, "grouping": 9, "minblocks": 27, "algorithm": "medium", "perf": 874.49, "source": "autotuned"},
{"m": 9, "n": 5, "k": 5, "tile_m": 1, "tile_n": 1, "threads": 64, "grouping": 11, "minblocks": 5, "algorithm": "medium", "perf": 1018.5, "source": "autotuned"},
{"m": 9, "n": 5, "k": 6, "tile_m": 1, "tile_n": 1, "threads": 64, "grouping": 7, "minblocks": 2, "algorithm": "medium", "perf": 1135.64, "source": "autotuned"},
{"m": 9, "n": 5, "k": 7, "tile_m": 1, "tile_n": 1, "threads": 64, "grouping": 6, "minblocks": 19, "algorithm": "medium", "perf": 1251.15, "source": "autotuned"},
{"m": 9, "n": 5, "k": 8, "tile_m": 1, "tile_n": 1, "threads": 96, "grouping": 5, "minblocks": 15, "algorithm": "medium", "perf": 1271.95, "source": "autotuned"},
{"m": 9, "n": 5, "k": 9, "tile_m": 1, "tile_n": 2, "threads": 96, "grouping": 9, "minblocks": 18, "algorithm": "medium", "perf": 1347.73, "source": "autotuned"},
{"m": 9, "n": 5, "k": 10, "tile_m": 1, "tile_n": 1, "threads": 96, "grouping": 6, "minblocks": 9, "algorithm": "medium", "perf": 1441.73, "source": "autotuned"},
{"m": 9, "n": 5, "k": 13, "tile_m": 2, "tile_n": 1, "threads": 128, "grouping": 9, "minblocks": 16, "algorithm": "medium", "perf": 1569.66, "source": "autotuned"},
{"m": 9, "n": 5, "k": 14, "tile_m": 2, "tile_n": 1, "threads": 128, "grouping": 9, "minblocks": 16, "algorithm": "medium", "perf": 1637.77, "source": "autotuned"},
{"m": 9, "n": 5, "k": 15, "tile_m": 1, "tile_n": 2, "threads": 96, "grouping": 8, "minblocks": 15, "algorithm": "medium", "perf": 1600.87, "source": "autotuned"},
{"m": 9, "n": 5, "k": 16, "tile_m": 1, "tile_n": 2, "threads": 96, "grouping": 8, "minblocks": 15, "algorithm": "medium", "perf": 1662.43, "source": "autotuned"},
{"m": 9, "n": 5, "k": 22, "tile_m": 1, "tile_n": 2, "threads": 128, "grouping": 8, "minblocks": 15, "algorithm": "medium", "perf": 1781.93, "source": "autotuned"},
{"m": 9, "n": 5, "k": 23, "tile_m": 1, "tile_n": 2, "threads": 128, "grouping": 8, "minblocks": 14, "algorithm": "medium", "perf": 1817.95, "source": "autotuned"},
{"m": 9, "n": 5, "k": 25, "tile_m": 1, "tile_n": 2, "threads": 128, "grouping": 8, "minblocks": 15, "algorithm": "medium", "perf": 1893.66, "source": "autotuned"},
{"m": 9, "n": 5, "k": 26, "tile_m": 1, "tile_n": 2, "threads": 32, "grouping": 4, "minblocks": 15, "algorithm": "medium", "perf": 1803.06, "source": "autotuned"},
{"m": 9, "n": 5, "k": 32, "tile_m": 2, "tile_n": 1, "w": 14, "v": 4, "threads": 32, "grouping": 16, "minblocks": 4, "algorithm": "largeDB2", "perf": 1985.12, "source": "autotuned"},
{"m": 9, "n": 5, "k": 45, "tile_m": 2, "tile_n": 1, "w": 18, "v": 4, "threads": 32, "grouping": 16, "minblocks": 4, "algorithm": "largeDB2", "perf": 2091.52, "source": "autotuned"},
{"m": 9, "n": 6, "k": 4, "tile_m": 1, "tile_n": 2, "threads": 64, "grouping": 9, "minblocks": 9, "algorithm": "medium", "perf": 1002.35, "source": "autotuned"},
{"m": 9, "n": 6, "k": 5, "tile_m": 1, "tile_n": 2, "threads": 64, "grouping": 13, "minblocks": 13, "algorithm": "medium", "perf": 1197.25, "source": "autotuned"},
{"m": 9, "n": 6, "k": 6, "tile_m": 1, "tile_n": 2, "threads": 64, "grouping": 9, "minblocks": 22, "algorithm": "medium", "perf": 1337.81, "source": "autotuned"},
{"m": 9, "n": 6, "k": 7, "tile_m": 1, "tile_n": 2, "threads": 64, "grouping": 9, "minblocks": 8, "algorithm": "medium", "perf": 1478.42, "source": "autotuned"},
{"m": 9, "n": 6, "k": 8, "tile_m": 1, "tile_n": 2, "threads": 96, "grouping": 9, "minblocks": 20, "algorithm": "medium", "perf": 1541.18, "source": "autotuned"},
{"m": 9, "n": 6, "k": 9, "tile_m": 2, "tile_n": 1, "threads": 96, "grouping": 8, "minblocks": 17, "algorithm": "medium", "perf": 1600.03, "source": "autotuned"},
{"m": 9, "n": 6, "k": 10, "tile_m": 1, "tile_n": 2, "threads": 96, "grouping": 9, "minblocks": 18, "algorithm": "medium", "perf": 1720.28, "source": "autotuned"},
{"m": 9, "n": 6, "k": 13, "tile_m": 2, "tile_n": 1, "threads": 128, "grouping": 9, "minblocks": 14, "algorithm": "medium", "perf": 1845.09, "source": "autotuned"},
{"m": 9, "n": 6, "k": 14, "tile_m": 2, "tile_n": 1, "threads": 128, "grouping": 9, "minblocks": 16, "algorithm": "medium", "perf": 1935.35, "source": "autotuned"},
{"m": 9, "n": 6, "k": 15, "tile_m": 1, "tile_n": 2, "threads": 96, "grouping": 8, "minblocks": 15, "algorithm": "medium", "perf": 1896.96, "source": "autotuned"},
{"m": 9, "n": 6, "k": 22, "tile_m": 1, "tile_n": 2, "threads": 32, "grouping": 8, "minblocks": 21, "algorithm": "medium", "perf": 2056.72, "source": "autotuned"},
{"m": 9, "n": 6, "k": 26, "tile_m": 1, "tile_n": 2, "threads": 32, "grouping": 4, "minblocks": 16, "algorithm": "medium", "perf": 2149.93, "source": "autotuned"},
{"m": 9, "n": 6, "k": 32, "tile_m": 1, "tile_n": 2, "w": 14, "v": 6, "threads": 32, "grouping": 16, "minblocks": 4, "algorithm": "largeDB2", "perf": 2378.57, "source": "autotuned"},
{"m": 9, "n": 6, "k": 45, "tile_m": 2, "tile_n": 1, "w": 16, "v": 6, "threads": 32, "grouping": 16, "minblocks": 4, "algorithm": "largeDB2", "perf": 2466.77, "source": "autotuned"},
{"m": 9, "n": 7, "k": 4, "tile_m": 1, "tile_n": 1, "threads": 64, "grouping": 11, "minblocks": 27, "algorithm": "medium", "perf": 1139.26, "source": "autotuned"},
{"m": 9, "n": 7, "k": 5, "tile_m": 1, "tile_n": 1, "threads": 64, "grouping": 7, "minblocks": 6, "algorithm": "medium", "perf": 1299.44, "source": "autotuned"},
{"m": 9, "n": 7, "k": 6, "tile_m": 1, "tile_n": 1, "threads": 64, "grouping": 7, "minblocks": 1, "algorithm": "medium", "perf": 1447.05, "source": "autotuned"},
{"m": 9, "n": 7, "k": 7, "tile_m": 1, "tile_n": 1, "threads": 64, "grouping": 7, "minblocks": 16, "algorithm": "medium", "perf": 1574.49, "source": "autotuned"},
{"m": 9, "n": 7, "k": 8, "tile_m": 5, "tile_n": 1, "threads": 96, "grouping": 8, "minblocks": 15, "algorithm": "medium", "perf": 1626.53, "source": "autotuned"},
{"m": 9, "n": 7, "k": 9, "tile_m": 5, "tile_n": 1, "threads": 96, "grouping": 8, "minblocks": 16, "algorithm": "medium", "perf": 1760.67, "source": "autotuned"},
{"m": 9, "n": 7, "k": 10, "tile_m": 6, "tile_n": 1, "threads": 32, "grouping": 4, "minblocks": 32, "algorithm": "small", "perf": 1888.01, "source": "autotuned"},
{"m": 9, "n": 7, "k": 13, "tile_m": 6, "tile_n": 1, "threads": 32, "grouping": 4, "minblocks": 30, "algorithm": "small", "perf": 2028.53, "source": "autotuned"},
{"m": 9, "n": 7, "k": 15, "tile_m": 6, "tile_n": 1, "threads": 32, "grouping": 8, "minblocks": 18, "algorithm": "medium", "perf": 1993.32, "source": "autotuned"},
{"m": 9, "n": 7, "k": 22, "tile_m": 6, "tile_n": 1, "threads": 32, "grouping": 8, "minblocks": 14, "algorithm": "medium", "perf": 2297.11, "source": "autotuned"},
{"m": 9, "n": 7, "k": 25, "tile_m": 6, "tile_n": 1, "threads": 32, "grouping": 8, "minblocks": 4, "algorithm": "medium", "perf": 2357.01, "source": "autotuned"},
{"m": 9, "n": 7, "k": 26, "tile_m": 6, "tile_n": 1, "threads": 32, "grouping": 8, "minblocks": 14, "algorithm": "medium", "perf": 2384.03, "source": "autotuned"},
{"m": 9, "n": 7, "k": 28, "tile_m": 6, "tile_n": 1, "w": 12, "v": 6, "threads": 32, "grouping": 16, "minblocks": 12, "algorithm": "largeDB2", "perf": 2470.87, "source": "autotuned"},
{"m": 9, "n": 7, "k": 32, "tile_m": 6, "tile_n": 1, "threads": 32, "grouping": 8, "minblocks": 14, "algorithm": "medium", "perf": 2568.96, "source": "autotuned"},
{"m": 9, "n": 7, "k": 45, "tile_m": 6, "tile_n": 1, "w": 16, "v": 6, "threads": 32, "grouping": 16, "minblocks": 12, "algorithm": "largeDB2", "perf": 2675.36, "source": "autotuned"},
{"m": 9, "n": 8, "k": 4, "tile_m": 2, "tile_n": 2, "threads": 64, "grouping": 8, "minblocks": 24, "algorithm": "medium", "perf": 1251.81, "source": "autotuned"},
{"m": 9, "n": 8, "k": 5, "tile_m": 1, "tile_n": 3, "threads": 64, "grouping": 9, "minblocks": 24, "algorithm": "medium", "perf": 1436.06, "source": "autotuned"},
{"m": 9, "n": 8, "k": 6, "tile_m": 2, "tile_n": 2, "threads": 64, "grouping": 9, "minblocks": 19, "algorithm": "medium", "perf": 1639.31, "source": "autotuned"},
{"m": 9, "n": 8, "k": 7, "tile_m": 2, "tile_n": 2, "threads": 64, "grouping": 9, "minblocks": 24, "algorithm": "medium", "perf": 1720.92, "source": "autotuned"},
{"m": 9, "n": 8, "k": 8, "tile_m": 5, "tile_n": 1, "threads": 96, "grouping": 8, "minblocks": 16, "algorithm": "medium", "perf": 1856.93, "source": "autotuned"},
{"m": 9, "n": 8, "k": 9, "tile_m": 5, "tile_n": 1, "threads": 96, "grouping": 8, "minblocks": 14, "algorithm": "medium", "perf": 1946.25, "source": "autotuned"},
{"m": 9, "n": 8, "k": 10, "tile_m": 6, "tile_n": 1, "threads": 32, "grouping": 4, "minblocks": 31, "algorithm": "small", "perf": 2155.98, "source": "autotuned"},
{"m": 9, "n": 8, "k": 13, "tile_m": 5, "tile_n": 1, "threads": 128, "grouping": 8, "minblocks": 14, "algorithm": "medium", "perf": 2194.7, "source": "autotuned"},
{"m": 9, "n": 8, "k": 15, "tile_m": 6, "tile_n": 1, "threads": 32, "grouping": 8, "minblocks": 15, "algorithm": "medium", "perf": 2256.26, "source": "autotuned"},
{"m": 9, "n": 8, "k": 22, "tile_m": 6, "tile_n": 1, "threads": 32, "grouping": 8, "minblocks": 14, "algorithm": "medium", "perf": 2576.41, "source": "autotuned"},
{"m": 9, "n": 8, "k": 26, "tile_m": 6, "tile_n": 1, "threads": 32, "grouping": 8, "minblocks": 16, "algorithm": "medium", "perf": 2684.71, "source": "autotuned"},
{"m": 9, "n": 8, "k": 32, "tile_m": 6, "tile_n": 1, "w": 14, "v": 8, "threads": 32, "grouping": 16, "minblocks": 4, "algorithm": "largeDB2", "perf": 2966.18, "source": "autotuned"},
{"m": 9, "n": 8, "k": 45, "tile_m": 6, "tile_n": 1, "w": 18, "v": 8, "threads": 32, "grouping": 16, "minblocks": 12, "algorithm": "largeDB2", "perf": 3053.72, "source": "autotuned"},
{"m": 9, "n": 9, "k": 4, "tile_m": 1, "tile_n": 3, "threads": 64, "grouping": 9, "minblocks": 24, "algorithm": "medium", "perf": 1374.23, "source": "autotuned"},
{"m": 9, "n": 9, "k": 5, "tile_m": 1, "tile_n": 3, "threads": 64, "grouping": 8, "minblocks": 17, "algorithm": "medium", "perf": 1587.69, "source": "autotuned"},
{"m": 9, "n": 9, "k": 6, "tile_m": 1, "tile_n": 3, "threads": 64, "grouping": 9, "minblocks": 21, "algorithm": "medium", "perf": 1761.93, "source": "autotuned"},
{"m": 9, "n": 9, "k": 7, "tile_m": 5, "tile_n": 1, "threads": 32, "grouping": 5, "minblocks": 31, "algorithm": "small", "perf": 1939.37, "source": "autotuned"},
{"m": 9, "n": 9, "k": 8, "tile_m": 5, "tile_n": 1, "threads": 32, "grouping": 8, "minblocks": 9, "algorithm": "small", "perf": 2113.58, "source": "autotuned"},
{"m": 9, "n": 9, "k": 9, "tile_m": 5, "tile_n": 1, "threads": 32, "grouping": 8, "minblocks": 8, "algorithm": "small", "perf": 2232.06, "source": "autotuned"},
{"m": 9, "n": 9, "k": 10, "tile_m": 5, "tile_n": 1, "threads": 32, "grouping": 8, "minblocks": 10, "algorithm": "small", "perf": 2383.56, "source": "autotuned"},
{"m": 9, "n": 9, "k": 12, "tile_m": 5, "tile_n": 1, "threads": 96, "grouping": 8, "minblocks": 14, "algorithm": "small", "perf": 2389.93, "source": "autotuned"},
{"m": 9, "n": 9, "k": 13, "tile_m": 5, "tile_n": 1, "threads": 96, "grouping": 8, "minblocks": 15, "algorithm": "small", "perf": 2516.64, "source": "autotuned"},
{"m": 9, "n": 9, "k": 14, "tile_m": 5, "tile_n": 1, "threads": 96, "grouping": 8, "minblocks": 15, "algorithm": "small", "perf": 2593.08, "source": "autotuned"},
{"m": 9, "n": 9, "k": 15, "tile_m": 5, "tile_n": 1, "threads": 32, "grouping": 8, "minblocks": 22, "algorithm": "medium", "perf": 2603.64, "source": "autotuned"},
{"m": 9, "n": 9, "k": 16, "tile_m": 5, "tile_n": 1, "threads": 32, "grouping": 8, "minblocks": 1, "algorithm": "medium", "perf": 2691.5, "source": "autotuned"},
{"m": 9, "n": 9, "k": 17, "tile_m": 5, "tile_n": 1, "threads": 32, "grouping": 8, "minblocks": 24, "algorithm": "medium", "perf": 2720.4, "source": "autotuned"},
{"m": 9, "n": 9, "k": 22, "tile_m": 5, "tile_n": 1, "threads": 32, "grouping": 8, "minblocks": 4, "algorithm": "medium", "perf": 2855.35, "source": "autotuned"},
{"m": 9, "n": 9, "k": 23, "tile_m": 5, "tile_n": 1, "threads": 32, "grouping": 8, "minblocks": 19, "algorithm": "medium", "perf": 2897.51, "source": "autotuned"},
{"m": 9, "n": 9, "k": 25, "tile_m": 5, "tile_n": 1, "threads": 32, "grouping": 8, "minblocks": 6, "algorithm": "medium", "perf": 2935.7, "source": "autotuned"},
{"m": 9, "n": 9, "k": 26, "tile_m": 5, "tile_n": 1, "threads": 32, "grouping": 8, "minblocks": 17, "algorithm": "medium", "perf": 2950.5, "source": "autotuned"},
{"m": 9, "n": 9, "k": 28, "tile_m": 5, "tile_n": 1, "threads": 32, "grouping": 8, "minblocks": 14, "algorithm": "medium", "perf": 3035.47, "source": "autotuned"},
{"m": 9, "n": 9, "k": 32, "tile_m": 5, "tile_n": 1, "threads": 32, "grouping": 8, "minblocks": 1, "algorithm": "medium", "perf": 3345.56, "source": "autotuned"},
{"m": 9, "n": 9, "k": 45, "tile_m": 5, "tile_n": 1, "threads": 32, "grouping": 11, "minblocks": 4, "algorithm": "medium", "perf": 3318.69, "source": "autotuned"},
{"m": 9, "n": 10, "k": 4, "tile_m": 1, "tile_n": 2, "threads": 64, "grouping": 9, "minblocks": 24, "algorithm": "medium", "perf": 1522.67, "source": "autotuned"},
{"m": 9, "n": 10, "k": 5, "tile_m": 3, "tile_n": 1, "threads": 64, "grouping": 11, "minblocks": 19, "algorithm": "medium", "perf": 1751.27, "source": "autotuned"},
{"m": 9, "n": 10, "k": 6, "tile_m": 3, "tile_n": 1, "threads": 64, "grouping": 11, "minblocks": 24, "algorithm": "medium", "perf": 1954.67, "source": "autotuned"},
{"m": 9, "n": 10, "k": 7, "tile_m": 5, "tile_n": 1, "threads": 96, "grouping": 11, "minblocks": 11, "algorithm": "medium", "perf": 2080.22, "source": "autotuned"},
{"m": 9, "n": 10, "k": 8, "tile_m": 5, "tile_n": 1, "threads": 96, "grouping": 8, "minblocks": 14, "algorithm": "medium", "perf": 2294.14, "source": "autotuned"},
{"m": 9, "n": 10, "k": 9, "tile_m": 5, "tile_n": 1, "threads": 96, "grouping": 8, "minblocks": 14, "algorithm": "medium", "perf": 2391.07, "source": "autotuned"},
{"m": 9, "n": 10, "k": 10, "tile_m": 5, "tile_n": 1, "threads": 128, "grouping": 11, "minblocks": 11, "algorithm": "medium", "perf": 2401.74, "source": "autotuned"},
{"m": 9, "n": 10, "k": 13, "tile_m": 5, "tile_n": 1, "threads": 32, "grouping": 8, "minblocks": 3, "algorithm": "medium", "perf": 2545.93, "source": "autotuned"},
{"m": 9, "n": 10, "k": 14, "tile_m": 5, "tile_n": 1, "threads": 32, "grouping": 8, "minblocks": 21, "algorithm": "medium", "perf": 2657.81, "source": "autotuned"},
{"m": 9, "n": 10, "k": 15, "tile_m": 5, "tile_n": 1, "threads": 32, "grouping": 8, "minblocks": 24, "algorithm": "medium", "perf": 2739.19, "source": "autotuned"},
{"m": 9, "n": 10, "k": 22, "tile_m": 5, "tile_n": 1, "threads": 32, "grouping": 8, "minblocks": 18, "algorithm": "medium", "perf": 3020.0, "source": "autotuned"},
{"m": 9, "n": 10, "k": 26, "tile_m": 5, "tile_n": 1, "w": 12, "v": 10, "threads": 32, "grouping": 16, "minblocks": 12, "algorithm": "largeDB2", "perf": 3254.63, "source": "autotuned"},
{"m": 9, "n": 10, "k": 32, "tile_m": 5, "tile_n": 1, "w": 14, "v": 10, "threads": 32, "grouping": 16, "minblocks": 12, "algorithm": "largeDB2", "perf": 3394.29, "source": "autotuned"},
{"m": 9, "n": 10, "k": 45, "tile_m": 5, "tile_n": 1, "w": 16, "v": 10, "threads": 32, "grouping": 16, "minblocks": 1, "algorithm": "largeDB2", "perf": 3559.99, "source": "autotuned"},
{"m": 9, "n": 12, "k": 9, "tile_m": 5, "tile_n": 1, "threads": 128, "grouping": 11, "minblocks": 11, "algorithm": "medium", "perf": 2603.22, "source": "autotuned"},
{"m": 9, "n": 12, "k": 10, "tile_m": 5, "tile_n": 1, "threads": 128, "grouping": 11, "minblocks": 11, "algorithm": "medium", "perf": 2796.17, "source": "autotuned"},
{"m": 9, "n": 12, "k": 32, "tile_m": 5, "tile_n": 1, "threads": 32, "grouping": 11, "minblocks": 10, "algorithm": "medium", "perf": 3760.42, "source": "autotuned"},
{"m": 9, "n": 13, "k": 4, "tile_m": 6, "tile_n": 1, "threads": 64, "grouping": 9, "minblocks": 13, "algorithm": "medium", "perf": 1823.22, "source": "autotuned"},
{"m": 9, "n": 13, "k": 5, "tile_m": 5, "tile_n": 1, "threads": 96, "grouping": 8, "minblocks": 14, "algorithm": "medium", "perf": 2132.0, "source": "autotuned"},
{"m": 9, "n": 13, "k": 6, "tile_m": 5, "tile_n": 1, "threads": 96, "grouping": 11, "minblocks": 13, "algorithm": "medium", "perf": 2411.66, "source": "autotuned"},
{"m": 9, "n": 13, "k": 7, "tile_m": 5, "tile_n": 1, "threads": 96, "grouping": 11, "minblocks": 13, "algorithm": "medium", "perf": 2656.47, "source": "autotuned"},
{"m": 9, "n": 13, "k": 8, "tile_m": 5, "tile_n": 1, "threads": 128, "grouping": 11, "minblocks": 11, "algorithm": "medium", "perf": 2617.03, "source": "autotuned"},
{"m": 9, "n": 13, "k": 9, "tile_m": 5, "tile_n": 1, "threads": 128, "grouping": 11, "minblocks": 12, "algorithm": "medium", "perf": 2858.07, "source": "autotuned"},
{"m": 9, "n": 13, "k": 10, "tile_m": 5, "tile_n": 1, "threads": 160, "grouping": 16, "minblocks": 8, "algorithm": "medium", "perf": 2786.58, "source": "autotuned"},
{"m": 9, "n": 13, "k": 13, "tile_m": 5, "tile_n": 1, "threads": 32, "grouping": 8, "minblocks": 23, "algorithm": "medium", "perf": 3124.18, "source": "autotuned"},
{"m": 9, "n": 13, "k": 14, "tile_m": 5, "tile_n": 1, "threads": 32, "grouping": 8, "minblocks": 24, "algorithm": "medium", "perf": 3275.15, "source": "autotuned"},
{"m": 9, "n": 13, "k": 15, "tile_m": 5, "tile_n": 1, "threads": 32, "grouping": 8, "minblocks": 23, "algorithm": "medium", "perf": 3258.77, "source": "autotuned"},
{"m": 9, "n": 13, "k": 16, "tile_m": 5, "tile_n": 1, "threads": 32, "grouping": 8, "minblocks": 5, "algorithm": "medium", "perf": 3406.76, "source": "autotuned"},
{"m": 9, "n": 13, "k": 22, "tile_m": 5, "tile_n": 1, "w": 10, "v": 8, "threads": 32, "grouping": 16, "minblocks": 1, "algorithm": "largeDB2", "perf": 3712.77, "source": "autotuned"},
{"m": 9, "n": 13, "k": 23, "tile_m": 5, "tile_n": 1, "w": 10, "v": 8, "threads": 32, "grouping": 16, "minblocks": 8, "algorithm": "largeDB2", "perf": 3691.25, "source": "autotuned"},
{"m": 9, "n": 13, "k": 25, "tile_m": 5, "tile_n": 1, "w": 12, "v": 8, "threads": 32, "grouping": 16, "minblocks": 1, "algorithm": "largeDB2", "perf": 3849.89, "source": "autotuned"},
{"m": 9, "n": 13, "k": 26, "tile_m": 5, "tile_n": 1, "w": 12, "v": 10, "threads": 32, "grouping": 16, "minblocks": 2, "algorithm": "largeDB2", "perf": 3882.55, "source": "autotuned"},
{"m": 9, "n": 13, "k": 32, "tile_m": 5, "tile_n": 1, "w": 14, "v": 10, "threads": 32, "grouping": 16, "minblocks": 4, "algorithm": "largeDB2", "perf": 4035.74, "source": "autotuned"},
{"m": 9, "n": 13, "k": 45, "tile_m": 5, "tile_n": 1, "w": 16, "v": 12, "threads": 32, "grouping": 16, "minblocks": 2, "algorithm": "largeDB2", "perf": 4279.51, "source": "autotuned"},
{"m": 9, "n": 14, "k": 5, "tile_m": 5, "tile_n": 1, "threads": 96, "grouping": 8, "minblocks": 16, "algorithm": "medium", "perf": 2292.06, "source": "autotuned"},
{"m": 9, "n": 14, "k": 6, "tile_m": 5, "tile_n": 1, "threads": 96, "grouping": 11, "minblocks": 13, "algorithm": "medium", "perf": 2567.87, "source": "autotuned"},
{"m": 9, "n": 14, "k": 9, "tile_m": 5, "tile_n": 1, "threads": 128, "grouping": 11, "minblocks": 11, "algorithm": "medium", "perf": 3077.92, "source": "autotuned"},
{"m": 9, "n": 14, "k": 10, "tile_m": 5, "tile_n": 1, "threads": 160, "grouping": 16, "minblocks": 8, "algorithm": "medium", "perf": 3000.94, "source": "autotuned"},
{"m": 9, "n": 14, "k": 13, "tile_m": 5, "tile_n": 1, "threads": 32, "grouping": 8, "minblocks": 21, "algorithm": "medium", "perf": 3314.91, "source": "autotuned"},
{"m": 9, "n": 14, "k": 14, "tile_m": 5, "tile_n": 1, "threads": 32, "grouping": 8, "minblocks": 15, "algorithm": "medium", "perf": 3414.95, "source": "autotuned"},
{"m": 9, "n": 15, "k": 4, "tile_m": 5, "tile_n": 1, "threads": 96, "grouping": 8, "minblocks": 14, "algorithm": "medium", "perf": 2084.54, "source": "autotuned"},
{"m": 9, "n": 15, "k": 5, "tile_m": 5, "tile_n": 1, "threads": 96, "grouping": 8, "minblocks": 16, "algorithm": "medium", "perf": 2456.3, "source": "autotuned"},
{"m": 9, "n": 15, "k": 6, "tile_m": 5, "tile_n": 1, "threads": 96, "grouping": 8, "minblocks": 14, "algorithm": "medium", "perf": 2689.49, "source": "autotuned"},
{"m": 9, "n": 15, "k": 7, "tile_m": 5, "tile_n": 1, "threads": 128, "grouping": 11, "minblocks": 12, "algorithm": "medium", "perf": 2758.44, "source": "autotuned"},
{"m": 9, "n": 15, "k": 8, "tile_m": 5, "tile_n": 1, "threads": 128, "grouping": 11, "minblocks": 12, "algorithm": "medium", "perf": 3040.87, "source": "autotuned"},
{"m": 9, "n": 15, "k": 9, "tile_m": 5, "tile_n": 1, "threads": 32, "grouping": 6, "minblocks": 27, "algorithm": "medium", "perf": 3043.01, "source": "autotuned"},
{"m": 9, "n": 15, "k": 10, "tile_m": 5, "tile_n": 1, "threads": 160, "grouping": 16, "minblocks": 8, "algorithm": "medium", "perf": 3201.74, "source": "autotuned"},
{"m": 9, "n": 15, "k": 13, "tile_m": 5, "tile_n": 1, "threads": 32, "grouping": 8, "minblocks": 24, "algorithm": "medium", "perf": 3507.09, "source": "autotuned"},
{"m": 9, "n": 15, "k": 15, "tile_m": 5, "tile_n": 1, "threads": 32, "grouping": 8, "minblocks": 22, "algorithm": "medium", "perf": 3666.3, "source": "autotuned"},
{"m": 9, "n": 15, "k": 16, "tile_m": 5, "tile_n": 1, "threads": 32, "grouping": 8, "minblocks": 16, "algorithm": "medium", "perf": 3845.99, "source": "autotuned"},
{"m": 9, "n": 15, "k": 22, "tile_m": 5, "tile_n": 1, "w": 10, "v": 10, "threads": 32, "grouping": 16, "minblocks": 1, "algorithm": "largeDB2", "perf": 4065.59, "source": "autotuned"},
{"m": 9, "n": 15, "k": 25, "tile_m": 5, "tile_n": 1, "w": 10, "v": 8, "threads": 32, "grouping": 16, "minblocks": 4, "algorithm": "largeDB2", "perf": 4169.68, "source": "autotuned"},
{"m": 9, "n": 15, "k": 26, "tile_m": 5, "tile_n": 1, "w": 10, "v": 8, "threads": 32, "grouping": 16, "minblocks": 2, "algorithm": "largeDB2", "perf": 4238.75, "source": "autotuned"},
{"m": 9, "n": 15, "k": 45, "tile_m": 5, "tile_n": 1, "w": 16, "v": 8, "threads": 32, "grouping": 16, "minblocks": 12, "algorithm": "largeDB2", "perf": 4729.1, "source": "autotuned"},
{"m": 9, "n": 16, "k": 4, "tile_m": 5, "tile_n": 1, "threads": 96, "grouping": 8, "minblocks": 16, "algorithm": "medium", "perf": 2225.45, "source": "autotuned"},
{"m": 9, "n": 16, "k": 5, "tile_m": 5, "tile_n": 1, "threads": 96, "grouping": 11, "minblocks": 13, "algorithm": "medium", "perf": 2624.61, "source": "autotuned"},
{"m": 9, "n": 16, "k": 9, "tile_m": 5, "tile_n": 1, "threads": 32, "grouping": 6, "minblocks": 27, "algorithm": "medium", "perf": 3232.93, "source": "autotuned"},
{"m": 9, "n": 16, "k": 13, "tile_m": 5, "tile_n": 1, "threads": 32, "grouping": 8, "minblocks": 22, "algorithm": "medium", "perf": 3804.78, "source": "autotuned"},
{"m": 9, "n": 16, "k": 15, "tile_m": 5, "tile_n": 1, "threads": 32, "grouping": 8, "minblocks": 13, "algorithm": "medium", "perf": 3908.6, "source": "autotuned"},
{"m": 9, "n": 16, "k": 16, "tile_m": 5, "tile_n": 1, "w": 6, "v": 16, "threads": 32, "grouping": 16, "minblocks": 12, "algorithm": "largeDB2", "perf": 4301.46, "source": "autotuned"},
{"m": 9, "n": 16, "k": 17, "tile_m": 5, "tile_n": 1, "w": 8, "v": 16, "threads": 32, "grouping": 16, "minblocks": 12, "algorithm": "largeDB2", "perf": 4334.1, "source": "autotuned"},
{"m": 9, "n": 16, "k": 22, "tile_m": 5, "tile_n": 1, "w": 10, "v": 16, "threads": 32, "grouping": 16, "minblocks": 12, "algorithm": "largeDB2", "perf": 4527.13, "source": "autotuned"},
{"m": 9, "n": 16, "k": 23, "tile_m": 5, "tile_n": 1, "w": 10, "v": 16, "threads": 32, "grouping": 16, "minblocks": 12, "algorithm": "largeDB2", "perf": 4590.81, "source": "autotuned"},
{"m": 9, "n": 16, "k": 25, "tile_m": 5, "tile_n": 1, "w": 10, "v": 16, "threads": 32, "grouping": 16, "minblocks": 12, "algorithm": "largeDB2", "perf": 4566.09, "source": "autotuned"},
{"m": 9, "n": 16, "k": 26, "tile_m": 5, "tile_n": 1, "w": 10, "v": 16, "threads": 32, "grouping": 16, "minblocks": 12, "algorithm": "largeDB2", "perf": 4597.18, "source": "autotuned"},
{"m": 9, "n": 16, "k": 45, "tile_m": 5, "tile_n": 1, "w": 16, "v": 16, "threads": 32, "grouping": 16, "minblocks": 1, "algorithm": "largeDB2", "perf": 5177.34, "source": "autotuned"},
{"m": 9, "n": 17, "k": 9, "tile_m": 5, "tile_n": 2, "threads": 32, "grouping": 5, "minblocks": 27, "algorithm": "medium", "perf": 3019.94, "source": "autotuned"},
{"m": 9, "n": 17, "k": 16, "tile_m": 5, "tile_n": 2, "threads": 32, "grouping": 8, "minblocks": 18, "algorithm": "medium", "perf": 3918.02, "source": "autotuned"},
{"m": 9, "n": 17, "k": 17, "tile_m": 5, "tile_n": 2, "threads": 32, "grouping": 8, "minblocks": 15, "algorithm": "medium", "perf": 3860.26, "source": "autotuned"},
{"m": 9, "n": 17, "k": 22, "tile_m": 5, "tile_n": 2, "threads": 32, "grouping": 8, "minblocks": 13, "algorithm": "medium", "perf": 3948.85, "source": "autotuned"},
{"m": 9, "n": 17, "k": 23, "tile_m": 5, "tile_n": 2, "w": 10, "v": 16, "threads": 32, "grouping": 16, "minblocks": 8, "algorithm": "largeDB2", "perf": 4030.65, "source": "autotuned"},
{"m": 9, "n": 22, "k": 4, "tile_m": 5, "tile_n": 2, "threads": 96, "grouping": 11, "minblocks": 11, "algorithm": "medium", "perf": 2648.48, "source": "autotuned"},
{"m": 9, "n": 22, "k": 5, "tile_m": 5, "tile_n": 2, "threads": 128, "grouping": 16, "minblocks": 9, "algorithm": "medium", "perf": 2742.61, "source": "autotuned"},
{"m": 9, "n": 22, "k": 6, "tile_m": 5, "tile_n": 2, "threads": 32, "grouping": 5, "minblocks": 25, "algorithm": "medium", "perf": 2991.87, "source": "autotuned"},
{"m": 9, "n": 22, "k": 7, "tile_m": 5, "tile_n": 2, "threads": 32, "grouping": 5, "minblocks": 26, "algorithm": "medium", "perf": 3235.13, "source": "autotuned"},
{"m": 9, "n": 22, "k": 8, "tile_m": 5, "tile_n": 2, "threads": 32, "grouping": 8, "minblocks": 14, "algorithm": "medium", "perf": 3522.22, "source": "autotuned"},
{"m": 9, "n": 22, "k": 9, "tile_m": 5, "tile_n": 2, "threads": 32, "grouping": 8, "minblocks": 11, "algorithm": "medium", "perf": 3622.03, "source": "autotuned"},
{"m": 9, "n": 22, "k": 10, "tile_m": 5, "tile_n": 2, "threads": 32, "grouping": 8, "minblocks": 20, "algorithm": "medium", "perf": 4029.74, "source": "autotuned"},
{"m": 9, "n": 22, "k": 13, "tile_m": 5, "tile_n": 2, "w": 6, "v": 22, "threads": 32, "grouping": 16, "minblocks": 12, "algorithm": "largeDB2", "perf": 4343.83, "source": "autotuned"},
{"m": 9, "n": 22, "k": 15, "tile_m": 5, "tile_n": 2, "w": 6, "v": 22, "threads": 32, "grouping": 16, "minblocks": 4, "algorithm": "largeDB2", "perf": 4504.82, "source": "autotuned"},
{"m": 9, "n": 22, "k": 16, "tile_m": 5, "tile_n": 2, "threads": 32, "grouping": 8, "minblocks": 16, "algorithm": "medium", "perf": 4748.74, "source": "autotuned"},
{"m": 9, "n": 22, "k": 17, "tile_m": 5, "tile_n": 2, "w": 8, "v": 22, "threads": 32, "grouping": 16, "minblocks": 2, "algorithm": "largeDB2", "perf": 4523.58, "source": "autotuned"},
{"m": 9, "n": 22, "k": 22, "tile_m": 5, "tile_n": 2, "w": 8, "v": 22, "threads": 32, "grouping": 16, "minblocks": 12, "algorithm": "largeDB2", "perf": 4805.91, "source": "autotuned"},
{"m": 9, "n": 22, "k": 23, "tile_m": 5, "tile_n": 2, "w": 8, "v": 22, "threads": 32, "grouping": 16, "minblocks": 2, "algorithm": "largeDB2", "perf": 4815.46, "source": "autotuned"},
{"m": 9, "n": 22, "k": 25, "tile_m": 5, "tile_n": 2, "w": 10, "v": 22, "threads": 32, "grouping": 16, "minblocks": 12, "algorithm": "largeDB2", "perf": 4943.31, "source": "autotuned"},
{"m": 9, "n": 22, "k": 26, "tile_m": 5, "tile_n": 2, "w": 10, "v": 22, "threads": 32, "grouping": 16, "minblocks": 4, "algorithm": "largeDB2", "perf": 4956.31, "source": "autotuned"},
{"m": 9, "n": 22, "k": 32, "tile_m": 5, "tile_n": 2, "w": 12, "v": 22, "threads": 32, "grouping": 16, "minblocks": 8, "algorithm": "largeDB2", "perf": 5268.48, "source": "autotuned"},
{"m": 9, "n": 22, "k": 45, "tile_m": 5, "tile_n": 2, "w": 16, "v": 22, "threads": 32, "grouping": 16, "minblocks": 1, "algorithm": "largeDB2", "perf": 5707.23, "source": "autotuned"},
{"m": 9, "n": 23, "k": 4, "tile_m": 5, "tile_n": 2, "threads": 96, "grouping": 11, "minblocks": 11, "algorithm": "medium", "perf": 2723.94, "source": "autotuned"},
{"m": 9, "n": 23, "k": 5, "tile_m": 5, "tile_n": 2, "threads": 128, "grouping": 16, "minblocks": 8, "algorithm": "medium", "perf": 2874.57, "source": "autotuned"},
{"m": 9, "n": 23, "k": 9, "tile_m": 5, "tile_n": 2, "threads": 32, "grouping": 8, "minblocks": 7, "algorithm": "medium", "perf": 3835.85, "source": "autotuned"},
{"m": 9, "n": 23, "k": 13, "tile_m": 5, "tile_n": 2, "threads": 32, "grouping": 8, "minblocks": 14, "algorithm": "medium", "perf": 4539.36, "source": "autotuned"},
{"m": 9, "n": 23, "k": 16, "tile_m": 5, "tile_n": 2, "threads": 32, "grouping": 8, "minblocks": 14, "algorithm": "medium", "perf": 4796.87, "source": "autotuned"},
{"m": 9, "n": 23, "k": 17, "tile_m": 5, "tile_n": 2, "threads": 32, "grouping": 8, "minblocks": 13, "algorithm": "medium", "perf": 4746.2, "source": "autotuned"},
{"m": 9, "n": 23, "k": 22, "tile_m": 5, "tile_n": 2, "w": 10, "v": 22, "threads": 32, "grouping": 16, "minblocks": 12, "algorithm": "largeDB2", "perf": 4783.43, "source": "autotuned"},
{"m": 9, "n": 23, "k": 23, "tile_m": 5, "tile_n": 2, "w": 8, "v": 22, "threads": 32, "grouping": 16, "minblocks": 8, "algorithm": "largeDB2", "perf": 4808.97, "source": "autotuned"},
{"m": 9, "n": 23, "k": 26, "tile_m": 5, "tile_n": 2, "threads": 32, "grouping": 11, "minblocks": 4, "algorithm": "medium", "perf": 4991.05, "source": "autotuned"},
{"m": 9, "n": 25, "k": 4, "tile_m": 5, "tile_n": 2, "threads": 128, "grouping": 16, "minblocks": 9, "algorithm": "medium", "perf": 2635.37, "source": "autotuned"},
{"m": 9, "n": 25, "k": 5, "tile_m": 5, "tile_n": 2, "threads": 128, "grouping": 16, "minblocks": 9, "algorithm": "medium", "perf": 3083.15, "source": "autotuned"},
{"m": 9, "n": 25, "k": 9, "tile_m": 5, "tile_n": 2, "threads": 32, "grouping": 8, "minblocks": 10, "algorithm": "medium", "perf": 4028.44, "source": "autotuned"},
{"m": 9, "n": 25, "k": 13, "tile_m": 5, "tile_n": 2, "threads": 32, "grouping": 8, "minblocks": 13, "algorithm": "medium", "perf": 4711.62, "source": "autotuned"},
{"m": 9, "n": 25, "k": 15, "tile_m": 5, "tile_n": 2, "threads": 32, "grouping": 8, "minblocks": 13, "algorithm": "medium", "perf": 4836.75, "source": "autotuned"},
{"m": 9, "n": 25, "k": 16, "tile_m": 5, "tile_n": 2, "threads": 32, "grouping": 8, "minblocks": 14, "algorithm": "medium", "perf": 4906.16, "source": "autotuned"},
{"m": 9, "n": 25, "k": 22, "tile_m": 5, "tile_n": 2, "w": 10, "v": 24, "threads": 32, "grouping": 16, "minblocks": 12, "algorithm": "largeDB2", "perf": 5003.25, "source": "autotuned"},
{"m": 9, "n": 25, "k": 25, "tile_m": 5, "tile_n": 2, "w": 10, "v": 24, "threads": 32, "grouping": 16, "minblocks": 8, "algorithm": "largeDB2", "perf": 5253.74, "source": "autotuned"},
{"m": 9, "n": 25, "k": 26, "tile_m": 5, "tile_n": 2, "w": 10, "v": 16, "threads": 32, "grouping": 16, "minblocks": 12, "algorithm": "largeDB2", "perf": 5260.86, "source": "autotuned"},
{"m": 9, "n": 25, "k": 45, "tile_m": 5, "tile_n": 2, "w": 16, "v": 24, "threads": 32, "grouping": 16, "minblocks": 8, "algorithm": "largeDB2", "perf": 6050.28, "source": "autotuned"},
{"m": 9, "n": 26, "k": 4, "tile_m": 5, "tile_n": 2, "threads": 128, "grouping": 16, "minblocks": 9, "algorithm": "medium", "perf": 2756.3, "source": "autotuned"},
{"m": 9, "n": 26, "k": 5, "tile_m": 5, "tile_n": 1, "threads": 64, "grouping": 8, "minblocks": 24, "algorithm": "medium", "perf": 2987.91, "source": "autotuned"},
{"m": 9, "n": 26, "k": 6, "tile_m": 5, "tile_n": 2, "threads": 32, "grouping": 5, "minblocks": 25, "algorithm": "medium", "perf": 3383.17, "source": "autotuned"},
{"m": 9, "n": 26, "k": 7, "tile_m": 5, "tile_n": 2, "threads": 32, "grouping": 6, "minblocks": 21, "algorithm": "medium", "perf": 3650.41, "source": "autotuned"},
{"m": 9, "n": 26, "k": 8, "tile_m": 5, "tile_n": 2, "threads": 32, "grouping": 8, "minblocks": 19, "algorithm": "medium", "perf": 4005.53, "source": "autotuned"},
{"m": 9, "n": 26, "k": 9, "tile_m": 5, "tile_n": 2, "threads": 32, "grouping": 8, "minblocks": 19, "algorithm": "medium", "perf": 4066.91, "source": "autotuned"},
{"m": 9, "n": 26, "k": 10, "tile_m": 5, "tile_n": 2, "threads": 32, "grouping": 8, "minblocks": 14, "algorithm": "medium", "perf": 4529.28, "source": "autotuned"},
{"m": 9, "n": 26, "k": 13, "tile_m": 5, "tile_n": 2, "w": 6, "v": 26, "threads": 32, "grouping": 16, "minblocks": 1, "algorithm": "largeDB2", "perf": 4868.72, "source": "autotuned"},
{"m": 9, "n": 26, "k": 15, "tile_m": 5, "tile_n": 2, "w": 6, "v": 26, "threads": 32, "grouping": 16, "minblocks": 1, "algorithm": "largeDB2", "perf": 4901.48, "source": "autotuned"},
{"m": 9, "n": 26, "k": 16, "tile_m": 5, "tile_n": 2, "threads": 32, "grouping": 8, "minblocks": 13, "algorithm": "medium", "perf": 5242.89, "source": "autotuned"},
{"m": 9, "n": 26, "k": 22, "tile_m": 5, "tile_n": 2, "w": 8, "v": 26, "threads": 32, "grouping": 16, "minblocks": 1, "algorithm": "largeDB2", "perf": 5244.0, "source": "autotuned"},
{"m": 9, "n": 26, "k": 23, "tile_m": 5, "tile_n": 2, "threads": 32, "grouping": 11, "minblocks": 2, "algorithm": "medium", "perf": 5335.66, "source": "autotuned"},
{"m": 9, "n": 26, "k": 25, "tile_m": 5, "tile_n": 2, "threads": 32, "grouping": 11, "minblocks": 9, "algorithm": "medium", "perf": 5308.58, "source": "autotuned"},
{"m": 9, "n": 26, "k": 26, "tile_m": 5, "tile_n": 2, "w": 10, "v": 26, "threads": 32, "grouping": 16, "minblocks": 4, "algorithm": "largeDB2", "perf": 5541.03, "source": "autotuned"},
{"m": 9, "n": 26, "k": 45, "tile_m": 5, "tile_n": 2, "w": 16, "v": 24, "threads": 32, "grouping": 16, "minblocks": 12, "algorithm": "largeDB2", "perf": 6274.8, "source": "autotuned"},
{"m": 9, "n": 32, "k": 4, "tile_m": 5, "tile_n": 1, "threads": 64, "grouping": 9, "minblocks": 19, "algorithm": "medium", "perf": 3267.25, "source": "autotuned"},
{"m": 9, "n": 32, "k": 5, "tile_m": 5, "tile_n": 1, "threads": 64, "grouping": 9, "minblocks": 19, "algorithm": "medium", "perf": 3621.5, "source": "autotuned"},
{"m": 9, "n": 32, "k": 6, "tile_m": 5, "tile_n": 2, "threads": 96, "grouping": 11, "minblocks": 12, "algorithm": "medium", "perf": 4052.17, "source": "autotuned"},
{"m": 9, "n": 32, "k": 7, "tile_m": 9, "tile_n": 1, "threads": 64, "grouping": 9, "minblocks": 18, "algorithm": "medium", "perf": 4388.75, "source": "autotuned"},
{"m": 9, "n": 32, "k": 8, "tile_m": 5, "tile_n": 2, "threads": 32, "grouping": 8, "minblocks": 16, "algorithm": "medium", "perf": 4876.68, "source": "autotuned"},
{"m": 9, "n": 32, "k": 9, "tile_m": 5, "tile_n": 2, "threads": 32, "grouping": 8, "minblocks": 14, "algorithm": "medium", "perf": 5000.6, "source": "autotuned"},
{"m": 9, "n": 32, "k": 10, "tile_m": 5, "tile_n": 2, "threads": 32, "grouping": 8, "minblocks": 16, "algorithm": "medium", "perf": 5508.41, "source": "autotuned"},
{"m": 9, "n": 32, "k": 13, "tile_m": 5, "tile_n": 2, "w": 6, "v": 32, "threads": 32, "grouping": 16, "minblocks": 1, "algorithm": "largeDB2", "perf": 5620.57, "source": "autotuned"},
{"m": 9, "n": 32, "k": 22, "tile_m": 5, "tile_n": 2, "threads": 32, "grouping": 11, "minblocks": 1, "algorithm": "medium", "perf": 6207.62, "source": "autotuned"},
{"m": 9, "n": 32, "k": 32, "tile_m": 5, "tile_n": 2, "w": 14, "v": 32, "threads": 32, "grouping": 16, "minblocks": 2, "algorithm": "largeDB2", "perf": 6699.77, "source": "autotuned"},
{"m": 9, "n": 45, "k": 4, "tile_m": 5, "tile_n": 2, "threads": 64, "grouping": 9, "minblocks": 16, "algorithm": "medium", "perf": 3879.46, "source": "autotuned"},
{"m": 9, "n": 45, "k": 5, "tile_m": 5, "tile_n": 2, "threads": 64, "grouping": 9, "minblocks": 17, "algorithm": "medium", "perf": 4296.15, "source": "autotuned"},
{"m": 9, "n": 45, "k": 6, "tile_m": 5, "tile_n": 3, "threads": 32, "grouping": 8, "minblocks": 16, "algorithm": "medium", "perf": 4479.84, "source": "autotuned"},
{"m": 9, "n": 45, "k": 7, "tile_m": 5, "tile_n": 3, "threads": 32, "grouping": 8, "minblocks": 16, "algorithm": "medium", "perf": 5008.19, "source": "autotuned"},
{"m": 9, "n": 45, "k": 8, "tile_m": 5, "tile_n": 3, "threads": 32, "grouping": 8, "minblocks": 14, "algorithm": "medium", "perf": 5290.01, "source": "autotuned"},
{"m": 9, "n": 45, "k": 9, "tile_m": 5, "tile_n": 3, "threads": 32, "grouping": 8, "minblocks": 14, "algorithm": "medium", "perf": 5385.73, "source": "autotuned"},
{"m": 9, "n": 45, "k": 10, "tile_m": 5, "tile_n": 3, "w": 4, "v": 44, "threads": 32, "grouping": 16, "minblocks": 12, "algorithm": "largeDB2", "perf": 5587.95, "source": "autotuned"},
{"m": 9, "n": 45, "k": 13, "tile_m": 5, "tile_n": 3, "threads": 32, "grouping": 11, "minblocks": 6, "algorithm": "medium", "perf": 6171.85, "source": "autotuned"},
{"m": 9, "n": 45, "k": 15, "tile_m": 5, "tile_n": 3, "threads": 32, "grouping": 11, "minblocks": 9, "algorithm": "medium", "perf": 6169.44, "source": "autotuned"},
{"m": 9, "n": 45, "k": 16, "tile_m": 5, "tile_n": 3, "threads": 32, "grouping": 11, "minblocks": 9, "algorithm": "medium", "perf": 6484.19, "source": "autotuned"},
{"m": 9, "n": 45, "k": 22, "tile_m": 5, "tile_n": 3, "w": 8, "v": 44, "threads": 32, "grouping": 16, "minblocks": 8, "algorithm": "largeDB2", "perf": 6582.56, "source": "autotuned"},
{"m": 9, "n": 45, "k": 25, "tile_m": 5, "tile_n": 3, "w": 10, "v": 44, "threads": 32, "grouping": 16, "minblocks": 4, "algorithm": "largeDB2", "perf": 6761.12, "source": "autotuned"},
{"m": 9, "n": 45, "k": 26, "tile_m": 5, "tile_n": 3, "w": 10, "v": 24, "threads": 32, "grouping": 16, "minblocks": 4, "algorithm": "largeDB2", "perf": 6854.64, "source": "autotuned"},
{"m": 9, "n": 45, "k": 45, "tile_m": 5, "tile_n": 3, "w": 18, "v": 30, "threads": 32, "grouping": 16, "minblocks": 1, "algorithm": "largeDB2", "perf": 7291.31, "source": "autotuned"},
{"m": 10, "n": 4, "k": 4, "tile_m": 1, "tile_n": 2, "threads": 64, "grouping": 9, "minblocks": 11, "algorithm": "medium", "perf": 818.616, "source": "autotuned"},
{"m": 10, "n": 4, "k": 5, "tile_m": 1, "tile_n": 2, "threads": 64, "grouping": 9, "minblocks": 13, "algorithm": "medium", "perf": 960.127, "source": "autotuned"},
{"m": 10, "n": 4, "k": 6, "tile_m": 1, "tile_n": 2, "threads": 64, "grouping": 9, "minblocks": 17, "algorithm": "medium", "perf": 1117.23, "source": "autotuned"},
{"m": 10, "n": 4, "k": 7, "tile_m": 1, "tile_n": 2, "threads": 96, "grouping": 9, "minblocks": 16, "algorithm": "medium", "perf": 1144.7, "source": "autotuned"},
{"m": 10, "n": 4, "k": 8, "tile_m": 1, "tile_n": 2, "threads": 96, "grouping": 8, "minblocks": 19, "algorithm": "medium", "perf": 1271.4, "source": "autotuned"},
{"m": 10, "n": 4, "k": 9, "tile_m": 1, "tile_n": 2, "threads": 96, "grouping": 9, "minblocks": 16, "algorithm": "medium", "perf": 1349.33, "source": "autotuned"},
{"m": 10, "n": 4, "k": 10, "tile_m": 1, "tile_n": 2, "threads": 128, "grouping": 8, "minblocks": 15, "algorithm": "medium", "perf": 1342.27, "source": "autotuned"},
{"m": 10, "n": 4, "k": 13, "tile_m": 1, "tile_n": 2, "threads": 64, "grouping": 9, "minblocks": 18, "algorithm": "medium", "perf": 1529.89, "source": "autotuned"},
{"m": 10, "n": 4, "k": 15, "tile_m": 1, "tile_n": 2, "threads": 64, "grouping": 9, "minblocks": 20, "algorithm": "medium", "perf": 1676.27, "source": "autotuned"},
{"m": 10, "n": 4, "k": 22, "tile_m": 1, "tile_n": 2, "threads": 96, "grouping": 8, "minblocks": 16, "algorithm": "medium", "perf": 1925.9, "source": "autotuned"},
{"m": 10, "n": 4, "k": 26, "tile_m": 1, "tile_n": 2, "w": 12, "v": 4, "threads": 32, "grouping": 16, "minblocks": 4, "algorithm": "largeDB2", "perf": 2038.19, "source": "autotuned"},
{"m": 10, "n": 4, "k": 32, "tile_m": 1, "tile_n": 2, "w": 12, "v": 4, "threads": 32, "grouping": 16, "minblocks": 1, "algorithm": "largeDB2", "perf": 2184.15, "source": "autotuned"},
{"m": 10, "n": 4, "k": 45, "tile_m": 1, "tile_n": 2, "w": 22, "v": 4, "threads": 32, "grouping": 16, "minblocks": 1, "algorithm": "largeDB2", "perf": 2246.96, "source": "autotuned"},
{"m": 10, "n": 5, "k": 4, "tile_m": 1, "tile_n": 2, "threads": 64, "grouping": 9, "minblocks": 18, "algorithm": "medium", "perf": 1034.86, "source": "autotuned"},
{"m": 10, "n": 5, "k": 5, "tile_m": 1, "tile_n": 2, "threads": 64, "grouping": 9, "minblocks": 18, "algorithm": "medium", "perf": 1218.94, "source": "autotuned"},
{"m": 10, "n": 5, "k": 6, "tile_m": 1, "tile_n": 2, "threads": 64, "grouping": 9, "minblocks": 18, "algorithm": "medium", "perf": 1385.72, "source": "autotuned"},
{"m": 10, "n": 5, "k": 7, "tile_m": 1, "tile_n": 2, "threads": 96, "grouping": 13, "minblocks": 4, "algorithm": "medium", "perf": 1378.69, "source": "autotuned"},
{"m": 10, "n": 5, "k": 8, "tile_m": 1, "tile_n": 2, "threads": 96, "grouping": 8, "minblocks": 16, "algorithm": "medium", "perf": 1561.81, "source": "autotuned"},
{"m": 10, "n": 5, "k": 9, "tile_m": 1, "tile_n": 2, "threads": 96, "grouping": 8, "minblocks": 18, "algorithm": "medium", "perf": 1667.87, "source": "autotuned"},
{"m": 10, "n": 5, "k": 10, "tile_m": 1, "tile_n": 2, "threads": 128, "grouping": 8, "minblocks": 15, "algorithm": "medium", "perf": 1662.97, "source": "autotuned"},
{"m": 10, "n": 5, "k": 13, "tile_m": 1, "tile_n": 2, "threads": 96, "grouping": 8, "minblocks": 16, "algorithm": "medium", "perf": 1817.81, "source": "autotuned"},
{"m": 10, "n": 5, "k": 14, "tile_m": 1, "tile_n": 2, "threads": 96, "grouping": 8, "minblocks": 16, "algorithm": "medium", "perf": 1908.26, "source": "autotuned"},
{"m": 10, "n": 5, "k": 15, "tile_m": 1, "tile_n": 2, "threads": 96, "grouping": 8, "minblocks": 16, "algorithm": "medium", "perf": 1989.68, "source": "autotuned"},
{"m": 10, "n": 5, "k": 22, "tile_m": 1, "tile_n": 2, "threads": 32, "grouping": 8, "minblocks": 2, "algorithm": "medium", "perf": 2269.18, "source": "autotuned"},
{"m": 10, "n": 5, "k": 26, "tile_m": 1, "tile_n": 2, "w": 10, "v": 4, "threads": 32, "grouping": 16, "minblocks": 12, "algorithm": "largeDB2", "perf": 2415.12, "source": "autotuned"},
{"m": 10, "n": 5, "k": 32, "tile_m": 1, "tile_n": 2, "threads": 32, "grouping": 8, "minblocks": 9, "algorithm": "medium", "perf": 2565.49, "source": "autotuned"},
{"m": 10, "n": 5, "k": 45, "tile_m": 1, "tile_n": 2, "w": 18, "v": 4, "threads": 32, "grouping": 16, "minblocks": 1, "algorithm": "largeDB2", "perf": 2666.08, "source": "autotuned"},
{"m": 10, "n": 6, "k": 4, "tile_m": 1, "tile_n": 2, "threads": 64, "grouping": 9, "minblocks": 1, "algorithm": "medium", "perf": 1213.21, "source": "autotuned"},
{"m": 10, "n": 6, "k": 5, "tile_m": 1, "tile_n": 2, "threads": 64, "grouping": 9, "minblocks": 16, "algorithm": "medium", "perf": 1433.68, "source": "autotuned"},
{"m": 10, "n": 6, "k": 6, "tile_m": 1, "tile_n": 2, "threads": 64, "grouping": 9, "minblocks": 22, "algorithm": "medium", "perf": 1654.12, "source": "autotuned"},
{"m": 10, "n": 6, "k": 7, "tile_m": 1, "tile_n": 2, "threads": 96, "grouping": 8, "minblocks": 21, "algorithm": "medium", "perf": 1670.62, "source": "autotuned"},
{"m": 10, "n": 6, "k": 8, "tile_m": 1, "tile_n": 2, "threads": 96, "grouping": 9, "minblocks": 16, "algorithm": "medium", "perf": 1875.02, "source": "autotuned"},
{"m": 10, "n": 6, "k": 9, "tile_m": 1, "tile_n": 2, "threads": 96, "grouping": 9, "minblocks": 20, "algorithm": "medium", "perf": 1994.84, "source": "autotuned"},
{"m": 10, "n": 6, "k": 10, "tile_m": 1, "tile_n": 2, "threads": 128, "grouping": 9, "minblocks": 16, "algorithm": "medium", "perf": 1988.03, "source": "autotuned"},
{"m": 10, "n": 6, "k": 13, "tile_m": 1, "tile_n": 2, "threads": 96, "grouping": 8, "minblocks": 16, "algorithm": "medium", "perf": 2206.03, "source": "autotuned"},
{"m": 10, "n": 6, "k": 14, "tile_m": 1, "tile_n": 2, "threads": 96, "grouping": 8, "minblocks": 14, "algorithm": "medium", "perf": 2316.6, "source": "autotuned"},
{"m": 10, "n": 6, "k": 15, "tile_m": 1, "tile_n": 2, "threads": 96, "grouping": 8, "minblocks": 14, "algorithm": "medium", "perf": 2377.83, "source": "autotuned"},
{"m": 10, "n": 6, "k": 22, "tile_m": 1, "tile_n": 2, "threads": 32, "grouping": 8, "minblocks": 6, "algorithm": "medium", "perf": 2660.33, "source": "autotuned"},
{"m": 10, "n": 6, "k": 26, "tile_m": 1, "tile_n": 2, "w": 12, "v": 6, "threads": 32, "grouping": 16, "minblocks": 2, "algorithm": "largeDB2", "perf": 2895.82, "source": "autotuned"},
{"m": 10, "n": 6, "k": 32, "tile_m": 1, "tile_n": 2, "w": 14, "v": 6, "threads": 32, "grouping": 16, "minblocks": 2, "algorithm": "largeDB2", "perf": 3082.82, "source": "autotuned"},
{"m": 10, "n": 6, "k": 45, "tile_m": 1, "tile_n": 2, "threads": 32, "grouping": 8, "minblocks": 7, "algorithm": "medium", "perf": 3148.75, "source": "autotuned"},
{"m": 10, "n": 7, "k": 4, "tile_m": 1, "tile_n": 2, "threads": 64, "grouping": 9, "minblocks": 22, "algorithm": "medium", "perf": 1269.98, "source": "autotuned"},
{"m": 10, "n": 7, "k": 5, "tile_m": 1, "tile_n": 3, "threads": 64, "grouping": 9, "minblocks": 2, "algorithm": "medium", "perf": 1465.94, "source": "autotuned"},
{"m": 10, "n": 7, "k": 6, "tile_m": 1, "tile_n": 3, "threads": 64, "grouping": 9, "minblocks": 23, "algorithm": "medium", "perf": 1659.47, "source": "autotuned"},
{"m": 10, "n": 7, "k": 7, "tile_m": 1, "tile_n": 3, "threads": 96, "grouping": 11, "minblocks": 13, "algorithm": "medium", "perf": 1785.49, "source": "autotuned"},
{"m": 10, "n": 7, "k": 8, "tile_m": 1, "tile_n": 3, "threads": 96, "grouping": 8, "minblocks": 16, "algorithm": "medium", "perf": 1963.96, "source": "autotuned"},
{"m": 10, "n": 7, "k": 9, "tile_m": 1, "tile_n": 3, "threads": 96, "grouping": 8, "minblocks": 15, "algorithm": "medium", "perf": 2075.17, "source": "autotuned"},
{"m": 10, "n": 7, "k": 10, "tile_m": 1, "tile_n": 3, "threads": 128, "grouping": 11, "minblocks": 11, "algorithm": "medium", "perf": 2077.44, "source": "autotuned"},
{"m": 10, "n": 7, "k": 13, "tile_m": 1, "tile_n": 3, "threads": 32, "grouping": 7, "minblocks": 12, "algorithm": "medium", "perf": 2260.5, "source": "autotuned"},
{"m": 10, "n": 7, "k": 15, "tile_m": 1, "tile_n": 3, "threads": 32, "grouping": 7, "minblocks": 26, "algorithm": "medium", "perf": 2414.55, "source": "autotuned"},
{"m": 10, "n": 7, "k": 22, "tile_m": 1, "tile_n": 3, "threads": 32, "grouping": 8, "minblocks": 12, "algorithm": "medium", "perf": 2727.72, "source": "autotuned"},
{"m": 10, "n": 7, "k": 26, "tile_m": 1, "tile_n": 3, "threads": 32, "grouping": 8, "minblocks": 10, "algorithm": "medium", "perf": 2851.32, "source": "autotuned"},
{"m": 10, "n": 7, "k": 32, "tile_m": 1, "tile_n": 3, "threads": 32, "grouping": 8, "minblocks": 9, "algorithm": "medium", "perf": 3032.89, "source": "autotuned"},
{"m": 10, "n": 7, "k": 45, "tile_m": 1, "tile_n": 3, "threads": 32, "grouping": 8, "minblocks": 8, "algorithm": "medium", "perf": 3121.85, "source": "autotuned"},
{"m": 10, "n": 8, "k": 4, "tile_m": 1, "tile_n": 2, "threads": 64, "grouping": 9, "minblocks": 3, "algorithm": "medium", "perf": 1477.21, "source": "autotuned"},
{"m": 10, "n": 8, "k": 5, "tile_m": 1, "tile_n": 2, "threads": 64, "grouping": 9, "minblocks": 21, "algorithm": "medium", "perf": 1712.06, "source": "autotuned"},
{"m": 10, "n": 8, "k": 6, "tile_m": 1, "tile_n": 4, "threads": 64, "grouping": 8, "minblocks": 17, "algorithm": "medium", "perf": 1964.42, "source": "autotuned"},
{"m": 10, "n": 8, "k": 7, "tile_m": 1, "tile_n": 3, "threads": 96, "grouping": 11, "minblocks": 13, "algorithm": "medium", "perf": 2040.37, "source": "autotuned"},
{"m": 10, "n": 8, "k": 8, "tile_m": 1, "tile_n": 3, "threads": 96, "grouping": 8, "minblocks": 16, "algorithm": "medium", "perf": 2244.24, "source": "autotuned"},
{"m": 10, "n": 8, "k": 9, "tile_m": 1, "tile_n": 3, "threads": 96, "grouping": 8, "minblocks": 16, "algorithm": "medium", "perf": 2376.52, "source": "autotuned"},
{"m": 10, "n": 8, "k": 10, "tile_m": 1, "tile_n": 3, "threads": 128, "grouping": 11, "minblocks": 12, "algorithm": "medium", "perf": 2330.37, "source": "autotuned"},
{"m": 10, "n": 8, "k": 13, "tile_m": 1, "tile_n": 3, "threads": 160, "grouping": 16, "minblocks": 8, "algorithm": "medium", "perf": 2539.96, "source": "autotuned"},
{"m": 10, "n": 8, "k": 15, "tile_m": 1, "tile_n": 3, "threads": 160, "grouping": 16, "minblocks": 8, "algorithm": "medium", "perf": 2730.61, "source": "autotuned"},
{"m": 10, "n": 8, "k": 22, "tile_m": 1, "tile_n": 3, "threads": 32, "grouping": 8, "minblocks": 13, "algorithm": "medium", "perf": 3098.78, "source": "autotuned"},
{"m": 10, "n": 8, "k": 26, "tile_m": 1, "tile_n": 3, "threads": 32, "grouping": 8, "minblocks": 14, "algorithm": "medium", "perf": 3196.08, "source": "autotuned"},
{"m": 10, "n": 8, "k": 32, "tile_m": 1, "tile_n": 3, "threads": 32, "grouping": 8, "minblocks": 4, "algorithm": "medium", "perf": 3448.89, "source": "autotuned"},
{"m": 10, "n": 8, "k": 45, "tile_m": 1, "tile_n": 3, "w": 16, "v": 8, "threads": 32, "grouping": 16, "minblocks": 8, "algorithm": "largeDB2", "perf": 3388.76, "source": "autotuned"},
{"m": 10, "n": 9, "k": 4, "tile_m": 1, "tile_n": 3, "threads": 64, "grouping": 11, "minblocks": 14, "algorithm": "medium", "perf": 1634.69, "source": "autotuned"},
{"m": 10, "n": 9, "k": 5, "tile_m": 1, "tile_n": 3, "threads": 64, "grouping": 11, "minblocks": 14, "algorithm": "medium", "perf": 1901.41, "source": "autotuned"},
{"m": 10, "n": 9, "k": 6, "tile_m": 1, "tile_n": 3, "threads": 64, "grouping": 9, "minblocks": 23, "algorithm": "medium", "perf": 2119.03, "source": "autotuned"},
{"m": 10, "n": 9, "k": 7, "tile_m": 1, "tile_n": 3, "threads": 96, "grouping": 11, "minblocks": 14, "algorithm": "medium", "perf": 2337.25, "source": "autotuned"},
{"m": 10, "n": 9, "k": 8, "tile_m": 1, "tile_n": 3, "threads": 96, "grouping": 11, "minblocks": 14, "algorithm": "medium", "perf": 2543.38, "source": "autotuned"},
{"m": 10, "n": 9, "k": 9, "tile_m": 1, "tile_n": 3, "threads": 96, "grouping": 8, "minblocks": 15, "algorithm": "medium", "perf": 2632.97, "source": "autotuned"},
{"m": 10, "n": 9, "k": 10, "tile_m": 1, "tile_n": 3, "threads": 128, "grouping": 11, "minblocks": 12, "algorithm": "medium", "perf": 2625.9, "source": "autotuned"},
{"m": 10, "n": 9, "k": 13, "tile_m": 1, "tile_n": 3, "threads": 160, "grouping": 16, "minblocks": 8, "algorithm": "medium", "perf": 2808.65, "source": "autotuned"},
{"m": 10, "n": 9, "k": 14, "tile_m": 1, "tile_n": 3, "threads": 160, "grouping": 16, "minblocks": 8, "algorithm": "medium", "perf": 2980.44, "source": "autotuned"},
{"m": 10, "n": 9, "k": 15, "tile_m": 1, "tile_n": 3, "threads": 160, "grouping": 16, "minblocks": 8, "algorithm": "medium", "perf": 3057.56, "source": "autotuned"},
{"m": 10, "n": 9, "k": 22, "tile_m": 1, "tile_n": 3, "threads": 32, "grouping": 8, "minblocks": 19, "algorithm": "medium", "perf": 3341.88, "source": "autotuned"},
{"m": 10, "n": 9, "k": 26, "tile_m": 1, "tile_n": 3, "threads": 32, "grouping": 8, "minblocks": 8, "algorithm": "medium", "perf": 3497.81, "source": "autotuned"},
{"m": 10, "n": 9, "k": 32, "tile_m": 1, "tile_n": 3, "threads": 32, "grouping": 8, "minblocks": 8, "algorithm": "medium", "perf": 3759.74, "source": "autotuned"},
{"m": 10, "n": 9, "k": 45, "tile_m": 1, "tile_n": 3, "threads": 32, "grouping": 11, "minblocks": 7, "algorithm": "medium", "perf": 3678.51, "source": "autotuned"},
{"m": 10, "n": 10, "k": 4, "tile_m": 1, "tile_n": 4, "threads": 64, "grouping": 9, "minblocks": 19, "algorithm": "medium", "perf": 1776.3, "source": "autotuned"},
{"m": 10, "n": 10, "k": 5, "tile_m": 1, "tile_n": 4, "threads": 64, "grouping": 8, "minblocks": 24, "algorithm": "medium", "perf": 2034.15, "source": "autotuned"},
{"m": 10, "n": 10, "k": 6, "tile_m": 1, "tile_n": 4, "threads": 64, "grouping": 8, "minblocks": 19, "algorithm": "medium", "perf": 2299.57, "source": "autotuned"},
{"m": 10, "n": 10, "k": 7, "tile_m": 1, "tile_n": 4, "threads": 96, "grouping": 8, "minblocks": 15, "algorithm": "medium", "perf": 2430.32, "source": "autotuned"},
{"m": 10, "n": 10, "k": 8, "tile_m": 1, "tile_n": 4, "threads": 96, "grouping": 9, "minblocks": 15, "algorithm": "medium", "perf": 2632.98, "source": "autotuned"},
{"m": 10, "n": 10, "k": 9, "tile_m": 1, "tile_n": 4, "threads": 96, "grouping": 9, "minblocks": 14, "algorithm": "medium", "perf": 2807.31, "source": "autotuned"},
{"m": 10, "n": 10, "k": 10, "tile_m": 1, "tile_n": 4, "threads": 128, "grouping": 8, "minblocks": 15, "algorithm": "medium", "perf": 2786.39, "source": "autotuned"},
{"m": 10, "n": 10, "k": 13, "tile_m": 1, "tile_n": 4, "threads": 32, "grouping": 8, "minblocks": 23, "algorithm": "medium", "perf": 3064.59, "source": "autotuned"},
{"m": 10, "n": 10, "k": 14, "tile_m": 1, "tile_n": 4, "threads": 32, "grouping": 8, "minblocks": 21, "algorithm": "medium", "perf": 3175.6, "source": "autotuned"},
{"m": 10, "n": 10, "k": 15, "tile_m": 1, "tile_n": 4, "threads": 32, "grouping": 8, "minblocks": 22, "algorithm": "medium", "perf": 3255.7, "source": "autotuned"},
{"m": 10, "n": 10, "k": 22, "tile_m": 1, "tile_n": 4, "threads": 32, "grouping": 8, "minblocks": 6, "algorithm": "medium", "perf": 3602.96, "source": "autotuned"},
{"m": 10, "n": 10, "k": 26, "tile_m": 1, "tile_n": 4, "threads": 32, "grouping": 8, "minblocks": 6, "algorithm": "medium", "perf": 3897.81, "source": "autotuned"},
{"m": 10, "n": 10, "k": 32, "tile_m": 1, "tile_n": 4, "threads": 32, "grouping": 8, "minblocks": 6, "algorithm": "medium", "perf": 4117.92, "source": "autotuned"},
{"m": 10, "n": 10, "k": 45, "tile_m": 1, "tile_n": 4, "threads": 32, "grouping": 4, "minblocks": 2, "algorithm": "medium", "perf": 4123.43, "source": "autotuned"},
{"m": 10, "n": 12, "k": 10, "tile_m": 1, "tile_n": 4, "threads": 128, "grouping": 8, "minblocks": 15, "algorithm": "medium", "perf": 3297.73, "source": "autotuned"},
{"m": 10, "n": 13, "k": 4, "tile_m": 6, "tile_n": 1, "threads": 64, "grouping": 9, "minblocks": 15, "algorithm": "medium", "perf": 2061.41, "source": "autotuned"},
{"m": 10, "n": 13, "k": 5, "tile_m": 5, "tile_n": 1, "threads": 96, "grouping": 8, "minblocks": 15, "algorithm": "medium", "perf": 2332.24, "source": "autotuned"},
{"m": 10, "n": 13, "k": 6, "tile_m": 5, "tile_n": 1, "threads": 96, "grouping": 8, "minblocks": 16, "algorithm": "medium", "perf": 2666.93, "source": "autotuned"},
{"m": 10, "n": 13, "k": 7, "tile_m": 5, "tile_n": 1, "threads": 96, "grouping": 11, "minblocks": 13, "algorithm": "medium", "perf": 2948.84, "source": "autotuned"},
{"m": 10, "n": 13, "k": 8, "tile_m": 5, "tile_n": 1, "threads": 128, "grouping": 11, "minblocks": 11, "algorithm": "medium", "perf": 2965.3, "source": "autotuned"},
{"m": 10, "n": 13, "k": 9, "tile_m": 5, "tile_n": 1, "threads": 128, "grouping": 11, "minblocks": 11, "algorithm": "medium", "perf": 3155.47, "source": "autotuned"},
{"m": 10, "n": 13, "k": 10, "tile_m": 5, "tile_n": 1, "threads": 160, "grouping": 16, "minblocks": 8, "algorithm": "medium", "perf": 3082.34, "source": "autotuned"},
{"m": 10, "n": 13, "k": 13, "tile_m": 5, "tile_n": 1, "threads": 32, "grouping": 7, "minblocks": 26, "algorithm": "medium", "perf": 3463.18, "source": "autotuned"},
{"m": 10, "n": 13, "k": 14, "tile_m": 5, "tile_n": 1, "threads": 32, "grouping": 8, "minblocks": 24, "algorithm": "medium", "perf": 3623.02, "source": "autotuned"},
{"m": 10, "n": 13, "k": 15, "tile_m": 5, "tile_n": 1, "threads": 32, "grouping": 8, "minblocks": 22, "algorithm": "medium", "perf": 3636.93, "source": "autotuned"},
{"m": 10, "n": 13, "k": 22, "tile_m": 5, "tile_n": 1, "threads": 32, "grouping": 8, "minblocks": 15, "algorithm": "medium", "perf": 4094.3, "source": "autotuned"},
{"m": 10, "n": 13, "k": 26, "tile_m": 5, "tile_n": 1, "w": 12, "v": 8, "threads": 32, "grouping": 16, "minblocks": 4, "algorithm": "largeDB2", "perf": 4228.08, "source": "autotuned"},
{"m": 10, "n": 13, "k": 32, "tile_m": 5, "tile_n": 1, "w": 12, "v": 8, "threads": 32, "grouping": 16, "minblocks": 8, "algorithm": "largeDB2", "perf": 4369.58, "source": "autotuned"},
{"m": 10, "n": 13, "k": 45, "tile_m": 5, "tile_n": 1, "w": 18, "v": 8, "threads": 32, "grouping": 16, "minblocks": 8, "algorithm": "largeDB2", "perf": 4657.86, "source": "autotuned"},
{"m": 10, "n": 14, "k": 5, "tile_m": 5, "tile_n": 1, "threads": 96, "grouping": 11, "minblocks": 13, "algorithm": "medium", "perf": 2524.65, "source": "autotuned"},
{"m": 10, "n": 14, "k": 6, "tile_m": 5, "tile_n": 1, "threads": 96, "grouping": 11, "minblocks": 13, "algorithm": "medium", "perf": 2848.35, "source": "autotuned"},
{"m": 10, "n": 14, "k": 9, "tile_m": 5, "tile_n": 1, "threads": 128, "grouping": 11, "minblocks": 11, "algorithm": "medium", "perf": 3358.06, "source": "autotuned"},
{"m": 10, "n": 14, "k": 10, "tile_m": 5, "tile_n": 1, "threads": 160, "grouping": 16, "minblocks": 8, "algorithm": "medium", "perf": 3329.42, "source": "autotuned"},
{"m": 10, "n": 14, "k": 13, "tile_m": 5, "tile_n": 1, "threads": 32, "grouping": 8, "minblocks": 17, "algorithm": "medium", "perf": 3706.62, "source": "autotuned"},
{"m": 10, "n": 14, "k": 14, "tile_m": 5, "tile_n": 1, "threads": 32, "grouping": 8, "minblocks": 23, "algorithm": "medium", "perf": 3828.08, "source": "autotuned"},
{"m": 10, "n": 15, "k": 4, "tile_m": 6, "tile_n": 1, "threads": 64, "grouping": 9, "minblocks": 15, "algorithm": "medium", "perf": 2358.76, "source": "autotuned"},
{"m": 10, "n": 15, "k": 5, "tile_m": 5, "tile_n": 1, "threads": 96, "grouping": 11, "minblocks": 11, "algorithm": "medium", "perf": 2690.22, "source": "autotuned"},
{"m": 10, "n": 15, "k": 6, "tile_m": 5, "tile_n": 1, "threads": 96, "grouping": 11, "minblocks": 11, "algorithm": "medium", "perf": 3056.58, "source": "autotuned"},
{"m": 10, "n": 15, "k": 7, "tile_m": 5, "tile_n": 1, "threads": 128, "grouping": 11, "minblocks": 12, "algorithm": "medium", "perf": 3021.34, "source": "autotuned"},
{"m": 10, "n": 15, "k": 8, "tile_m": 5, "tile_n": 1, "threads": 128, "grouping": 11, "minblocks": 12, "algorithm": "medium", "perf": 3384.2, "source": "autotuned"},
{"m": 10, "n": 15, "k": 9, "tile_m": 5, "tile_n": 1, "threads": 32, "grouping": 6, "minblocks": 27, "algorithm": "medium", "perf": 3352.77, "source": "autotuned"},
{"m": 10, "n": 15, "k": 10, "tile_m": 5, "tile_n": 1, "threads": 160, "grouping": 16, "minblocks": 8, "algorithm": "medium", "perf": 3545.11, "source": "autotuned"},
{"m": 10, "n": 15, "k": 13, "tile_m": 5, "tile_n": 1, "threads": 32, "grouping": 8, "minblocks": 17, "algorithm": "medium", "perf": 3894.73, "source": "autotuned"},
{"m": 10, "n": 15, "k": 15, "tile_m": 5, "tile_n": 1, "threads": 32, "grouping": 8, "minblocks": 21, "algorithm": "medium", "perf": 4098.15, "source": "autotuned"},
{"m": 10, "n": 22, "k": 4, "tile_m": 1, "tile_n": 8, "threads": 96, "grouping": 12, "minblocks": 12, "algorithm": "medium", "perf": 2948.29, "source": "autotuned"},
{"m": 10, "n": 22, "k": 5, "tile_m": 1, "tile_n": 8, "threads": 128, "grouping": 13, "minblocks": 10, "algorithm": "medium", "perf": 3105.13, "source": "autotuned"},
{"m": 10, "n": 22, "k": 6, "tile_m": 5, "tile_n": 2, "threads": 32, "grouping": 5, "minblocks": 26, "algorithm": "medium", "perf": 2790.26, "source": "autotuned"},
{"m": 10, "n": 22, "k": 7, "tile_m": 5, "tile_n": 2, "threads": 32, "grouping": 5, "minblocks": 26, "algorithm": "medium", "perf": 3576.28, "source": "autotuned"},
{"m": 10, "n": 22, "k": 8, "tile_m": 5, "tile_n": 2, "threads": 32, "grouping": 8, "minblocks": 13, "algorithm": "medium", "perf": 3872.99, "source": "autotuned"},
{"m": 10, "n": 22, "k": 9, "tile_m": 5, "tile_n": 2, "threads": 32, "grouping": 8, "minblocks": 8, "algorithm": "medium", "perf": 4137.78, "source": "autotuned"},
{"m": 10, "n": 22, "k": 10, "tile_m": 5, "tile_n": 2, "threads": 32, "grouping": 8, "minblocks": 14, "algorithm": "medium", "perf": 4394.34, "source": "autotuned"},
{"m": 10, "n": 22, "k": 13, "tile_m": 5, "tile_n": 2, "threads": 32, "grouping": 8, "minblocks": 14, "algorithm": "medium", "perf": 4921.97, "source": "autotuned"},
{"m": 10, "n": 22, "k": 22, "tile_m": 5, "tile_n": 2, "w": 8, "v": 22, "threads": 32, "grouping": 16, "minblocks": 1, "algorithm": "largeDB2", "perf": 5198.47, "source": "autotuned"},
{"m": 10, "n": 22, "k": 32, "tile_m": 5, "tile_n": 2, "w": 12, "v": 22, "threads": 32, "grouping": 16, "minblocks": 4, "algorithm": "largeDB2", "perf": 5805.61, "source": "autotuned"},
{"m": 10, "n": 26, "k": 4, "tile_m": 5, "tile_n": 2, "threads": 128, "grouping": 16, "minblocks": 8, "algorithm": "medium", "perf": 3049.32, "source": "autotuned"},
{"m": 10, "n": 26, "k": 5, "tile_m": 5, "tile_n": 1, "threads": 64, "grouping": 9, "minblocks": 19, "algorithm": "medium", "perf": 3265.53, "source": "autotuned"},
{"m": 10, "n": 26, "k": 6, "tile_m": 5, "tile_n": 2, "threads": 32, "grouping": 5, "minblocks": 27, "algorithm": "medium", "perf": 3686.92, "source": "autotuned"},
{"m": 10, "n": 26, "k": 7, "tile_m": 5, "tile_n": 2, "threads": 32, "grouping": 8, "minblocks": 9, "algorithm": "medium", "perf": 4039.72, "source": "autotuned"},
{"m": 10, "n": 26, "k": 8, "tile_m": 5, "tile_n": 2, "threads": 32, "grouping": 8, "minblocks": 16, "algorithm": "medium", "perf": 4403.49, "source": "autotuned"},
{"m": 10, "n": 26, "k": 9, "tile_m": 5, "tile_n": 2, "threads": 32, "grouping": 8, "minblocks": 9, "algorithm": "medium", "perf": 4726.84, "source": "autotuned"},
{"m": 10, "n": 26, "k": 10, "tile_m": 5, "tile_n": 2, "threads": 32, "grouping": 8, "minblocks": 16, "algorithm": "medium", "perf": 4961.02, "source": "autotuned"},
{"m": 10, "n": 26, "k": 13, "tile_m": 5, "tile_n": 2, "w": 6, "v": 26, "threads": 32, "grouping": 16, "minblocks": 8, "algorithm": "largeDB2", "perf": 5545.75, "source": "autotuned"},
{"m": 10, "n": 26, "k": 26, "tile_m": 5, "tile_n": 2, "w": 12, "v": 26, "threads": 32, "grouping": 16, "minblocks": 1, "algorithm": "largeDB2", "perf": 5959.56, "source": "autotuned"},
{"m": 10, "n": 26, "k": 45, "tile_m": 5, "tile_n": 2, "w": 16, "v": 26, "threads": 32, "grouping": 16, "minblocks": 4, "algorithm": "largeDB2", "perf": 6848.25, "source": "autotuned"},
{"m": 10, "n": 32, "k": 4, "tile_m": 5, "tile_n": 1, "threads": 64, "grouping": 9, "minblocks": 15, "algorithm": "medium", "perf": 3558.86, "source": "autotuned"},
{"m": 10, "n": 32, "k": 5, "tile_m": 5, "tile_n": 1, "threads": 64, "grouping": 9, "minblocks": 20, "algorithm": "medium", "perf": 3999.82, "source": "autotuned"},
{"m": 10, "n": 32, "k": 6, "tile_m": 5, "tile_n": 2, "threads": 96, "grouping": 11, "minblocks": 12, "algorithm": "medium", "perf": 4435.57, "source": "autotuned"},
{"m": 10, "n": 32, "k": 7, "tile_m": 5, "tile_n": 2, "threads": 32, "grouping": 8, "minblocks": 6, "algorithm": "medium", "perf": 4751.27, "source": "autotuned"},
{"m": 10, "n": 32, "k": 8, "tile_m": 5, "tile_n": 2, "threads": 32, "grouping": 8, "minblocks": 14, "algorithm": "medium", "perf": 5285.45, "source": "autotuned"},
{"m": 10, "n": 32, "k": 9, "tile_m": 5, "tile_n": 2, "w": 4, "v": 32, "threads": 32, "grouping": 16, "minblocks": 8, "algorithm": "largeDB2", "perf": 5840.65, "source": "autotuned"},
{"m": 10, "n": 32, "k": 10, "tile_m": 5, "tile_n": 2, "w": 4, "v": 32, "threads": 32, "grouping": 16, "minblocks": 2, "algorithm": "largeDB2", "perf": 6175.56, "source": "autotuned"},
{"m": 10, "n": 32, "k": 13, "tile_m": 5, "tile_n": 2, "threads": 32, "grouping": 8, "minblocks": 14, "algorithm": "medium", "perf": 6349.9, "source": "autotuned"},
{"m": 10, "n": 32, "k": 22, "tile_m": 5, "tile_n": 2, "threads": 32, "grouping": 11, "minblocks": 8, "algorithm": "medium", "perf": 6751.87, "source": "autotuned"},
{"m": 10, "n": 32, "k": 32, "tile_m": 5, "tile_n": 2, "w": 12, "v": 32, "threads": 32, "grouping": 16, "minblocks": 12, "algorithm": "largeDB2", "perf": 7287.08, "source": "autotuned"},
{"m": 10, "n": 45, "k": 4, "tile_m": 5, "tile_n": 2, "threads": 64, "grouping": 9, "minblocks": 13, "algorithm": "medium", "perf": 4118.71, "source": "autotuned"},
{"m": 10, "n": 45, "k": 5, "tile_m": 6, "tile_n": 2, "threads": 64, "grouping": 9, "minblocks": 14, "algorithm": "medium", "perf": 4557.92, "source": "autotuned"},
{"m": 10, "n": 45, "k": 6, "tile_m": 5, "tile_n": 3, "threads": 32, "grouping": 8, "minblocks": 13, "algorithm": "medium", "perf": 4978.51, "source": "autotuned"},
{"m": 10, "n": 45, "k": 7, "tile_m": 5, "tile_n": 3, "threads": 32, "grouping": 8, "minblocks": 16, "algorithm": "medium", "perf": 5451.53, "source": "autotuned"},
{"m": 10, "n": 45, "k": 8, "tile_m": 5, "tile_n": 3, "threads": 32, "grouping": 8, "minblocks": 14, "algorithm": "medium", "perf": 5890.61, "source": "autotuned"},
{"m": 10, "n": 45, "k": 9, "tile_m": 5, "tile_n": 3, "threads": 32, "grouping": 8, "minblocks": 15, "algorithm": "medium", "perf": 6052.69, "source": "autotuned"},
{"m": 10, "n": 45, "k": 10, "tile_m": 5, "tile_n": 3, "w": 4, "v": 44, "threads": 32, "grouping": 16, "minblocks": 8, "algorithm": "largeDB2", "perf": 6061.14, "source": "autotuned"},
{"m": 10, "n": 45, "k": 13, "tile_m": 5, "tile_n": 3, "threads": 32, "grouping": 11, "minblocks": 4, "algorithm": "medium", "perf": 6741.74, "source": "autotuned"},
{"m": 10, "n": 45, "k": 26, "tile_m": 5, "tile_n": 3, "w": 12, "v": 28, "threads": 32, "grouping": 16, "minblocks": 8, "algorithm": "largeDB2", "perf": 7510.37, "source": "autotuned"},
{"m": 10, "n": 45, "k": 45, "tile_m": 5, "tile_n": 3, "w": 16, "v": 36, "threads": 32, "grouping": 16, "minblocks": 8, "algorithm": "largeDB2", "perf": 7935.36, "source": "autotuned"},
{"m": 11, "n": 11, "k": 11, "tile_m": 2, "tile_n": 3, "threads": 96, "grouping": 8, "minblocks": 15, "algorithm": "small", "perf": 3228.11, "source": "autotuned"},
{"m": 12, "n": 12, "k": 12, "tile_m": 2, "tile_n": 3, "threads": 32, "grouping": 8, "minblocks": 18, "algorithm": "medium", "perf": 4041.34, "source": "autotuned"},
{"m": 13, "n": 4, "k": 4, "tile_m": 1, "tile_n": 2, "threads": 64, "grouping": 9, "minblocks": 11, "algorithm": "medium", "perf": 968.195, "source": "autotuned"},
{"m": 13, "n": 4, "k": 5, "tile_m": 1, "tile_n": 2, "threads": 96, "grouping": 8, "minblocks": 20, "algorithm": "medium", "perf": 1056.79, "source": "autotuned"},
{"m": 13, "n": 4, "k": 6, "tile_m": 1, "tile_n": 4, "threads": 96, "grouping": 12, "minblocks": 11, "algorithm": "medium", "perf": 1238.85, "source": "autotuned"},
{"m": 13, "n": 4, "k": 7, "tile_m": 1, "tile_n": 4, "threads": 32, "grouping": 5, "minblocks": 27, "algorithm": "medium", "perf": 1392.09, "source": "autotuned"},
{"m": 13, "n": 4, "k": 8, "tile_m": 1, "tile_n": 4, "threads": 128, "grouping": 8, "minblocks": 13, "algorithm": "medium", "perf": 1386.02, "source": "autotuned"},
{"m": 13, "n": 4, "k": 9, "tile_m": 1, "tile_n": 4, "threads": 128, "grouping": 13, "minblocks": 10, "algorithm": "medium", "perf": 1467.37, "source": "autotuned"},
{"m": 13, "n": 4, "k": 10, "tile_m": 1, "tile_n": 4, "threads": 32, "grouping": 5, "minblocks": 26, "algorithm": "medium", "perf": 1506.26, "source": "autotuned"},
{"m": 13, "n": 4, "k": 13, "tile_m": 1, "tile_n": 4, "threads": 32, "grouping": 5, "minblocks": 27, "algorithm": "medium", "perf": 1742.06, "source": "autotuned"},
{"m": 13, "n": 4, "k": 15, "tile_m": 1, "tile_n": 4, "threads": 32, "grouping": 5, "minblocks": 25, "algorithm": "medium", "perf": 1795.21, "source": "autotuned"},
{"m": 13, "n": 4, "k": 16, "tile_m": 1, "tile_n": 4, "threads": 32, "grouping": 8, "minblocks": 14, "algorithm": "medium", "perf": 1856.34, "source": "autotuned"},
{"m": 13, "n": 4, "k": 22, "tile_m": 1, "tile_n": 4, "threads": 32, "grouping": 8, "minblocks": 17, "algorithm": "medium", "perf": 2164.47, "source": "autotuned"},
{"m": 13, "n": 4, "k": 23, "tile_m": 1, "tile_n": 4, "w": 8, "v": 4, "threads": 32, "grouping": 16, "minblocks": 12, "algorithm": "largeDB2", "perf": 2174.83, "source": "autotuned"},
{"m": 13, "n": 4, "k": 25, "tile_m": 1, "tile_n": 4, "w": 12, "v": 4, "threads": 32, "grouping": 16, "minblocks": 12, "algorithm": "largeDB2", "perf": 2219.97, "source": "autotuned"},
{"m": 13, "n": 4, "k": 26, "tile_m": 1, "tile_n": 4, "w": 10, "v": 4, "threads": 32, "grouping": 16, "minblocks": 12, "algorithm": "largeDB2", "perf": 2245.31, "source": "autotuned"},
{"m": 13, "n": 4, "k": 32, "tile_m": 1, "tile_n": 4, "w": 14, "v": 4, "threads": 32, "grouping": 16, "minblocks": 8, "algorithm": "largeDB2", "perf": 2410.35, "source": "autotuned"},
{"m": 13, "n": 4, "k": 45, "tile_m": 1, "tile_n": 4, "w": 18, "v": 4, "threads": 32, "grouping": 16, "minblocks": 1, "algorithm": "largeDB2", "perf": 2430.67, "source": "autotuned"},
{"m": 13, "n": 5, "k": 4, "tile_m": 2, "tile_n": 2, "threads": 64, "grouping": 9, "minblocks": 7, "algorithm": "medium", "perf": 1091.92, "source": "autotuned"},
{"m": 13, "n": 5, "k": 5, "tile_m": 2, "tile_n": 2, "threads": 96, "grouping": 8, "minblocks": 16, "algorithm": "medium", "perf": 1238.85, "source": "autotuned"},
{"m": 13, "n": 5, "k": 6, "tile_m": 1, "tile_n": 5, "threads": 32, "grouping": 6, "minblocks": 27, "algorithm": "medium", "perf": 1428.04, "source": "autotuned"},
{"m": 13, "n": 5, "k": 7, "tile_m": 2, "tile_n": 2, "threads": 96, "grouping": 8, "minblocks": 16, "algorithm": "medium", "perf": 1528.27, "source": "autotuned"},
{"m": 13, "n": 5, "k": 8, "tile_m": 2, "tile_n": 2, "threads": 128, "grouping": 8, "minblocks": 16, "algorithm": "medium", "perf": 1542.56, "source": "autotuned"},
{"m": 13, "n": 5, "k": 9, "tile_m": 2, "tile_n": 2, "threads": 128, "grouping": 8, "minblocks": 14, "algorithm": "medium", "perf": 1637.64, "source": "autotuned"},
{"m": 13, "n": 5, "k": 10, "tile_m": 1, "tile_n": 5, "threads": 32, "grouping": 5, "minblocks": 27, "algorithm": "medium", "perf": 1662.7, "source": "autotuned"},
{"m": 13, "n": 5, "k": 13, "tile_m": 2, "tile_n": 2, "threads": 96, "grouping": 8, "minblocks": 16, "algorithm": "medium", "perf": 1857.14, "source": "autotuned"},
{"m": 13, "n": 5, "k": 14, "tile_m": 1, "tile_n": 5, "threads": 32, "grouping": 8, "minblocks": 7, "algorithm": "medium", "perf": 1930.14, "source": "autotuned"},
{"m": 13, "n": 5, "k": 15, "tile_m": 1, "tile_n": 5, "threads": 32, "grouping": 8, "minblocks": 15, "algorithm": "medium", "perf": 1949.63, "source": "autotuned"},
{"m": 13, "n": 5, "k": 16, "tile_m": 1, "tile_n": 5, "threads": 32, "grouping": 8, "minblocks": 10, "algorithm": "medium", "perf": 2031.88, "source": "autotuned"},
{"m": 13, "n": 5, "k": 22, "tile_m": 1, "tile_n": 5, "threads": 32, "grouping": 8, "minblocks": 19, "algorithm": "medium", "perf": 2282.32, "source": "autotuned"},
{"m": 13, "n": 5, "k": 23, "tile_m": 1, "tile_n": 5, "threads": 32, "grouping": 8, "minblocks": 10, "algorithm": "medium", "perf": 2307.37, "source": "autotuned"},
{"m": 13, "n": 5, "k": 25, "tile_m": 1, "tile_n": 5, "threads": 32, "grouping": 8, "minblocks": 15, "algorithm": "medium", "perf": 2358.74, "source": "autotuned"},
{"m": 13, "n": 5, "k": 26, "tile_m": 1, "tile_n": 5, "threads": 32, "grouping": 8, "minblocks": 17, "algorithm": "medium", "perf": 2314.43, "source": "autotuned"},
{"m": 13, "n": 5, "k": 32, "tile_m": 1, "tile_n": 5, "threads": 32, "grouping": 8, "minblocks": 13, "algorithm": "medium", "perf": 2410.48, "source": "autotuned"},
{"m": 13, "n": 5, "k": 45, "tile_m": 2, "tile_n": 2, "w": 18, "v": 4, "threads": 32, "grouping": 16, "minblocks": 12, "algorithm": "largeDB2", "perf": 2464.97, "source": "autotuned"},
{"m": 13, "n": 6, "k": 4, "tile_m": 2, "tile_n": 2, "threads": 64, "grouping": 9, "minblocks": 8, "algorithm": "medium", "perf": 1328.36, "source": "autotuned"},
{"m": 13, "n": 6, "k": 5, "tile_m": 1, "tile_n": 6, "threads": 96, "grouping": 12, "minblocks": 11, "algorithm": "medium", "perf": 1447.74, "source": "autotuned"},
{"m": 13, "n": 6, "k": 6, "tile_m": 2, "tile_n": 2, "threads": 96, "grouping": 8, "minblocks": 14, "algorithm": "medium", "perf": 1688.89, "source": "autotuned"},
{"m": 13, "n": 6, "k": 7, "tile_m": 1, "tile_n": 6, "threads": 96, "grouping": 16, "minblocks": 7, "algorithm": "medium", "perf": 1773.28, "source": "autotuned"},
{"m": 13, "n": 6, "k": 8, "tile_m": 1, "tile_n": 6, "threads": 128, "grouping": 8, "minblocks": 16, "algorithm": "medium", "perf": 1845.37, "source": "autotuned"},
{"m": 13, "n": 6, "k": 9, "tile_m": 1, "tile_n": 6, "threads": 32, "grouping": 4, "minblocks": 31, "algorithm": "small", "perf": 1927.31, "source": "autotuned"},
{"m": 13, "n": 6, "k": 10, "tile_m": 1, "tile_n": 6, "threads": 32, "grouping": 5, "minblocks": 25, "algorithm": "medium", "perf": 2016.46, "source": "autotuned"},
{"m": 13, "n": 6, "k": 13, "tile_m": 1, "tile_n": 6, "threads": 32, "grouping": 5, "minblocks": 25, "algorithm": "medium", "perf": 2184.07, "source": "autotuned"},
{"m": 13, "n": 6, "k": 14, "tile_m": 1, "tile_n": 6, "threads": 32, "grouping": 5, "minblocks": 26, "algorithm": "medium", "perf": 2286.1, "source": "autotuned"},
{"m": 13, "n": 6, "k": 15, "tile_m": 1, "tile_n": 6, "threads": 32, "grouping": 5, "minblocks": 26, "algorithm": "medium", "perf": 2306.14, "source": "autotuned"},
{"m": 13, "n": 6, "k": 22, "tile_m": 1, "tile_n": 6, "threads": 32, "grouping": 8, "minblocks": 13, "algorithm": "medium", "perf": 2663.66, "source": "autotuned"},
{"m": 13, "n": 6, "k": 26, "tile_m": 2, "tile_n": 2, "w": 12, "v": 6, "threads": 32, "grouping": 16, "minblocks": 8, "algorithm": "largeDB2", "perf": 2790.42, "source": "autotuned"},
{"m": 13, "n": 6, "k": 32, "tile_m": 1, "tile_n": 6, "w": 12, "v": 6, "threads": 32, "grouping": 16, "minblocks": 8, "algorithm": "largeDB2", "perf": 2867.88, "source": "autotuned"},
{"m": 13, "n": 6, "k": 45, "tile_m": 2, "tile_n": 2, "w": 16, "v": 6, "threads": 32, "grouping": 16, "minblocks": 1, "algorithm": "largeDB2", "perf": 2949.68, "source": "autotuned"},
{"m": 13, "n": 7, "k": 4, "tile_m": 2, "tile_n": 2, "threads": 64, "grouping": 8, "minblocks": 21, "algorithm": "medium", "perf": 1504.42, "source": "autotuned"},
{"m": 13, "n": 7, "k": 5, "tile_m": 2, "tile_n": 2, "threads": 96, "grouping": 9, "minblocks": 15, "algorithm": "medium", "perf": 1648.18, "source": "autotuned"},
{"m": 13, "n": 7, "k": 6, "tile_m": 2, "tile_n": 2, "threads": 96, "grouping": 9, "minblocks": 16, "algorithm": "medium", "perf": 1860.02, "source": "autotuned"},
{"m": 13, "n": 7, "k": 7, "tile_m": 2, "tile_n": 2, "threads": 96, "grouping": 9, "minblocks": 16, "algorithm": "medium", "perf": 2012.1, "source": "autotuned"},
{"m": 13, "n": 7, "k": 8, "tile_m": 2, "tile_n": 2, "threads": 128, "grouping": 9, "minblocks": 16, "algorithm": "medium", "perf": 2030.15, "source": "autotuned"},
{"m": 13, "n": 7, "k": 9, "tile_m": 2, "tile_n": 2, "threads": 128, "grouping": 9, "minblocks": 15, "algorithm": "medium", "perf": 2177.33, "source": "autotuned"},
{"m": 13, "n": 7, "k": 10, "tile_m": 2, "tile_n": 2, "threads": 32, "grouping": 7, "minblocks": 27, "algorithm": "medium", "perf": 2154.72, "source": "autotuned"},
{"m": 13, "n": 7, "k": 13, "tile_m": 2, "tile_n": 2, "threads": 96, "grouping": 8, "minblocks": 15, "algorithm": "medium", "perf": 2502.9, "source": "autotuned"},
{"m": 13, "n": 7, "k": 15, "tile_m": 2, "tile_n": 2, "threads": 32, "grouping": 8, "minblocks": 24, "algorithm": "medium", "perf": 2471.11, "source": "autotuned"},
{"m": 13, "n": 7, "k": 22, "tile_m": 8, "tile_n": 1, "threads": 32, "grouping": 8, "minblocks": 16, "algorithm": "medium", "perf": 2845.99, "source": "autotuned"},
{"m": 13, "n": 7, "k": 26, "tile_m": 2, "tile_n": 2, "w": 12, "v": 6, "threads": 32, "grouping": 16, "minblocks": 8, "algorithm": "largeDB2", "perf": 2944.44, "source": "autotuned"},
{"m": 13, "n": 7, "k": 32, "tile_m": 2, "tile_n": 2, "w": 14, "v": 6, "threads": 32, "grouping": 16, "minblocks": 8, "algorithm": "largeDB2", "perf": 3027.97, "source": "autotuned"},
{"m": 13, "n": 7, "k": 45, "tile_m": 2, "tile_n": 2, "w": 16, "v": 6, "threads": 32, "grouping": 16, "minblocks": 12, "algorithm": "largeDB2", "perf": 3200.22, "source": "autotuned"},
{"m": 13, "n": 8, "k": 4, "tile_m": 2, "tile_n": 2, "threads": 64, "grouping": 9, "minblocks": 19, "algorithm": "medium", "perf": 1709.89, "source": "autotuned"},
{"m": 13, "n": 8, "k": 5, "tile_m": 2, "tile_n": 2, "threads": 96, "grouping": 11, "minblocks": 14, "algorithm": "medium", "perf": 1870.53, "source": "autotuned"},
{"m": 13, "n": 8, "k": 6, "tile_m": 2, "tile_n": 2, "threads": 96, "grouping": 9, "minblocks": 15, "algorithm": "medium", "perf": 2075.81, "source": "autotuned"},
{"m": 13, "n": 8, "k": 7, "tile_m": 2, "tile_n": 2, "threads": 96, "grouping": 11, "minblocks": 15, "algorithm": "medium", "perf": 2279.9, "source": "autotuned"},
{"m": 13, "n": 8, "k": 8, "tile_m": 2, "tile_n": 2, "threads": 128, "grouping": 9, "minblocks": 16, "algorithm": "medium", "perf": 2306.71, "source": "autotuned"},
{"m": 13, "n": 8, "k": 9, "tile_m": 2, "tile_n": 2, "threads": 128, "grouping": 8, "minblocks": 13, "algorithm": "medium", "perf": 2431.93, "source": "autotuned"},
{"m": 13, "n": 8, "k": 10, "tile_m": 2, "tile_n": 2, "threads": 96, "grouping": 8, "minblocks": 14, "algorithm": "medium", "perf": 2434.46, "source": "autotuned"},
{"m": 13, "n": 8, "k": 13, "tile_m": 2, "tile_n": 2, "threads": 32, "grouping": 8, "minblocks": 23, "algorithm": "medium", "perf": 2660.5, "source": "autotuned"},
{"m": 13, "n": 8, "k": 15, "tile_m": 2, "tile_n": 2, "threads": 32, "grouping": 8, "minblocks": 24, "algorithm": "medium", "perf": 2790.95, "source": "autotuned"},
{"m": 13, "n": 8, "k": 22, "tile_m": 8, "tile_n": 1, "w": 8, "v": 8, "threads": 32, "grouping": 16, "minblocks": 12, "algorithm": "largeDB2", "perf": 3244.56, "source": "autotuned"},
{"m": 13, "n": 8, "k": 26, "tile_m": 8, "tile_n": 1, "w": 12, "v": 8, "threads": 32, "grouping": 16, "minblocks": 12, "algorithm": "largeDB2", "perf": 3419.53, "source": "autotuned"},
{"m": 13, "n": 8, "k": 32, "tile_m": 8, "tile_n": 1, "w": 12, "v": 8, "threads": 32, "grouping": 16, "minblocks": 2, "algorithm": "largeDB2", "perf": 3434.36, "source": "autotuned"},
{"m": 13, "n": 8, "k": 45, "tile_m": 2, "tile_n": 2, "w": 18, "v": 6, "threads": 32, "grouping": 16, "minblocks": 2, "algorithm": "largeDB2", "perf": 3579.1, "source": "autotuned"},
{"m": 13, "n": 9, "k": 4, "tile_m": 3, "tile_n": 2, "threads": 64, "grouping": 9, "minblocks": 15, "algorithm": "medium", "perf": 1735.11, "source": "autotuned"},
{"m": 13, "n": 9, "k": 5, "tile_m": 7, "tile_n": 1, "threads": 96, "grouping": 11, "minblocks": 13, "algorithm": "medium", "perf": 1952.78, "source": "autotuned"},
{"m": 13, "n": 9, "k": 6, "tile_m": 7, "tile_n": 1, "threads": 96, "grouping": 11, "minblocks": 13, "algorithm": "medium", "perf": 2195.24, "source": "autotuned"},
{"m": 13, "n": 9, "k": 7, "tile_m": 4, "tile_n": 2, "threads": 96, "grouping": 8, "minblocks": 16, "algorithm": "medium", "perf": 2391.76, "source": "autotuned"},
{"m": 13, "n": 9, "k": 8, "tile_m": 2, "tile_n": 3, "threads": 128, "grouping": 13, "minblocks": 10, "algorithm": "medium", "perf": 2352.04, "source": "autotuned"},
{"m": 13, "n": 9, "k": 9, "tile_m": 4, "tile_n": 2, "threads": 128, "grouping": 16, "minblocks": 8, "algorithm": "medium", "perf": 2487.47, "source": "autotuned"},
{"m": 13, "n": 9, "k": 10, "tile_m": 7, "tile_n": 1, "threads": 32, "grouping": 8, "minblocks": 20, "algorithm": "medium", "perf": 2517.46, "source": "autotuned"},
{"m": 13, "n": 9, "k": 13, "tile_m": 7, "tile_n": 1, "threads": 32, "grouping": 8, "minblocks": 22, "algorithm": "medium", "perf": 2809.09, "source": "autotuned"},
{"m": 13, "n": 9, "k": 14, "tile_m": 7, "tile_n": 1, "threads": 32, "grouping": 8, "minblocks": 24, "algorithm": "medium", "perf": 2951.51, "source": "autotuned"},
{"m": 13, "n": 9, "k": 15, "tile_m": 7, "tile_n": 1, "threads": 32, "grouping": 8, "minblocks": 19, "algorithm": "medium", "perf": 2899.68, "source": "autotuned"},
{"m": 13, "n": 9, "k": 16, "tile_m": 7, "tile_n": 1, "threads": 32, "grouping": 8, "minblocks": 17, "algorithm": "medium", "perf": 3022.74, "source": "autotuned"},
{"m": 13, "n": 9, "k": 22, "tile_m": 7, "tile_n": 1, "threads": 32, "grouping": 8, "minblocks": 13, "algorithm": "medium", "perf": 3271.67, "source": "autotuned"},
{"m": 13, "n": 9, "k": 23, "tile_m": 7, "tile_n": 1, "threads": 32, "grouping": 8, "minblocks": 13, "algorithm": "medium", "perf": 3305.91, "source": "autotuned"},
{"m": 13, "n": 9, "k": 25, "tile_m": 7, "tile_n": 1, "w": 12, "v": 8, "threads": 32, "grouping": 16, "minblocks": 12, "algorithm": "largeDB2", "perf": 3377.68, "source": "autotuned"},
{"m": 13, "n": 9, "k": 26, "tile_m": 7, "tile_n": 1, "w": 12, "v": 8, "threads": 32, "grouping": 16, "minblocks": 1, "algorithm": "largeDB2", "perf": 3411.38, "source": "autotuned"},
{"m": 13, "n": 9, "k": 32, "tile_m": 7, "tile_n": 1, "w": 12, "v": 8, "threads": 32, "grouping": 16, "minblocks": 12, "algorithm": "largeDB2", "perf": 3473.11, "source": "autotuned"},
{"m": 13, "n": 9, "k": 45, "tile_m": 7, "tile_n": 1, "w": 18, "v": 8, "threads": 32, "grouping": 16, "minblocks": 12, "algorithm": "largeDB2", "perf": 3628.0, "source": "autotuned"},
{"m": 13, "n": 10, "k": 4, "tile_m": 3, "tile_n": 2, "threads": 64, "grouping": 8, "minblocks": 24, "algorithm": "medium", "perf": 1923.86, "source": "autotuned"},
{"m": 13, "n": 10, "k": 5, "tile_m": 7, "tile_n": 1, "threads": 96, "grouping": 11, "minblocks": 11, "algorithm": "medium", "perf": 2126.68, "source": "autotuned"},
{"m": 13, "n": 10, "k": 6, "tile_m": 7, "tile_n": 1, "threads": 96, "grouping": 11, "minblocks": 12, "algorithm": "medium", "perf": 2381.06, "source": "autotuned"},
{"m": 13, "n": 10, "k": 7, "tile_m": 7, "tile_n": 1, "threads": 96, "grouping": 11, "minblocks": 12, "algorithm": "medium", "perf": 2639.68, "source": "autotuned"},
{"m": 13, "n": 10, "k": 8, "tile_m": 4, "tile_n": 2, "threads": 128, "grouping": 16, "minblocks": 8, "algorithm": "medium", "perf": 2607.33, "source": "autotuned"},
{"m": 13, "n": 10, "k": 9, "tile_m": 7, "tile_n": 1, "threads": 128, "grouping": 16, "minblocks": 8, "algorithm": "medium", "perf": 2768.79, "source": "autotuned"},
{"m": 13, "n": 10, "k": 10, "tile_m": 7, "tile_n": 1, "threads": 32, "grouping": 7, "minblocks": 23, "algorithm": "medium", "perf": 2791.24, "source": "autotuned"},
{"m": 13, "n": 10, "k": 13, "tile_m": 7, "tile_n": 1, "threads": 32, "grouping": 8, "minblocks": 16, "algorithm": "medium", "perf": 3074.49, "source": "autotuned"},
{"m": 13, "n": 10, "k": 14, "tile_m": 7, "tile_n": 1, "threads": 32, "grouping": 8, "minblocks": 20, "algorithm": "medium", "perf": 3165.29, "source": "autotuned"},
{"m": 13, "n": 10, "k": 15, "tile_m": 7, "tile_n": 1, "threads": 32, "grouping": 8, "minblocks": 22, "algorithm": "medium", "perf": 3201.22, "source": "autotuned"},
{"m": 13, "n": 10, "k": 22, "tile_m": 7, "tile_n": 1, "w": 10, "v": 10, "threads": 32, "grouping": 16, "minblocks": 4, "algorithm": "largeDB2", "perf": 3638.66, "source": "autotuned"},
{"m": 13, "n": 10, "k": 26, "tile_m": 7, "tile_n": 1, "w": 12, "v": 10, "threads": 32, "grouping": 16, "minblocks": 8, "algorithm": "largeDB2", "perf": 3803.21, "source": "autotuned"},
{"m": 13, "n": 10, "k": 32, "tile_m": 7, "tile_n": 1, "w": 12, "v": 10, "threads": 32, "grouping": 16, "minblocks": 8, "algorithm": "largeDB2", "perf": 3915.9, "source": "autotuned"},
{"m": 13, "n": 10, "k": 45, "tile_m": 7, "tile_n": 1, "w": 18, "v": 10, "threads": 32, "grouping": 16, "minblocks": 4, "algorithm": "largeDB2", "perf": 4132.65, "source": "autotuned"},
{"m": 13, "n": 13, "k": 4, "tile_m": 7, "tile_n": 1, "threads": 96, "grouping": 11, "minblocks": 11, "algorithm": "medium", "perf": 2423.21, "source": "autotuned"},
{"m": 13, "n": 13, "k": 5, "tile_m": 7, "tile_n": 1, "threads": 96, "grouping": 11, "minblocks": 12, "algorithm": "medium", "perf": 2686.42, "source": "autotuned"},
{"m": 13, "n": 13, "k": 6, "tile_m": 7, "tile_n": 1, "threads": 96, "grouping": 11, "minblocks": 13, "algorithm": "medium", "perf": 3101.89, "source": "autotuned"},
{"m": 13, "n": 13, "k": 7, "tile_m": 7, "tile_n": 1, "threads": 96, "grouping": 11, "minblocks": 13, "algorithm": "medium", "perf": 3338.14, "source": "autotuned"},
{"m": 13, "n": 13, "k": 8, "tile_m": 8, "tile_n": 1, "threads": 32, "grouping": 8, "minblocks": 24, "algorithm": "medium", "perf": 3361.45, "source": "autotuned"},
{"m": 13, "n": 13, "k": 9, "tile_m": 7, "tile_n": 1, "threads": 32, "grouping": 8, "minblocks": 15, "algorithm": "medium", "perf": 3524.99, "source": "autotuned"},
{"m": 13, "n": 13, "k": 10, "tile_m": 7, "tile_n": 1, "threads": 32, "grouping": 8, "minblocks": 23, "algorithm": "medium", "perf": 3715.45, "source": "autotuned"},
{"m": 13, "n": 13, "k": 13, "tile_m": 7, "tile_n": 1, "threads": 32, "grouping": 8, "minblocks": 23, "algorithm": "medium", "perf": 4011.84, "source": "autotuned"},
{"m": 13, "n": 13, "k": 14, "tile_m": 7, "tile_n": 1, "threads": 32, "grouping": 8, "minblocks": 15, "algorithm": "medium", "perf": 4118.93, "source": "autotuned"},
{"m": 13, "n": 13, "k": 15, "tile_m": 7, "tile_n": 1, "threads": 32, "grouping": 11, "minblocks": 17, "algorithm": "medium", "perf": 4103.22, "source": "autotuned"},
{"m": 13, "n": 13, "k": 16, "tile_m": 8, "tile_n": 1, "threads": 32, "grouping": 8, "minblocks": 19, "algorithm": "medium", "perf": 4264.64, "source": "autotuned"},
{"m": 13, "n": 13, "k": 17, "tile_m": 8, "tile_n": 1, "threads": 32, "grouping": 8, "minblocks": 18, "algorithm": "medium", "perf": 4297.42, "source": "autotuned"},
